District,Block,School_ID,School_Name,School_Growth_Tag,Block_Cluster_Type,Is_Outlier,Outlier_Type
HARDOI,TONDARPUR,9251001111,RAJKIYA HSS SIROMAN NAGAR,Recovery,Recovery Cluster,No,Normal
HATHRAS,HASAYAN,9130310904,GOV HIGH SCHOOL AMOUSI,Recovery,Recovery Cluster,No,Normal
HATHRAS,HASAYAN,9130321101,GOV HIGH SCHOOL GANGAPUR,Recovery,Recovery Cluster,No,Normal
HATHRAS,HASAYAN,9130307505,GOVERMENT  HIGH SCHOOL  BASTOI,Recovery,Recovery Cluster,No,Normal
HATHRAS,HATHRAS,9130113503,GOV HIGH SCHOOL BAGHANA,Recovery,Mixed Block,No,Normal
HATHRAS,HATHRAS,9130107603,GOV HIGH SCHOOL KOKA,Recovery,Mixed Block,No,Normal
HATHRAS,MURSAN,9130400703,GOV. HIGH SCHOOL BAMOLI,Consistent Growth,Mixed Block,No,Normal
HATHRAS,MURSAN,9130405102,PT Deen Dyal Upadhyay rajkiye model inter college tuksan,Consistent Growth,Mixed Block,No,Normal
HATHRAS,N.P. HATHRAS,9130800710,Govt. Girls Inter College,Consistent Growth,Isolated Growth,No,Normal
HATHRAS,SADABAD,9130609707,GOV HIGH SCHOOL MITHAVALI,Consistent Growth,Mixed Block,No,Normal
HATHRAS,SADABAD,9130602312,Govement Gigh School Bedai,Recovery,Mixed Block,No,Normal
HATHRAS,SADABAD,9130601607,Goverment high School mai,Recovery,Mixed Block,No,Normal
HATHRAS,SADABAD,9130610805,PT DEEN DAYAL RAJKIYE MODEL INTER COLLEGE SINSTA,Consistent Growth,Mixed Block,No,Normal
HATHRAS,SADABAD,9130600106,"RAJKIYA H.S. SCHOOL, AROTHA",Stable,Mixed Block,No,Normal
HATHRAS,SAHPAU,9130704403,GOV HIGH SCHOOL RASGAVAN,Volatile,Mixed Block,No,Normal
HATHRAS,SAHPAU,9130704207,GOV HIGH SCHOOL UGHENA,Volatile,Mixed Block,No,Normal
HATHRAS,SAHPAU,9130701914,GOVERNMENT INTER COLLEGE GUTHERA ,Consistent Growth,Mixed Block,No,Normal
HATHRAS,SAHPAU,9130700120,"RAJKIYA HIGH SCHOOL, MADHA PITHU",Recovery,Mixed Block,No,Normal
HATHRAS,SASNI,9130203603,GOV HIGH SCHOOL DARKOLI,Stable,Mixed Block,No,Normal
HATHRAS,SASNI,9130210605,GOV HIGH SCHOOL SAHAJPURA,Peaked,Mixed Block,No,Normal
HATHRAS,SASNI,9130200138,RAJKIY H.H.S MUHARIYA,Recovery,Mixed Block,No,Normal
HATHRAS,SIKANDRA RAO,9130500137,GOV HIGH SCHOIOL ARNAUT,Stable,Mixed Block,No,Normal
HATHRAS,SIKANDRA RAO,9130504604,GOV HIGH SCHOOL PACHAYTA,Peaked,Mixed Block,No,Normal
HATHRAS,SIKANDRA RAO,9130505108,PT Deen Dyal Upadhyay rajkiye model inter college wazeedpur,Peaked,Mixed Block,No,Normal
JALAUN,DAKOR,9350104105,GOVT. HSS AIR,Volatile,Mixed Block,No,Normal
JALAUN,DAKOR,9350101205,GOVT. HSS KHARKA,Recovery,Mixed Block,No,Normal
JALAUN,DAKOR,9350101606,GOVT. HSS MOHANA,Stable,Mixed Block,No,Normal
JALAUN,DAKOR,9350102006,GOVT. I.C. DAKOR,Peaked,Mixed Block,No,Normal
JALAUN,DAKOR,9350100606,GOVT. I.C. SAIDNAGAR,Recovery,Mixed Block,No,Normal
JALAUN,DAKOR,9350102306,PT DIN DAYAL UPDHAYAY GOVT MODEL I.C. KHAROOSA,Consistent Growth,Mixed Block,No,Normal
JALAUN,JALAUN,9350204603,GOVT. HSS KASIPURA,Recovery,Mixed Block,No,Normal
JALAUN,KADAURA,9350301408,GOVT. HSS CHHAUNK,Consistent Decline,Mixed Block,No,Normal
JALAUN,KADAURA,9350307506,GOVT. HSS MARGAYAN,Volatile,Mixed Block,No,Normal
JALAUN,KADAURA,9350315603,GOVT. MUMTAJ I.C. KADAURA,Stable,Mixed Block,No,Normal
JALAUN,KADAURA,9350313301,"PT. DEENDAYAL UPADHYAY GOVT. MODEL INTER COLLEGE, PIPRAYAN KADAURA",Volatile,Mixed Block,No,Normal
JALAUN,KONCH,9350400703,GOVT. HSS JAMROHI KHURD,Recovery,Mixed Block,No,Normal
JALAUN,KUTHAUND,9350509207,GOVT. HSS AJEETAPUR,Recovery,Mixed Block,No,Normal
JALAUN,KUTHAUND,9350509806,GOVT. HSS ENTON,Recovery,Mixed Block,No,Normal
JALAUN,MADHAUGADH,9350600507,GOVT. GIRLS I.C. GOHAN,Peaked,Mixed Block,No,Normal
JALAUN,MAHEVA,9350701410,GOVT. GIRLS I.C. BABAI,Consistent Decline,Mixed Block,No,Normal
JALAUN,MAHEVA,9350708703,GOVT. HSS ABHAIDEPUR,Recovery,Mixed Block,No,Normal
JALAUN,MAHEVA,9350707209,GOVT. HSS DAMRAS,Peaked,Mixed Block,No,Normal
JALAUN,MAHEVA,9350707103,GOVT. HSS SARSELA,Volatile,Mixed Block,No,Normal
JALAUN,MAHEVA,9350705204,GOVT. I.C. MUSMARIYA,Peaked,Mixed Block,No,Normal
JALAUN,MAHEVA,9350704006,"PT. DEENDAYAL UPADHYAY GOVT. MODEL INTER COLLEGE, CHURKHI",Recovery,Mixed Block,No,Normal
JALAUN,NADIGAWN,9350807303,GOVT. HSS LAGAMPURA,Recovery,Mixed Block,No,Normal
JALAUN,NADIGAWN,9350810503,GOVT. I.C. BANGRA,Consistent Growth,Mixed Block,No,Normal
JALAUN,RAMPURA,9350901003,GOVT. GIRLS I.C. JAGAMMANPUR,Consistent Growth,Mixed Block,No,Normal
JALAUN,RAMPURA,9350901903,GOVT. HSS BALIKA VIDHALAYA SIDDHAPURA,Recovery,Mixed Block,No,Normal
JALAUN,RAMPURA,9350904204,GOVT. HSS NARAUL,Consistent Growth,Mixed Block,No,Normal
JALAUN,T. A. ORAI,9351302306,GOVT. GIRLS I.C. ORAI,Recovery,Mixed Block,No,Normal
JALAUN,T. A. ORAI,9351302305,GOVT. I.C. ORAI,Volatile,Mixed Block,No,Normal
JAUNPUR,BADLA PUR,9641605304,GOVT. H.S. BADLAPUR KHURD,Recovery,Mixed Block,No,Normal
JAUNPUR,BADLA PUR,9641603920,GOVT.H.S. TIYARA,Recovery,Mixed Block,No,Normal
JAUNPUR,BARSATHI,9641122501,GOVT. H.S.. BABURI GAWAN,Recovery,Mixed Block,No,Normal
JAUNPUR,BUKSHA,9640606703,GOVT. H.S SCHOOL MAINUDDINPUR,Recovery,Mixed Block,No,Normal
JAUNPUR,DHARMAPUR,9640303803,GOVT. H.S. UTTARGAWAN,Recovery,Mixed Block,No,Normal
JAUNPUR,DOBHI,9641701703,GOVT. H.S. BALRAMPUR,Recovery,Mixed Block,No,Normal
JAUNPUR,JALALPUR,9640501008,GOVT. H.S. MAI,Volatile,Mixed Block,No,Normal
JAUNPUR,JAUNPUR  [NAGAR],9642200728,G.G.I.COLLEGE,Consistent Growth,Isolated Growth,No,Normal
JAUNPUR,KARANJA KALA,9640406208,GOVT. H.S. AARA,Consistent Decline,Mixed Block,No,Normal
JAUNPUR,KARANJA KALA,9640407106,GOVT.H.S. BHAKURA,Recovery,Mixed Block,No,Normal
JAUNPUR,KERAKAT,9641300121,GOVT. H.S CHAKRA RAIT NARHAN,Recovery,Mixed Block,No,Normal
JAUNPUR,KERAKAT,9641305704,GOVERNMENT INTER COLLEGE PACHWAR KERAKAT JAUNPUR,Consistent Growth,Mixed Block,No,Normal
JAUNPUR,KHUTHAN,9641801612,GOVT. H.S. DIHIYA,Recovery,Mixed Block,No,Normal
JAUNPUR,MACHHALI SHAHAR,9641217214,GOVT. GIRLS INTER COLLEGE MACHHALI SHAHAR,Consistent Growth,Mixed Block,No,Normal
JAUNPUR,MACHHALI SHAHAR,9641217216,GOVT.H S SHRI NAITGANJ,Recovery,Mixed Block,No,Normal
JAUNPUR,MADIYAHUN,9642112502,"G.G.I.C. MARIYAHUN, JAUNPUR",Consistent Growth,Mixed Block,No,Normal
JAUNPUR,MADIYAHUN,9642110703,GOVT. H.S. UGAPUR,Peaked,Mixed Block,No,Normal
JAUNPUR,MAHARAJ GANJ,9641008902,GOVT. H.S. HARAI PUR,Recovery,Mixed Block,No,Normal
JAUNPUR,MUFTI GANJ,9640902605,GOVT. H.S. PASEVA,Recovery,Mixed Block,No,Normal
JAUNPUR,MUGRA BADSHAH PUR,9641503610,GOVT. H.S. TARAHTI,Recovery,Mixed Block,No,Normal
JAUNPUR,MUGRA BADSHAH PUR,9641502503,GOVT.H.S. KACHHEEDEEH JAUNPUR,Peaked,Mixed Block,No,Normal
JAUNPUR,RAM PUR,9641910701,GOVT. H.S. KASERU,Volatile,Mixed Block,No,Normal
JAUNPUR,SHAH GANJ,9640807103,GIC MAWAI SONDHI SHAHGANJ JAUNPUR,Consistent Growth,Mixed Block,No,Normal
JAUNPUR,SHAH GANJ,9640803203,GOVT. H.S. NEVADA,Volatile,Mixed Block,No,Normal
JAUNPUR,SHAH GANJ,9640806103,GOVT.U.M SCHOOL PORAI KALA JAUNPUR,Recovery,Mixed Block,No,Normal
JAUNPUR,SIKRARA,9640205204,GOVT H.S SCHOOL RAMNAGAR,Recovery,Mixed Block,No,Normal
JAUNPUR,SIKRARA,9640203505,GOVT. H.S. SIKANDRA,Recovery,Mixed Block,No,Normal
JAUNPUR,SIRKONI,9640120505,G.G.I.C.,Consistent Growth,Mixed Block,No,Normal
JAUNPUR,SIRKONI,9640113804,GOVT. H.S. PARIYAWAN,Recovery,Mixed Block,No,Normal
JAUNPUR,SIRKONI,9640123704,GOVT. HIGH SCHOOL SURHURPUR,Volatile,Mixed Block,No,Normal
JAUNPUR,SUITHA KALA,9642006006,GOVT. H.S. SARAI MOHUDDINPUR,Recovery,Mixed Block,No,Normal
JAUNPUR,SUITHA KALA,9642001008,GOVT. H.S. SEWAYAN,Recovery,Mixed Block,No,Normal
JAUNPUR,SUJAN GANJ,9641409103,GOVT.H.S. SARAI KHAANI,Volatile,Mixed Block,No,Normal
JHANSI,BABINA,9360103006,GOVT. HIGH COLLEGE SARVA BABINA,Recovery,Recovery Cluster,No,Normal
JHANSI,BABINA,9360104505,GOVT. HIGH SCHOOL -KHAJRAHA BUJURG,Recovery,Recovery Cluster,No,Normal
JHANSI,BABINA,9360101605,GOVT. HIGH SCHOOL LAHAR THAKURPURA,Recovery,Recovery Cluster,No,Normal
JHANSI,BABINA,9360105903,GOVT. HIGH SCHOOL PATHARI,Recovery,Recovery Cluster,No,Normal
JHANSI,BABINA,9360100904,GOVT.HIGH SCHOOL BUDPURA,Recovery,Recovery Cluster,No,Normal
JHANSI,BABINA,9360102005,RAJKIYA BALIKA INTER COLL.-RASOI,Consistent Decline,Recovery Cluster,No,Normal
JHANSI,BABINA,9360106216,RAJKIYA INTER COLLEGE-RAKSHA,Consistent Decline,Recovery Cluster,No,Normal
JHANSI,BAMORE,9360207306,ABHINAV VIDAHAYALA KURAITHA ,Consistent Decline,Mixed Block,No,Normal
JHANSI,BAMORE,9360207503,GOVT. HIGH SCHOOL-AHARAURA,Recovery,Mixed Block,No,Normal
JHANSI,BAMORE,9360204706,GOVT.HIGH SCHOOL- KARGUA KHURD,Volatile,Mixed Block,No,Normal
JHANSI,BANGRA,9360308307,GOVT. HIGH SCHOOL-MAGARPUR,Recovery,Mixed Block,No,Normal
JHANSI,BANGRA,9360305533,RAJKIYA GIRLS INTER COLLEGE-RANIPUR,Consistent Decline,Mixed Block,No,Normal
JHANSI,BANGRA,9360306909,RAJKIYA INTER COLLEGE-KATERA,Stable,Mixed Block,No,Normal
JHANSI,BANGRA,9360307009,RAJKIYA INTER COLLEGE-SAKRAR,Stable,Mixed Block,No,Normal
JHANSI,BANGRA,9360305306,RAJKIYE HIGH SCHOOL BAMHORI SAUHAGI,Stable,Mixed Block,No,Normal
JHANSI,BARAGAON,9360405410,GOVT HIGH SCHOOL BHOJLA,Consistent Decline,Mixed Block,No,Normal
JHANSI,BARAGAON,9360405908,GOVT. GIRLS  HIGH SCHOOL. AMBA BAI,Stable,Mixed Block,No,Normal
JHANSI,BARAGAON,9360413201,RAJKIYA BALIKA INTER COLLEGE-BARUASAGAR,Volatile,Mixed Block,No,Normal
JHANSI,BARAGAON,9360407203,RAJKIYE HIGH SCHOOL MAVAI GIRD,Recovery,Mixed Block,No,Normal
JHANSI,CHIRGAON,9360503004,GOVT HIGH SCHOOL- BAKUAN BUJURG,Recovery,Mixed Block,No,Normal
JHANSI,CHIRGAON,9360507706,GOVT. HIGH SCHOOL  DHAMNA KHURD,Recovery,Mixed Block,No,Normal
JHANSI,CHIRGAON,9360501145,PT DEEN DAYAL UPADDHYAY GOVT MODEL INTER COLLEGE PIPRA BLOCK CHIRGAON JHANSI,Stable,Mixed Block,No,Normal
JHANSI,GURSARAI,9360604803,GOVT. HIGH SCHOOL BIJAURA,Volatile,Mixed Block,No,Normal
JHANSI,GURSARAI,9360608318,RAJKIYA BALIKA INTER COLLEGE - GURSARAI,Consistent Decline,Mixed Block,No,Normal
JHANSI,GURSARAI,9360600903,RAJKIYE INTER COLLEGE KHADOURA,Recovery,Mixed Block,No,Normal
JHANSI,JHANSI NAGARCHETRA,9361103861,RAJKIYA INTER COLL-GWALIOR ROAD,Recovery,Mixed Block,No,Normal
JHANSI,JHANSI NAGARCHETRA,9361104514,SURAJ PRASAD INTER COLL_RAJKIYE BALIKA .-7,Volatile,Mixed Block,No,Normal
JHANSI,MAURANIPUR,9360803803,GOVT HIGH SCHOOL- CHAKARA,Recovery,Mixed Block,No,Normal
JHANSI,MAURANIPUR,9360805103,GOVT. GIRLS INTER COLLGE VEERA,Recovery,Mixed Block,No,Normal
JHANSI,MAURANIPUR,9360808306,RAJIKIYE HIGH SCHOOL REVAN,Consistent Decline,Mixed Block,No,Normal
JHANSI,MAURANIPUR  N.CHETRA,9361001009,RAJKIYA KANYA INTER COLLEGE MAURANIPUR NAGAR,Recovery,Mixed Block,No,Normal
JHANSI,MOTH,9360702506,GOVT. HIGH SCHOOL SAKIN,Recovery,Mixed Block,No,Normal
JHANSI,MOTH,9360708404,PT DEEN DAYAL UPADDHYAY GOVT MODEL INTER COLLEGE KUMHRAR MOTH JHANSI,Peaked,Mixed Block,No,Normal
JHANSI,MOTH,9360714414,RAJKIYA INTER COLLEGE-SAMTHAR,Volatile,Mixed Block,No,Normal
JHANSI,MOTH,9360700604,RAJKIYA INTER COLLEGE-SHAJHAPUR,Volatile,Mixed Block,No,Normal
JYOTIBA PHULE NAGAR (AMROHA),AMROHA,9061812309,GOVT. INTER COLLEGE MITTHE PUR KALAN,Peaked,Mixed Block,No,Normal
JYOTIBA PHULE NAGAR (AMROHA),AMROHA,9061802809,PANDIT DEEN DAYAL UPADHYAY RAJIKYA INTER COLLEGE GAJSTHAL,Peaked,Mixed Block,No,Normal
JYOTIBA PHULE NAGAR (AMROHA),AMROHA,9061809103,RAJKIYA HIGH SCHOOL HASANPUR KATIA,Volatile,Mixed Block,No,Normal
JYOTIBA PHULE NAGAR (AMROHA),AMROHA CITY,9062202551,RAJKIYA BOYS INTER COLLEGE,Consistent Growth,Isolated Decline,No,Normal
JYOTIBA PHULE NAGAR (AMROHA),AMROHA CITY,9062202552,RAJKIYA GIRLS INTER COLLEGE,Consistent Decline,Isolated Decline,No,Normal
JYOTIBA PHULE NAGAR (AMROHA),DHANORA,9061910413,GOVT HIGH SCHOOL PATTI KHADAR,Recovery,Mixed Block,No,Normal
JYOTIBA PHULE NAGAR (AMROHA),DHANORA,9061908602,RAJKIYA H.S. CHANDRA,Consistent Growth,Mixed Block,No,Normal
JYOTIBA PHULE NAGAR (AMROHA),DHANORA,9061909008,RAJKIYA H.S. DYOTI,Consistent Decline,Mixed Block,No,Normal
JYOTIBA PHULE NAGAR (AMROHA),DHANORA,9061903730,RAJKIYA HIGH SCHOOL BACHRAU,Recovery,Mixed Block,No,Normal
JYOTIBA PHULE NAGAR (AMROHA),DHANORA,9061903723,RAJKIYA INDRAWATI GIRLS INTER,Peaked,Mixed Block,No,Normal
JYOTIBA PHULE NAGAR (AMROHA),GAJRAULA,9061701042,RAJKIYA BALIKA INTER COLLEGE,Recovery,Mixed Block,No,Normal
JYOTIBA PHULE NAGAR (AMROHA),GAJRAULA,9061708103,RAJKIYA H.S. KHUGAWALI,Volatile,Mixed Block,No,Normal
JYOTIBA PHULE NAGAR (AMROHA),GAJRAULA,9061708904,RAJKIYA H.S. YAKUBPUR,Consistent Growth,Mixed Block,No,Normal
JYOTIBA PHULE NAGAR (AMROHA),GAJRAULA,9064100759,RAJKIYE INTER COLLEGE PAPSARA,Consistent Growth,Mixed Block,No,Normal
JYOTIBA PHULE NAGAR (AMROHA),GANGESHWARI,9064100029,GOVT INTER COLLEGE BANSKA KALAN,Consistent Growth,Isolated Decline,No,Normal
JYOTIBA PHULE NAGAR (AMROHA),GANGESHWARI,9061615003,RAJKIYA H.S. DEHRI GUJAR,Consistent Growth,Isolated Decline,No,Normal
JYOTIBA PHULE NAGAR (AMROHA),GANGESHWARI,9061600706,RAJKIYA H.S. RAHRAI,Consistent Decline,Isolated Decline,No,Normal
JYOTIBA PHULE NAGAR (AMROHA),HASANPUR,9062406724,AMBADKAR Govt. INTER COLLEGE UJHARI,Volatile,Mixed Block,No,Normal
JYOTIBA PHULE NAGAR (AMROHA),HASANPUR,9062407908,RAJKIYA H.S. ALLIPUR KHADAR,Recovery,Mixed Block,No,Normal
JYOTIBA PHULE NAGAR (AMROHA),HASANPUR,9062401503,RAJKIYA H.S. JHUNDI MAFI,Recovery,Mixed Block,No,Normal
JYOTIBA PHULE NAGAR (AMROHA),HASANPUR,9064100090,GOVT. MODEL INTER COLLEGE GALSUA,Consistent Growth,Mixed Block,No,Normal
JYOTIBA PHULE NAGAR (AMROHA),HASANPUR,9064100084,RAJKIYA MODAL INTER COLLEGE TUGHLAKABAD,Consistent Decline,Mixed Block,No,Normal
JYOTIBA PHULE NAGAR (AMROHA),HASANPUR CITY,9062500230,RAJKIYA GIRLS INTER COLLEGE,Consistent Decline,Isolated Decline,No,Normal
JYOTIBA PHULE NAGAR (AMROHA),JOYA,9062123704,Govt Inter College Dhanora urf Murad Nagar,Consistent Growth,Mixed Block,No,Normal
JYOTIBA PHULE NAGAR (AMROHA),JOYA,9062108312,PT DEENDAYAL UPADHYAY GOVT MODEL INTER COLLEGE BUDHANPUR,Recovery,Mixed Block,No,Normal
KANNAUJ,CHHIBRAMAU,9300401103,RAJKIYA H.S.S BHOJPUR NIGHOH CHHIBRAMAU,Volatile,Mixed Block,No,Normal
KANNAUJ,CHHIBRAMAU,9300401603,RAJKIYA H.S.S. RAMKHDA CHHIBRAMAU,Consistent Growth,Mixed Block,No,Normal
KANNAUJ,CHHIBRAMAU,9300411109,SMT. RAMABAI GOVT. GIRLS INTER COLLEGE,Peaked,Mixed Block,No,Normal
KANNAUJ,GUGRAPUR,9300900103,RAJKIYA H.S.S GUGRAPUR,Recovery,Mixed Block,No,Normal
KANNAUJ,GUGRAPUR,9300900104,RAJKIYA H.S.S.BHANWARGARHA,Consistent Growth,Mixed Block,No,Normal
KANNAUJ,HASERAN,9300600110,RAJKIYA H.S.S. JOGNIPUR HASERAN,Recovery,Mixed Block,No,Normal
KANNAUJ,JALALABAD,9300701016,PT DEEN DAYAL UPADHYAY GOVT MODEL INTER COLLEGE FATEHPUR JASODA KANNAUJ,Volatile,Mixed Block,No,Normal
KANNAUJ,JALALABAD,9300704302,RAJKIYA H.S.S.BAISAWARI JALALABAD,Recovery,Mixed Block,No,Normal
KANNAUJ,KANNAUJ,9300101406, ABHINAV VIDYALAYA,Recovery,Mixed Block,No,Normal
KANNAUJ,KANNAUJ,9300102803,RAJKIYA H.S.S. MITRASENPUR KANNAUJ,Consistent Growth,Mixed Block,No,Normal
KANNAUJ,KANNAUJ,9300100204,RAJKIYA H.S.S. MURAIYA BUJURG KANNAUJ,Recovery,Mixed Block,No,Normal
KANNAUJ,SAURIKH,9300500109,RAJKIYA H.S.S HUSEPUR KARAN,Consistent Growth,Mixed Block,No,Normal
KANNAUJ,SAURIKH,9300500117,RAJKIYA H.S.S KISAI JAGDISPUR,Recovery,Mixed Block,No,Normal
KANNAUJ,TAL GRAM,9300301304,PT DEEN DAYAL UPADHYAY GOVT MODEL INTER COLLEGE VIRAULI TALGRAM KANNAUJ,Consistent Growth,Mixed Block,No,Normal
KANNAUJ,TAL GRAM,9300304208,RAJKIYA H.S.S UMAEPUR TALGRAM,Recovery,Mixed Block,No,Normal
KANNAUJ,TAL GRAM,9300308554,RAJKIYA INTER COLLEGE SAMDHAN,Recovery,Mixed Block,No,Normal
KANNAUJ,UMARDA,9300202008,GOVT. INTER COLLEGE,Volatile,Mixed Block,No,Normal
KANNAUJ,UMARDA,9300200106,RAJKIYA H.S.S DYODA UMARDA,Peaked,Mixed Block,No,Normal
KANNAUJ,UMARDA,9300200105,RAJKIYA H.S.S FULWARI UMARDA,Peaked,Mixed Block,No,Normal
KANPUR DEHAT,AKBARPUR,9330100126,GOVT.H.S.SCHOOL BARA,Recovery,Mixed Block,No,Normal
KANPUR DEHAT,AMARAUDHA,9330210405,GOVT.GIRLS INTER COLLEGE PUKHRAYAN,Volatile,Mixed Block,No,Normal
KANPUR DEHAT,AMARAUDHA,9330203303,GOVT.H.S.BARAULI,Volatile,Mixed Block,No,Normal
KANPUR DEHAT,AMARAUDHA,9330216106,GOVT.H.S.SCHOOL DEVRAHAT,Consistent Growth,Mixed Block,No,Normal
KANPUR DEHAT,DERAPUR,9330301703,GOVT. H.S. SCHOOL DILAULIY KD.,Consistent Growth,Isolated Growth,No,Normal
KANPUR DEHAT,JHINJHAK,9330401204,GOVT.H.S.SCHOOL BACHITPURVA K.D.,Consistent Growth,Mixed Block,No,Normal
KANPUR DEHAT,JHINJHAK,9330405910,GOVT.H.S.SCHOOL MANGALPUR K.D.,Recovery,Mixed Block,No,Normal
KANPUR DEHAT,JHINJHAK,9330403668,GOVT. INTER COLLEGE TIKKANGAON JHINJHAK KANPUR DEHAT,Consistent Growth,Mixed Block,No,Normal
KANPUR DEHAT,MAITHA,9330708404,GOVT.H.S.SCHOOL RAWATPUR CHAMPATPUR K.D.,Consistent Growth,Isolated Growth,No,Normal
KANPUR DEHAT,MALASA,9330608004,GOVT.H.S.S. PULANDER,Recovery,Mixed Block,No,Normal
KANPUR DEHAT,MALASA,9330607106,GOVT.H.S.SCHOOL MALASA,Volatile,Mixed Block,No,Normal
KANPUR DEHAT,RAJPUR,9330809203,GOVT.H.S.JAISALPUR,Volatile,Mixed Block,No,Normal
KANPUR DEHAT,RAJPUR,9330808704,GOVT.HIGH SCHOOL BEHMAI,Volatile,Mixed Block,No,Normal
KANPUR DEHAT,RASULABAD,9330914307,GOVT.  HIGHER SECONDARY SCHOOLJOT,Peaked,Mixed Block,No,Normal
KANPUR DEHAT,RASULABAD,9330907717,GOVT.G.I.C.RASULABAD,Peaked,Mixed Block,No,Normal
KANPUR DEHAT,RASULABAD,9330908805,GOVT.GIRLS I.C.SIMRAMAU,Consistent Growth,Mixed Block,No,Normal
KANPUR DEHAT,SANDALPUR,9331104705,GOVT.H.S.SCHOOL PINDATHU K.D.,Volatile,Mixed Block,No,Normal
KANPUR DEHAT,SARVANKHERA,9331009804,GOVT.H.S.SCHOOL KERSA,Volatile,Mixed Block,No,Normal
KANPUR DEHAT,SARVANKHERA,9331007921,GOVT. INTER COLLEGE RANIYA KANPUR DEHAT,Consistent Growth,Mixed Block,No,Normal
KANPUR NAGAR,BHITERGAON,9340800704,GOVT HIGH SCHOOL KORTHA,Recovery,Mixed Block,No,Normal
KANPUR NAGAR,BIDHNU,9340200109,GIC H S SCHOOL KHERSA,Consistent Decline,Isolated Decline,No,Normal
KANPUR NAGAR,BILHAUR,9340611801,RAJKIYA HIGH SCHOOL BIBPUR BILHAUR,Recovery,Mixed Block,No,Normal
KANPUR NAGAR,BILHAUR,9340602306,"RAJKIYA HIGH SCHOOL, RADHAN BILHAUR",Recovery,Mixed Block,No,Normal
KANPUR NAGAR,CHAUBEPUR,9340404805,GOVT HIGH SCHOOL RAI GOPALPUR,Consistent Decline,Isolated Decline,No,Normal
KANPUR NAGAR,GHATAMPUR,9340907956,GOVERNMENT GIRLS HIGHER SECONDARY SCHOOL,Recovery,Mixed Block,No,Normal
KANPUR NAGAR,GHATAMPUR,9340901903,GOVT HIGH SCHOOL,Peaked,Mixed Block,No,Normal
KANPUR NAGAR,GHATAMPUR,9340912902,GOVT HIGH SCHOOL KASIMPUR,Volatile,Mixed Block,No,Normal
KANPUR NAGAR,KAKWAN,9340701803,GOVT HIGH SCHOOL UTTANPUR,Recovery,Mixed Block,No,Normal
KANPUR NAGAR,KALYANPUR,9340303711,GOVT HIGH SCHOOL,Recovery,Mixed Block,No,Normal
KANPUR NAGAR,KALYANPUR,9340301105,GOVT HIGH SCHOOL BAIKUNTHPUR,Recovery,Mixed Block,No,Normal
KANPUR NAGAR,KALYANPUR,9340302810,GOVT. HIGH SCHOOL BHAUTI,Consistent Growth,Mixed Block,No,Normal
KANPUR NAGAR,KALYANPUR,9340300618,IC GGIC SINGHPUR,Consistent Decline,Mixed Block,No,Normal
KANPUR NAGAR,PATARA,9341009102,GOVT HIGH SCHOOL KAKRAHIYA,Recovery,Mixed Block,No,Normal
KANPUR NAGAR,PATARA,9341005107,GOVT. HIGH SCHOOL JAHANGIRABAD,Recovery,Mixed Block,No,Normal
KANPUR NAGAR,PREMNAGAR,9341112602,GOVT. BALIKA I.C. CHUNNIGANJ,Consistent Growth,Mixed Block,No,Normal
KANPUR NAGAR,PREMNAGAR,9341400144,GOVT. INTER COLLEGE,Peaked,Mixed Block,No,Normal
KANPUR NAGAR,SARSAUL,9340102922,G.G.I.C.,Consistent Decline,Mixed Block,No,Normal
KANPUR NAGAR,SARSAUL,9340101506,GOVT HIGH SCHOOL TILSAHRI BUJURG,Volatile,Mixed Block,No,Normal
KANPUR NAGAR,SHASTRI NAGAR,9341500180,GOVT. GIRLS INTER COLLEGE VIJAY NAGAR,Consistent Decline,Isolated Decline,No,Normal
KANPUR NAGAR,SHIVRAJPUR,9340500805,GOVT HIGH SCHOOL BEERA MAU,Recovery,Mixed Block,No,Normal
KANSHIRAM NAGAR,AMAPUR,9720208703,GOVERNMENT HIGHSCHOOL NAGLA YADKARAN ANMAPUR KASGANJ,Consistent Growth,Mixed Block,No,Normal
KANSHIRAM NAGAR,AMAPUR,9720210607,Pt Deendayal Upadhyay Govt Model Inter College Tharachitra,Consistent Growth,Mixed Block,No,Normal
KANSHIRAM NAGAR,GANJ DUNDWARA,9720406208,GOVERNMENT HIGHSCHOOL KADARGANJ KHAM,Consistent Growth,Growth Pocket,No,Normal
KANSHIRAM NAGAR,GANJ DUNDWARA,9720406703,GOVERNMENT HIGHSCHOOL RASOOLPUR ARAURA,Consistent Growth,Growth Pocket,No,Normal
KANSHIRAM NAGAR,GANJ DUNDWARA,9720407303,Pt Deendayal Upadhyay Govt Model Inter College Labhed,Consistent Growth,Growth Pocket,No,Normal
KANSHIRAM NAGAR,KASGANJ,9720700103,Govt. High School Bhitona,Stable,Mixed Block,No,Normal
KANSHIRAM NAGAR,KASGANJ (URBAN),9721901301,GOV.GIRL INTER COLLEGE,Recovery,Mixed Block,No,Normal
KANSHIRAM NAGAR,PATIYALI,9721002619,GOVERNMENT GIRLS INTER COL.,Peaked,Mixed Block,No,Normal
KANSHIRAM NAGAR,PATIYALI,9721009103,Govt. High School Bahora,Recovery,Mixed Block,No,Normal
KANSHIRAM NAGAR,PATIYALI,9721009433,PT DEENDAYAL UPADHYAY GOVT MODEL INTER COLLEGE BHARGAIN ,Consistent Growth,Mixed Block,No,Normal
KANSHIRAM NAGAR,PATIYALI,9721002635,GOVERNMENT INTER COLLAGE THANA DARIYAVGANJ,Consistent Growth,Mixed Block,No,Normal
KANSHIRAM NAGAR,SAHAVAR,9721105502,Pt Deendayal Upadhyay Govt Model Inter College Alauddinpur,Consistent Growth,Isolated Growth,No,Normal
KANSHIRAM NAGAR,SORON,9721501608,GOVERNMENT HIGHSCHOOL NAMAINI KASGANJ,Consistent Growth,Mixed Block,No,Normal
KANSHIRAM NAGAR,SORON,9721509904,GOVERNMENT INTER COLLEGE KASGANJ,Consistent Growth,Mixed Block,No,Normal
KANSHIRAM NAGAR,SORON,9721508305,PT DEENDAYAL UPADHYAY GOVT MODEL INTER COLLEGE TIMBARPUR,Peaked,Mixed Block,No,Normal
KAUSHAMBI,CHAYAL,9440702303,RAJKIYA HIGH SCHOOL MAHARAJ KA PURA CHAYAL KAUSHAMBI,Consistent Growth,Isolated Growth,No,Normal
KAUSHAMBI,KADA,9440802705,GOVT. GIRLS HIGH SCHOOL,Consistent Growth,Mixed Block,No,Normal
KAUSHAMBI,KADA,9440801803,PANDIT DEEN DAYAL UPADHAYAY RAJKIY MADAL INTER COLLEGE KESARI,Consistent Growth,Mixed Block,No,Normal
KAUSHAMBI,KADA,9440802713,RAJKIYA HIGH SCHOOL AMIRTAPUR KAUSHAMBI,Volatile,Mixed Block,No,Normal
KAUSHAMBI,KAUSHAMBI,9440200104,RAJKIY HS ARKAMAHAVEERPUR,Volatile,Mixed Block,No,Normal
KAUSHAMBI,KAUSHAMBI,9440205204,RAJKIYA  HIGH SCHOOL DHOKSAHA KAUSHAMBI,Consistent Growth,Mixed Block,No,Normal
KAUSHAMBI,MANJHANPUR,9440112201,RAJKIYA H.S.S PINDARA SAHAWANPUR,Volatile,Mixed Block,No,Normal
KAUSHAMBI,MANJHANPUR,9440109208,RAJKIYA HIGH SCHOOL TEWAN MANJHANPUR KAUSHAMBI,Consistent Growth,Mixed Block,No,Normal
KAUSHAMBI,MANJHANPUR,9440100219,RAJKIYA INTER COLLEGE  OSA MANJHANPUR KAUSHAMBI,Consistent Growth,Mixed Block,No,Normal
KAUSHAMBI,MURATGANJ,9440605503,RAJKIY HIGH SCHOOL PALHANA KACHAR MURATGANJ,Consistent Growth,Mixed Block,No,Normal
KAUSHAMBI,MURATGANJ,9440602403,RAJKIYA HIGH SCHOOL PANSAUR MURATGANJ KAUSHAMBI,Volatile,Mixed Block,No,Normal
KAUSHAMBI,MURATGANJ,9440602503,RAJKIYA HIGH SCHOOL RASOOLPUR BADLEY,Volatile,Mixed Block,No,Normal
KAUSHAMBI,NEWADA,9440405504,RAJKIY HS MISHRAPU DAHIYA,Consistent Growth,Mixed Block,No,Normal
KAUSHAMBI,NEWADA,9440407004,RAJKIYA HIGH SCHOOL SHERGARH NEWADA KAUSHAMBI,Recovery,Mixed Block,No,Normal
KAUSHAMBI,SARSAWAN,9440504913,PANDIT DEEN DAYAL UPADHAYAY RAJKIY MADAL INTER COLLEGE PURAB SHARIRA,Peaked,Mixed Block,No,Normal
KAUSHAMBI,SARSAWAN,9440500105,R.HIGH SCHOOL LOUDHNA SARSWANA KAUSHAMBI,Recovery,Mixed Block,No,Normal
KAUSHAMBI,SARSAWAN,9440508204,RAJKIY HS MAHEWAGHAT,Recovery,Mixed Block,No,Normal
KAUSHAMBI,SARSAWAN,9440512601,RAJKIYA H.S. LODHAN KA PURA,Consistent Growth,Mixed Block,No,Normal
KAUSHAMBI,SIRATHU,9440309823,GOVT. GIRLS HIGH SCHOOL,Consistent Growth,Growth Pocket,No,Normal
KAUSHAMBI,SIRATHU,9440305205,PANDIT DEEN DAYAL UPADHAYAY RAJKIY MADAL INTER COLLEGE DEVKHARPUR,Consistent Growth,Growth Pocket,No,Normal
KAUSHAMBI,SIRATHU,9440302204,R.HIGH SCHOOL AFJALPURWARI,Recovery,Growth Pocket,No,Normal
KAUSHAMBI,SIRATHU,9440309304,RAJKIY HIGH SCHOOL BAMAHROULI,Volatile,Growth Pocket,No,Normal
KAUSHAMBI,SIRATHU,9440307709,RAJKIYA BALIKA HIGH SCHOOL KASIYA,Consistent Growth,Growth Pocket,No,Normal
KAUSHAMBI,SIRATHU,9440303407,RAJKIYA GIGH SCHOOL RAMPUR DHAMANWA SIRATHU,Recovery,Growth Pocket,No,Normal
KAUSHAMBI,SIRATHU,9440307903,RAJKIYA HIGH SCHOOL RALA SIRATHU KAUSHAMBI,Recovery,Growth Pocket,No,Normal
KHERI,BANKEGANJ,9231508806,GOV GIRLS INTER COLLEGE KUKRA,Consistent Growth,Growth Pocket,No,Normal
KHERI,BANKEGANJ,9231508803,GOVT. H S KUKARA,Recovery,Growth Pocket,No,Normal
KHERI,BANKEGANJ,9231502613,KGBV SEC.,Consistent Growth,Growth Pocket,No,Normal
KHERI,BANKEGANJ,9231506303,GOVT INTER COLLEGE SALAVAT NAGAR,Consistent Growth,Growth Pocket,No,Normal
KHERI,BEHJAM,9230211803,GOVT.H.S. GYAN SINGH PURWA,Recovery,Mixed Block,No,Normal
KHERI,BIJUA,9230111602,GOVT. H S MAJHAURA,Recovery,Mixed Block,No,Normal
KHERI,BIJUA,9230113301,GOVT. H.S. FAIAJAL NAGAR GARNT,Consistent Growth,Mixed Block,No,Normal
KHERI,DHAURAHARA,9230300309,GOVT HS WALI,Consistent Growth,Mixed Block,No,Normal
KHERI,DHAURAHARA,9230300102,GOVT. INTER COLEGE.DHAURAHARA,Stable,Mixed Block,No,Normal
KHERI,DHAURAHARA,9230300103,GOVT.GIRLS INTER COLLEGE DHAURAHARA,Volatile,Mixed Block,No,Normal
KHERI,DHAURAHARA,9230305601,Govt. Girls.H.S.ADLISHPUR,Recovery,Mixed Block,No,Normal
KHERI,ISANAGAR,9230402403,GOVT.H.S. JETHARA,Volatile,Mixed Block,No,Normal
KHERI,ISANAGAR,9230409501,Govt. High School sarpatha,Volatile,Mixed Block,No,Normal
KHERI,ISANAGAR,9230402906,Govt.H.S lakhun,Recovery,Mixed Block,No,Normal
KHERI,ISANAGAR,9230402905,govt.H.S iswara,Volatile,Mixed Block,No,Normal
KHERI,ISANAGAR,9230402904,govt.h.s hasan pur katauli,Consistent Growth,Mixed Block,No,Normal
KHERI,KUMBHI-GOLA,9230509103,GOVT HS AHMAD NAGAR,Recovery,Recovery Cluster,No,Normal
KHERI,KUMBHI-GOLA,9230510410,GOVT HS AJAN,Recovery,Recovery Cluster,No,Normal
KHERI,KUMBHI-GOLA,9230513702,GOVT HS GANESH PUR,Consistent Growth,Recovery Cluster,No,Normal
KHERI,KUMBHI-GOLA,9230500204,GOVT HS MAGDAPUR,Recovery,Recovery Cluster,No,Normal
KHERI,KUMBHI-GOLA,9230503403,GOVT HS MOHAMMADBAD,Recovery,Recovery Cluster,No,Normal
KHERI,LAKHIMPUR,9230600213,GOVT.GIRLS I.C.KHIRI TOWN,Consistent Decline,Isolated Decline,No,Normal
KHERI,LMP,9231600237,GOVT.GIRLS I.C.LAKHIMPR KHIRI,Peaked,Mixed Block,No,Normal
KHERI,LMP,9231600236,GOVT.I.C.LAKHIMPR KHIRI,Consistent Growth,Mixed Block,No,Normal
KHERI,MITAULI,9230814203,GOVT. H.S CHURAIPURWA,Recovery,Mixed Block,No,Normal
KHERI,MITAULI,9230810404,GOVT. H.S. NAKARA,Stable,Mixed Block,No,Normal
KHERI,MITAULI,9230816704,GOVT.H.S. BHEEKHAM PUR,Recovery,Mixed Block,No,Normal
