District,Block,School_ID,School_Name,School_Growth_Tag,Block_Cluster_Type,Is_Outlier,Outlier_Type
PRATAPGARH,BABAGANJ,9430206004,Pt Deendayal Upadhyay Govt Model Inter College Mahewa Malkiya Babaganj,Volatile,Mixed Block,No,Normal
PRATAPGARH,BIHAR,9430305402,GOVT. GIRLS H.SEC. SCHOOL,Consistent Decline,Mixed Block,No,Normal
PRATAPGARH,BIHAR,9430303703,GOVT. H S S DEVRI HARDO PATTI,Recovery,Mixed Block,No,Normal
PRATAPGARH,BIHAR,9430305606,GOVT. H.S. SCHOOL BEDHAN GOPALPUR PRATAPGARH,Peaked,Mixed Block,No,Normal
PRATAPGARH,CITY(PRATAPGARH BELHA),9430401003,G I C PRATAPGARH,Recovery,Mixed Block,No,Normal
PRATAPGARH,CITY(PRATAPGARH BELHA),9430402706,GGIC,Consistent Decline,Mixed Block,No,Normal
PRATAPGARH,GAURA,9431807602,G I C SEKHUPUR,Recovery,Recovery Cluster,No,Normal
PRATAPGARH,GAURA,9431803804,GHS NAIKOT,Recovery,Recovery Cluster,No,Normal
PRATAPGARH,GAURA,9431805403,GOVT. GIRLS INTER COLLEGE,Consistent Growth,Recovery Cluster,No,Normal
PRATAPGARH,GAURA,9431803304,"GOVT. H.S. SCHOOL, DAMDAM, PRATAPGARH",Volatile,Recovery Cluster,No,Normal
PRATAPGARH,GAURA,9431808606,GOVT. HIGHER SECONDRY SCHOOL SULTANPUR,Recovery,Recovery Cluster,No,Normal
PRATAPGARH,KALAKANKER,9430607301,GGIC Manikpur,Recovery,Mixed Block,No,Normal
PRATAPGARH,KALAKANKER,9430607106,GOVT. H.S. SCHOOL VAZIDPUR KALAKANKAR PRATAPGARH,Recovery,Mixed Block,No,Normal
PRATAPGARH,KALAKANKER,9430604504,Pt Deendayal Upadhyay Govt Model Inter College Murassapur Kalakankar,Volatile,Mixed Block,No,Normal
PRATAPGARH,LALGANJ,9430803002,G G I C SITALMAU,Recovery,Mixed Block,No,Normal
PRATAPGARH,LAXMANPUR,9430906504,GOVT. HIGHER SEC. SCHOOL SHEETAL PATTI,Recovery,Mixed Block,No,Normal
PRATAPGARH,LAXMANPUR,9430906409,GOVT. HIGHER SECONDRY SCHOOL,Recovery,Mixed Block,No,Normal
PRATAPGARH,MANDHATA,9431004704,G H S S PURAILA,Recovery,Mixed Block,No,Normal
PRATAPGARH,MANDHATA,9431001101,GOVT. GIRLS INTER COLLEGE,Consistent Decline,Mixed Block,No,Normal
PRATAPGARH,MANGRAURA,9431108108,G H S VARI KALA,Consistent Growth,Mixed Block,No,Normal
PRATAPGARH,MANGRAURA,9431111005,GOVT. INTRE HOGHE SECONDARY SCHOOL,Recovery,Mixed Block,No,Normal
PRATAPGARH,MANGRAURA,9431101602,GOVERNMENT INTER COLLEGE RAMPUR KANPA,Consistent Growth,Mixed Block,No,Normal
PRATAPGARH,PATTI,9431204804,G H S BASAULI,Consistent Growth,Mixed Block,No,Normal
PRATAPGARH,PATTI,9431201004,GOVT H S SCHOOL KUKUWAR,Volatile,Mixed Block,No,Normal
PRATAPGARH,PATTI,9431203636,RAM AZOR CHAURSIYA  R.B. I.C. PATTI PRATAPGARH,Volatile,Mixed Block,No,Normal
PRATAPGARH,SADAR,9431308302,GOVERNMENT INTER COLLEGE SHUKULPUR,Consistent Growth,Isolated Growth,No,Normal
PRATAPGARH,SADWA-CHANDRIKA,9431505603,GOVT. H.S.S. LOHANG PATTI  PRATAPGARH,Consistent Growth,Mixed Block,No,Normal
PRATAPGARH,SADWA-CHANDRIKA,9431507205,GOVT. INTER COLLEGE,Volatile,Mixed Block,No,Normal
PRATAPGARH,SANGIPUR,9431406808,GHS RAJAPUR,Recovery,Mixed Block,No,Normal
PRATAPGARH,SANGIPUR,9431401003,GOVERNMENT HIGHER SECONDARY SCHOOL,Consistent Growth,Mixed Block,No,Normal
PRATAPGARH,SANGIPUR,9431407605,GOVT.GIRLS INTER COLLEGE,Recovery,Mixed Block,No,Normal
PRATAPGARH,SHIVGARH,9431709804,G I C CHANDI GOVINDPUR,Volatile,Mixed Block,No,Normal
PRATAPGARH,SHIVGARH,9431700203,GOVT. H S SCHOOL IMLIDAD,Peaked,Mixed Block,No,Normal
PRATAPGARH,SHIVGARH,9431707903,GOVT. HIGHER SECONDRY SCHOOL HARNAHPUR,Recovery,Mixed Block,No,Normal
PRATAPGARH,SHIVGARH,9431708707,Pt Deendayal Upadhyay Govt Model Inter College Kuradeeh Shivgarh,Volatile,Mixed Block,No,Normal
PRAYAGRAJ,BAHARIYA,9451904506,PT D.D.U.G.M.INTER COLLEGE,Recovery,Mixed Block,No,Normal
PRAYAGRAJ,BAHARIYA,9451907203,RAJKIYA U M VIDHYALAYA MIRAKPUR BAHARIYA,Recovery,Mixed Block,No,Normal
PRAYAGRAJ,CHAKA,9451306506,ABHINAV VIDYALAYA,Consistent Decline,Mixed Block,No,Normal
PRAYAGRAJ,CHAKA,9451306505,RAJKIYA U.M.V. DANDU PUR,Recovery,Mixed Block,No,Normal
PRAYAGRAJ,CHAKA,9451300803,RAJKIYA U.M.V. MOHABBAT GANJ,Consistent Decline,Mixed Block,No,Normal
PRAYAGRAJ,DHANUPUR,9451501409,GOVERNMENT GIRLS INTER COLLEGE,Consistent Growth,Isolated Growth,No,Normal
PRAYAGRAJ,HANDIA,9452002508,G.G.I.C. HANDIYA,Consistent Decline,Mixed Block,No,Normal
PRAYAGRAJ,HANDIA,9452004803,RAJKIYA U.M.V.,Peaked,Mixed Block,No,Normal
PRAYAGRAJ,JASARA,9450306508,G.G.I.C. JASARA,Volatile,Mixed Block,No,Normal
PRAYAGRAJ,JASARA,9450301603,RAJKIYA U.M.V.PARVEJABAD,Recovery,Mixed Block,No,Normal
PRAYAGRAJ,KARCHHANA,9451806805,G.G.I.C. MUGARI  RAMPUR,Stable,Mixed Block,No,Normal
PRAYAGRAJ,KORAON,9451010913,RAJKIYA U M VIDHYALAYA KHIRI KORAON PRAYAGRAJ,Consistent Decline,Isolated Decline,No,Normal
PRAYAGRAJ,KORAON,9451004607,RAJKIYA U.M.V. SANSAR PUR,Consistent Growth,Isolated Decline,No,Normal
PRAYAGRAJ,KORAON,9454100305,RAJKIYA INTER COLLEGE,Consistent Growth,Isolated Decline,No,Normal
PRAYAGRAJ,MANDA,9451606902,GOVT. INTER COLLEGE,Peaked,Mixed Block,No,Normal
PRAYAGRAJ,MANDA,9451608203,GOVT.H.S.SCHOOL,Volatile,Mixed Block,No,Normal
PRAYAGRAJ,MANDA,9451605402,RAJKIYA U.M.V. BERI MANDA,Volatile,Mixed Block,No,Normal
PRAYAGRAJ,MANDA,9451604004,RAJKIYA U.M.V. DIGHIYA,Consistent Decline,Mixed Block,No,Normal
PRAYAGRAJ,MAUAIMA,9450900303,RAJKIYA U M VIDHAYALAYA JOGIPUR MAUAIMA ,Recovery,Mixed Block,No,Normal
PRAYAGRAJ,MEJA,9450509801,RAJKIYA KANYA U.M.V. JEWANIYA,Recovery,Mixed Block,No,Normal
PRAYAGRAJ,MEJA,9450504705,RAJKIYA U.M.V. PIPRANWA,Volatile,Mixed Block,No,Normal
PRAYAGRAJ,NAGAR CHHETRA,9452200413,G.G.I.C. OLD KATARA,Consistent Growth,Isolated Growth,No,Normal
PRAYAGRAJ,NAGAR CHHETRA,9452200605,G.G.I.C. PHAPHAMAU,Consistent Decline,Isolated Growth,No,Normal
PRAYAGRAJ,NAGAR CHHETRA,9452209914,GOVT. GIRLS INTER COLLEGE,Peaked,Isolated Growth,No,Normal
PRAYAGRAJ,NAGAR CHHETRA,9452211107,GOVT. INTER COLLEGE,Consistent Decline,Isolated Growth,No,Normal
PRAYAGRAJ,PHOOLPUR,9450609903,GOVERNMENT GIRLS INTER COLLEGE PHOOLPUR,Recovery,Mixed Block,No,Normal
PRAYAGRAJ,PHOOLPUR,9450601903,RAJKIYA U.M.V. NANDOUT,Peaked,Mixed Block,No,Normal
PRAYAGRAJ,PRATAP PUR,9450403504,RAJKIYA U M VIDHAYALAYA CHANETHU PRATAPPUR,Volatile,Mixed Block,No,Normal
PRAYAGRAJ,SAIDABAD,9451106008,GOVT. GIRLS INTER COOLEGE,Consistent Growth,Isolated Growth,No,Normal
PRAYAGRAJ,SHANKAR GARH,9450100108,G.G.I.C. SHANKARGARH,Consistent Growth,Mixed Block,No,Normal
PRAYAGRAJ,SHANKAR GARH,9450104704,GOVT. GIRLS I.C. NARIBARI,Recovery,Mixed Block,No,Normal
PRAYAGRAJ,SHANKAR GARH,9450101503,RAJKIYA U.M.V. SONVEY,Consistent Growth,Mixed Block,No,Normal
PRAYAGRAJ,SORAON,9450706814,GOVERNMENT  HIGH SCHOOL GOHARI ,Recovery,Mixed Block,No,Normal
PRAYAGRAJ,URUWA,9452100117,GOVERNMENT GIRLS HIGH SCHOOL SIRSA,Recovery,Mixed Block,No,Normal
PRAYAGRAJ,URUWA,9452101104,PT Deen Dayal Updhyay Rajkiya Madel School Somhan,Volatile,Mixed Block,No,Normal
RAE BARELI,AMAWAN,9280207003,G.G.I.C. HARIYAWAN RAEBARELI,Peaked,Mixed Block,No,Normal
RAE BARELI,AMAWAN,9280203203,"GOVT. HIGHER  SCHOOL, PINDARI KALAN",Consistent Growth,Mixed Block,No,Normal
RAE BARELI,AMAWAN,9280205702,GOVT INTER COLLEGE JAMALPUR KARAUNDI,Consistent Growth,Mixed Block,No,Normal
RAE BARELI,BACHHRAWAN,9280403609,GOVT. GIRLS INTER COLLEGE,Consistent Growth,Mixed Block,No,Normal
RAE BARELI,BACHHRAWAN,9280405305,PT. FEEN DAYAL U GOVT. MODEL IMNTER COLLEGE ASHAN JAGATPUR,Consistent Growth,Mixed Block,No,Normal
RAE BARELI,CHHATOH,9282401706,GIC CHHATOH,Volatile,Mixed Block,No,Normal
RAE BARELI,CHHATOH,9282401707,GOV. GIRLS HIGHER SECONDERY CHHATOH,Consistent Decline,Mixed Block,No,Normal
RAE BARELI,CHHATOH,9281701904,PT DEEN DAYAL UPADHYAY MODEL INTER COLLEGE,Volatile,Mixed Block,No,Normal
RAE BARELI,DALMAU,9281905005,PT DEEN DAYAL UPADHYAY MODEL INTER COLLEGE,Consistent Growth,Isolated Growth,No,Normal
RAE BARELI,DEEH,9282306503,GOVT.  INTER COLLEGE,Peaked,Mixed Block,No,Normal
RAE BARELI,DEEH,9282306504,GOVT. GIRLS INTER COLLEGE,Stable,Mixed Block,No,Normal
RAE BARELI,DEEH,9282306106,RAJKIYE HAIGH SCHOOL VIRNAWO,Peaked,Mixed Block,No,Normal
RAE BARELI,GAURA,9281002306,"GOVT. HIGHER SECONDARY SCHOOL, JALAL PUR DHAI",Recovery,Mixed Block,No,Normal
RAE BARELI,GAURA,9281003801,"GOVT.GIRLS INTER COLLAGE, GURGUJ PUR",Consistent Decline,Mixed Block,No,Normal
RAE BARELI,HARCHANDPUR,9280302307,"G.G. HIGHER SECONDARY SCHOOL, PASCHIM GAON",Consistent Decline,Isolated Decline,No,Normal
RAE BARELI,HARCHANDPUR,9280301504,G.G.H. SCHOOL BALA,Consistent Growth,Isolated Decline,No,Normal
RAE BARELI,HARCHANDPUR,9280302402,"GOVT. INTER COLLAGE, TERA BAROULA",Peaked,Isolated Decline,No,Normal
RAE BARELI,JAGATPUR,9281105303,GOVT. HIGH SCHOOL ROJHAIYA BHIKHAMSHAH,Consistent Growth,Mixed Block,No,Normal
RAE BARELI,JAGATPUR,9281100109,"GOVT. HIGHER SECONDARY SCHOOL, JAGATPUR",Recovery,Mixed Block,No,Normal
RAE BARELI,KHIRON,9280801003,"GOVT. GIRLS INTER COLLAGE, KHIRON",Consistent Growth,Mixed Block,No,Normal
RAE BARELI,KHIRON,9280804204,JAWAHAR GOVT. INTER COLLEGE,Recovery,Mixed Block,No,Normal
RAE BARELI,KHIRON,9280802702,PT DEEN DAYAL UPADHYAY MODEL INTER COLLEGE HARIPUR NIHASTHA,Peaked,Mixed Block,No,Normal
RAE BARELI,LALGANJ,9282001127,"GOVT. GIRLS INTER COLLAGE, LALGANJ",Peaked,Mixed Block,No,Normal
RAE BARELI,LALGANJ,9282002304,GOVT. HIGH SCHOOL CHANDITIKAR,Volatile,Mixed Block,No,Normal
RAE BARELI,MAHRAJGANJ,9280602902,"G.G.I.C. ATREHTA, MAHARAJGANJ",Consistent Decline,Isolated Decline,No,Normal
RAE BARELI,MAHRAJGANJ,9280607104,GOVT. HIGHER SECONDARY SCHOOL MAU GARBI,Consistent Growth,Isolated Decline,No,Normal
RAE BARELI,MAHRAJGANJ,9280604203,"GOVT. HIGHER SECONDARY SCHOOL, JANAI",Volatile,Isolated Decline,No,Normal
RAE BARELI,MAHRAJGANJ,9280605708,GOVT. INTER COLLEGE,Peaked,Isolated Decline,No,Normal
RAE BARELI,MAHRAJGANJ,9280601705,PT. DEEN DAYAL UPADDHYAY  RAJKIYA MODEL INTER COLLEGE,Consistent Growth,Isolated Decline,No,Normal
RAE BARELI,NAGAR SHETRA (RBL),9282208604,GOVT. GIRLS INTER COLLEGE,Consistent Decline,Mixed Block,No,Normal
RAE BARELI,NAGAR SHETRA (RBL),9282208603,GOVT. INTER COLLEGE,Recovery,Mixed Block,No,Normal
RAE BARELI,NAGAR SHETRA (RBL),9282206102,SRI K.B. SHINHA GOVT. GIRLS INTER COLLEGE,Consistent Decline,Mixed Block,No,Normal
RAE BARELI,RAHI,9280103704, GOVT. HIGH SCHOOL SANAHI,Volatile,Mixed Block,No,Normal
RAE BARELI,RAHI,9280100806,GOVT. HIGH SCHOOL BELA BHELA,Recovery,Mixed Block,No,Normal
RAE BARELI,RAHI,9280103203,PT DEEN DAYAL UPADHYAY MODEL INTER COLLEGE,Peaked,Mixed Block,No,Normal
RAE BARELI,ROHANIYA,9281201805,"GOVT. HIGHER SECONDARY SCHOOL, ROHANIYA",Recovery,Mixed Block,No,Normal
RAE BARELI,ROHANIYA,9281206702,"GOVT. HIGHER SECONDARY SCHOOL, TAMASGARH",Peaked,Mixed Block,No,Normal
RAE BARELI,ROHANIYA,9281200803,PT DEEN DAYAL UPADHYAY MODEL INTER COLLEGE,Consistent Growth,Mixed Block,No,Normal
RAE BARELI,SALON,9282500701,GGIC SALON,Peaked,Mixed Block,No,Normal
RAE BARELI,SALON,9282500105,RAJKIYE HIGH SCHOOL SOOCHI,Volatile,Mixed Block,No,Normal
RAE BARELI,SARENI,9282100106,GOVERNMENT HIGH SCHOOL PURE TRIVEDI,Recovery,Mixed Block,No,Normal
RAE BARELI,SATAON,9280906108,"GOVT. INTER COLLAGE, A. BUJURG",Stable,Mixed Block,No,Normal
RAE BARELI,SATAON,9280902704,GOVT GIRLS INTER COLLEGE HAJIPUR,Consistent Growth,Mixed Block,No,Normal
RAE BARELI,SHIVGARH,9280500703,"G.G.HIGHER SECONDARY SCHOOL, OSAAH",Consistent Decline,Mixed Block,No,Normal
RAE BARELI,SHIVGARH,9280505504,GOVT INTER COLLEGE ACHCHHAI RAEBARELI,Peaked,Mixed Block,No,Normal
RAMPUR,BILASPUR,9050211003,GOVT HSS AHRO BILASHPUR,Consistent Decline,Decline Cluster,No,Normal
RAMPUR,BILASPUR,9050200102,GOVT HSS GAJRAULA BILASPUR,Volatile,Decline Cluster,No,Normal
RAMPUR,BILASPUR,9050233005,GOVT IC ASHOK NAGAR,Consistent Decline,Decline Cluster,No,Normal
RAMPUR,BILASPUR,9050211715,GOVT IC BILASPUR,Peaked,Decline Cluster,No,Normal
RAMPUR,BILASPUR,9050211713,GOVT IC KEMRI,Peaked,Decline Cluster,No,Normal
RAMPUR,BILASPUR,9050209107,"GOVT INTER COLLEGE MANUNAGAR, BILASPUR",Consistent Decline,Decline Cluster,No,Normal
RAMPUR,BILASPUR,9054100152,GIC PIPALIYA MISRA,Consistent Growth,Decline Cluster,Yes,Bright Spot
RAMPUR,CHAMRAUVA,9050402710,GOVT HSS CHAMRAUVA,Consistent Growth,Mixed Block,No,Normal
RAMPUR,CHAMRAUVA,9050410802,"GOVT INTER COLLEGE, MANKARA, BLOCK CHAMRAUVA SADAR RAMPUR",Consistent Growth,Mixed Block,No,Normal
RAMPUR,CHAMRAUVA,9050402603,GOVT. H.S.S. NAUGAVAN,Recovery,Mixed Block,No,Normal
RAMPUR,CHAMRAUVA,9050409918,PT.DEEN DYAL UPADHYAY GOVT. MODEL IC KAKRAUVA,Recovery,Mixed Block,No,Normal
RAMPUR,MILAK,9050514917,"GOVT INTER COLLEGE, DHAMAURA, MILAK",Consistent Decline,Isolated Decline,No,Normal
RAMPUR,SAID NAGAR,9050609304,GOVT HIGH SCHOOL KHANDIA,Recovery,Growth Pocket,No,Normal
RAMPUR,SAID NAGAR,9050613601,GOVT INTER COLLEGE MOHAMMADPUR SHUMALI,Consistent Growth,Growth Pocket,No,Normal
RAMPUR,SAID NAGAR,9050630801,GOVT. I  SAIJANI NANKAR,Consistent Growth,Growth Pocket,No,Normal
RAMPUR,SAID NAGAR,9050630901,GOVT. I C KASHIPUR,Peaked,Growth Pocket,No,Normal
RAMPUR,SAID NAGAR,9050619004,GOVT. INTER COLLEGE MANAKPUR BANJARIYA,Consistent Growth,Growth Pocket,No,Normal
RAMPUR,SHAHBAD,9050123004,GOVT GIRLS INTER COLLEGE PATWAI,Consistent Decline,Mixed Block,No,Normal
RAMPUR,SHAHBAD,9050125506,GOVT GIRLS INTER COLLEGE SHAHBAD,Stable,Mixed Block,No,Normal
RAMPUR,SHAHBAD,9050111403,GOVT HSS SHAHPUR DEV,Consistent Growth,Mixed Block,No,Normal
RAMPUR,SHAHBAD,9050123005,GOVT INTER COLLEGE PATWAI,Peaked,Mixed Block,No,Normal
RAMPUR,SHAHBAD,9050100703,GOVT INTER COLLEGE SHAHABAD,Consistent Growth,Mixed Block,No,Normal
RAMPUR,SHAHBAD,9050125507,GOVT INTER COLLEGE SHAHBAD,Consistent Decline,Mixed Block,No,Normal
RAMPUR,SHAHBAD,9050122704,GOVT. I C REBDI KALAN,Peaked,Mixed Block,No,Normal
RAMPUR,SUAR,9050302603,GOVT GIRLS I C NARPAT NAGAR,Peaked,Growth Pocket,No,Normal
RAMPUR,SUAR,9050315823,GOVT GIRLS I C SUAR,Recovery,Growth Pocket,No,Normal
RAMPUR,SUAR,9050308404,GOVT HSS DHANUPURA,Volatile,Growth Pocket,No,Normal
RAMPUR,SUAR,9050317018,GOVT HSS RAZA NAGAR,Recovery,Growth Pocket,No,Normal
RAMPUR,SUAR,9050315824,GOVT INTER COLLEGE SWAR,Recovery,Growth Pocket,No,Normal
RAMPUR,SUAR,9050316212,GOVT INTER COLLEGE TANDA,Consistent Growth,Growth Pocket,No,Normal
RAMPUR,SUAR,9050305311,"GOVT INTER COLLEGE, TANDA BADLI, TANDA",Volatile,Growth Pocket,No,Normal
RAMPUR,SUAR,9054100151,GOVT MODEL COLLEGE TANDA,Consistent Growth,Growth Pocket,No,Normal
RAMPUR,SUAR,9054100300,GOVT MODERN GIRLS INTER COLLEGE TANDA,Consistent Growth,Growth Pocket,No,Normal
RAMPUR,TOWN AREA RAMPUR,9050702225,GOVT BAQAR IC RAMPUR,Volatile,Mixed Block,No,Normal
RAMPUR,TOWN AREA RAMPUR,9050705613,GOVT GIRLS IC QILA RAMPUR,Consistent Decline,Mixed Block,No,Normal
RAMPUR,TOWN AREA RAMPUR,9050704510,GOVT HAMID IC RAMPUR,Volatile,Mixed Block,No,Normal
RAMPUR,TOWN AREA RAMPUR,9050721403,"GOVT INTER COLLEGE, PAHADI GATE, RAMPUR",Peaked,Mixed Block,No,Normal
RAMPUR,TOWN AREA RAMPUR,9050701903,GOVT KHURSHEED GIRLS IC RAM PUR,Recovery,Mixed Block,No,Normal
RAMPUR,TOWN AREA RAMPUR,9050702906,GOVT MURTAZA INTER COLL RAMPUR,Peaked,Mixed Block,No,Normal
RAMPUR,TOWN AREA RAMPUR,9050703909,GOVT ORIENTAL COLLEGE RAMPUR,Volatile,Mixed Block,No,Normal
RAMPUR,TOWN AREA RAMPUR,9050703906,GOVT RAZA IC RAM PUR,Recovery,Mixed Block,No,Normal
RAMPUR,TOWN AREA RAMPUR,9050700515,GOVT ZULFEQAR  IC RAMPUR,Consistent Decline,Mixed Block,No,Normal
RAMPUR,TOWN AREA RAMPUR,9050700514,GOVT ZULFEQAR GIRL IC RAM PUR,Peaked,Mixed Block,No,Normal
SAHARANPUR,BALIA KHEDI,9010800104,GOVT. HIGH SCHOOL PUNDAIN,Recovery,Mixed Block,No,Normal
SAHARANPUR,BALIA KHEDI,9010802912,RAJKIYA HIGH SCHOOL SABDALPUR,Consistent Decline,Mixed Block,No,Normal
SAHARANPUR,BALIA KHEDI,9010805402,RAMABAI RAJKIYA KANYA VIDHALAY,Consistent Decline,Mixed Block,No,Normal
SAHARANPUR,DEOBAND,9010504805,GOVT. HIGH SCHOOL JAHKWALA,Recovery,Recovery Cluster,No,Normal
SAHARANPUR,DEOBAND,9010502204,GOVT. HIGH SCHOOL UNCHAGAON,Recovery,Recovery Cluster,No,Normal
SAHARANPUR,DEOBAND,9010505604,GOVT. INTER COLLEGE TAYYABPUR TAPPALALU PHULAS AKBARPUR,Volatile,Recovery Cluster,No,Normal
SAHARANPUR,DEOBAND,9010506007,GOVT.HIGH SCHOOL DIVALHEDI,Recovery,Recovery Cluster,No,Normal
SAHARANPUR,DEOBAND,9010505706,RAJKIYE INTER COLLEGE SANPALA BAKKAL,Peaked,Recovery Cluster,No,Normal
SAHARANPUR,GANGOH,9010301503,GOVT INTER COLLEGE JHADVAN ,Volatile,Mixed Block,No,Normal
SAHARANPUR,GANGOH,9010305905,GOVT. HIGH SCHOOL,Volatile,Mixed Block,No,Normal
SAHARANPUR,GANGOH,9010310203,GOVT. HIGH SCHOOL CHAUPURA,Recovery,Mixed Block,No,Normal
SAHARANPUR,GANGOH,9010302208,GOVT. HIGH SCHOOL LAKHNOTI,Volatile,Mixed Block,No,Normal
SAHARANPUR,GANGOH,9010306705,PtDDUGICDhayakiGangoh,Peaked,Mixed Block,No,Normal
SAHARANPUR,GANGOH,9010313205,RAJKIYE INTER COLLEGE BEENPUR,Recovery,Mixed Block,No,Normal
SAHARANPUR,GANGOH,9010310414,RAJKIYE INTER COLLEGE DOODHLA,Consistent Growth,Mixed Block,No,Normal
SAHARANPUR,MUZAFFARABAD,9011208803,GOVT. HIGH SCHOOL BHAGUWALA,Recovery,Recovery Cluster,No,Normal
SAHARANPUR,MUZAFFARABAD,9011213906,GOVT. HIGH SCHOOL PATHLOKAR,Recovery,Recovery Cluster,No,Normal
SAHARANPUR,MUZAFFARABAD,9011202905,Govt. High School BADHERI GHOGHU,Recovery,Recovery Cluster,No,Normal
SAHARANPUR,MUZAFFARABAD,9011214506,RAJKIY HIGH SCHOOL,Volatile,Recovery Cluster,No,Normal
SAHARANPUR,MUZAFFARABAD,9011212104,RAJKIYA HIGH SCHOOL TOTA TANDA,Recovery,Recovery Cluster,No,Normal
SAHARANPUR,MUZAFFARABAD,9011209303,SAMAJWADI  ABHINAV VIDYALYA KALUWAL,Peaked,Recovery Cluster,No,Normal
SAHARANPUR,MUZAFFARABAD,9011207504,RAJKIYE INTER COLLEGE BHAINSRAU,Consistent Growth,Recovery Cluster,No,Normal
SAHARANPUR,MUZAFFARABAD,9011204801,RAJKIYE INTER COLLEGE KALUWALA JAHANPUR,Insufficient Data,Recovery Cluster,No,Normal
SAHARANPUR,NAGAL,9011101207,GOVT. HIGH SCHOOL KPOORI GOVINDPUR,Volatile,Mixed Block,No,Normal
SAHARANPUR,NAGAL,9011103706,GOVT. HIGH SCHOOL KUTUBPUR LABDOLA,Recovery,Mixed Block,No,Normal
SAHARANPUR,NAGAL,9011106403,GOVT. HIGH SCHOOL SHIVPUR,Volatile,Mixed Block,No,Normal
SAHARANPUR,NAGAL,9011101410,RAJKIYE INTER COLLEGE BANHERA KHAS,Peaked,Mixed Block,No,Normal
SAHARANPUR,NAKUR,9010106501,GOVT. GIRL INTER COLLEGE NICHI NAKUR,Consistent Growth,Recovery Cluster,No,Normal
SAHARANPUR,NAKUR,9010102805,GOVT. HIGH SCHOOL BADHI,Recovery,Recovery Cluster,No,Normal
SAHARANPUR,NAKUR,9010109005,GOVT. HIGH SCHOOL MACHCHARHERI,Peaked,Recovery Cluster,No,Normal
SAHARANPUR,NAKUR,9010103304,GOVT. HIGH SCHOOL RANIPUR BARSI,Peaked,Recovery Cluster,No,Normal
SAHARANPUR,NAKUR,9010106116,GOVT. HIGH SCHOOL TABER,Recovery,Recovery Cluster,No,Normal
SAHARANPUR,NAKUR,9010105208,GOVT. INTER COLLEGE KAPURI,Consistent Decline,Recovery Cluster,No,Normal
SAHARANPUR,NAKUR,9010106752,LALA INDARSEN GOVT GIRLS INTER COLLEGE,Consistent Decline,Recovery Cluster,No,Normal
SAHARANPUR,NAKUR,9010106026,SH.DEVENDRA KUMAR GOVT GIRLS INTER COLLEGE,Recovery,Recovery Cluster,No,Normal
SAHARANPUR,NANAUTA,9010906011,GOVT. GIRLS INTER COLLEGE TIKRAUL,Consistent Growth,Mixed Block,No,Normal
SAHARANPUR,NANAUTA,9010902802,GOVT. HIGH SHCOOL BHAWASI RAIPUR,Volatile,Mixed Block,No,Normal
SAHARANPUR,NANAUTA,9010904804,RAJKIYA  HIGH SCHOOL KUWA KHERA,Recovery,Mixed Block,No,Normal
SAHARANPUR,NANAUTA,9010900806,RAJKIYA HAIGH SCHOOL ABHA NANAUTA,Peaked,Mixed Block,No,Normal
SAHARANPUR,PUNWARKA,9011007604,"GOVT HIGH SCHOOL CHANDPUR, SRE",Consistent Decline,Growth Pocket,Yes,Problem School
SAHARANPUR,PUNWARKA,9011001825,GOVT INTER COLLEGE KAILASHPUR,Consistent Growth,Growth Pocket,No,Normal
SAHARANPUR,PUNWARKA,9011005113,GOVT. HIGH SCHOOL SADAK DUDLEE,Recovery,Growth Pocket,No,Normal
SAHARANPUR,PUNWARKA,9011001203,GOVT. HIGH SCHOOL SONA,Recovery,Growth Pocket,No,Normal
SAHARANPUR,PUNWARKA,9011009401,PDDUGICCHAURADEV,Peaked,Growth Pocket,No,Normal
SAHARANPUR,PUNWARKA,9011002605,RAJKIY KANYA INTER COLLEGE,Consistent Growth,Growth Pocket,No,Normal
SAHARANPUR,PUNWARKA,9011010911,RAJKIYE HIGH SCHOOL,Volatile,Growth Pocket,No,Normal
SAHARANPUR,PUNWARKA,9011010719,RAJKIYE KANYA INTER COLLEGE.GAGALHEDI,Recovery,Growth Pocket,No,Normal
SAHARANPUR,PUNWARKA,9011008405,RAJKIYE INTER COLLEGE CHANDRAULI,Consistent Growth,Growth Pocket,No,Normal
SAHARANPUR,RAMPUR MANIHARAN,9010205108,GOVT. HIGH SHCOOL SADHOLI HARIA,Volatile,Mixed Block,No,Normal
SAHARANPUR,RAMPUR MANIHARAN,9010201511,RAJKIYA KANYA HIGH SCHOOL,Recovery,Mixed Block,No,Normal
SAHARANPUR,SADHOLI KADIM,9010404507,GOVT INTER COLLEGE DABKAURA,Volatile,Recovery Cluster,No,Normal
SAHARANPUR,SADHOLI KADIM,9010406103,GOVT INTER COLLEGE HABIBPUR TAPOVAN,Volatile,Recovery Cluster,No,Normal
SAHARANPUR,SADHOLI KADIM,9010408003,GOVT. HIGH SCHOOL,Recovery,Recovery Cluster,No,Normal
SAHARANPUR,SADHOLI KADIM,9010401006,GOVT. HIGH SCHOOL KHERI MADHTI,Recovery,Recovery Cluster,No,Normal
SAHARANPUR,SADHOLI KADIM,9010409003,PDDUGICNAUGAVAN,Recovery,Recovery Cluster,No,Normal
SAHARANPUR,SARSAVA,9010710108,GOVT. HIGH SCHOOL BUDDA KHEDA,Volatile,Mixed Block,No,Normal
SAHARANPUR,SARSAVA,9010702506,GOVT. HIGH SCHOOL DAULATPUR,Volatile,Mixed Block,No,Normal
SAHARANPUR,SARSAVA,9010710801,GOVT. INTER COLLEGE GHUMTI,Peaked,Mixed Block,No,Normal
SAHARANPUR,SARSAVA,9010703103,RAJKIYA INTER COLLEGE PANCHKUAN,Consistent Growth,Mixed Block,No,Normal
SAHARANPUR,SARSAVA,9010711802,RAJKIYE INTER COLLEGE KUTUBPUR,Consistent Growth,Mixed Block,No,Normal
SAHARANPUR,T.A. DEOBAND,9011400504,GOVT.KANYA INTER COLLEGE DEOBAND,Peaked,Mixed Block,No,Normal
SAHARANPUR,T.A. SAHAHRANPUR,9010610303,GOVT. INTER COLLEGE KAMELA ROAD,Consistent Growth,Mixed Block,No,Normal
SAHARANPUR,T.A. SAHAHRANPUR,9010602509,GOVT.BOYS INTER COLLEGE,Recovery,Mixed Block,No,Normal
SAHARANPUR,T.A. SAHAHRANPUR,9010605703,GOVT.KANYA HYRE SECONDARY SCHOOL,Recovery,Mixed Block,No,Normal
SAMBHAL (BHIM NAGAR),ASMOLI,9680107105,GOVT.HIGHER SEC.SCHOOL HARTHALA,Recovery,Mixed Block,No,Normal
SAMBHAL (BHIM NAGAR),ASMOLI,9680102306,GOVT.HIGHER SECONDARY SCHOOL MADALA FATEHPUR,Volatile,Mixed Block,No,Normal
SAMBHAL (BHIM NAGAR),ASMOLI,9680109614,G I C SHAHBAJPUR KALAN SAMBHAL,Consistent Growth,Mixed Block,No,Normal
SAMBHAL (BHIM NAGAR),BANIYAKHERA,9680516204,GOVERNMENT HIGHER SECONDARY SCHOOL,Stable,Mixed Block,No,Normal
SAMBHAL (BHIM NAGAR),BANIYAKHERA,9680507903,GOVERNMNET HIGHER SECONDARY SCHOOL,Volatile,Mixed Block,No,Normal
SAMBHAL (BHIM NAGAR),BEHJOI,9680409002,GOVT.HIGHER SECONDARY SCHOOL LEHRAWAN,Stable,Mixed Block,No,Normal
SAMBHAL (BHIM NAGAR),BEHJOI,9680410105,Pt deendayal govt ic rajpur,Consistent Growth,Mixed Block,No,Normal
SAMBHAL (BHIM NAGAR),GUNNOR,9681404503,GGIC KHIZARPUR,Consistent Growth,Isolated Growth,No,Normal
SAMBHAL (BHIM NAGAR),JUNAVAI,9680700305,Pt deendayal govt ic nadrauli,Consistent Growth,Isolated Growth,No,Normal
SAMBHAL (BHIM NAGAR),PAWANSA,9681000106,GOVERNMENT INTER COLLEGE,Consistent Growth,Mixed Block,No,Normal
SAMBHAL (BHIM NAGAR),PAWANSA,9681009407,G G I C SIKANDARPUR SARAI,Consistent Growth,Mixed Block,No,Normal
SAMBHAL (BHIM NAGAR),RAJPURA,9681705510,GOVT. INTER COLLEGE BHIRAVTI,Consistent Growth,Isolated Growth,No,Normal
SAMBHAL (BHIM NAGAR),SAMBHAL,9681110418,GOVERNMENT KANYA INTER COLLEGE,Consistent Growth,Growth Pocket,No,Normal
SAMBHAL (BHIM NAGAR),SAMBHAL,9681112903,GOVT INTER COLLEGE DHIMARKHEDI,Consistent Growth,Growth Pocket,No,Normal
SAMBHAL (BHIM NAGAR),SAMBHAL,9681105703,G I C SADEERANPUR,Consistent Growth,Growth Pocket,No,Normal
SAMBHAL (BHIM NAGAR),SAMBHAL CITY,9681300307,GOVERNMENT GIRLS INTER COLLEGE,Stable,Mixed Block,No,Normal
SAMBHAL (BHIM NAGAR),SAMBHAL CITY,9681303933,GOVERNMENT INTER COLLEGE TAKHTGOSAI,Volatile,Mixed Block,No,Normal
SANT KABIR NAGAR,BAGHAULI,9561613001,GOVT. INTER COLLEGE BANAULI SANT KABIR NAGAR,Consistent Growth,Mixed Block,No,Normal
SANT KABIR NAGAR,BAGHAULI,9561602803,GOVT.HIGH SCHOOL BHAGWANPUR,Peaked,Mixed Block,No,Normal
SANT KABIR NAGAR,BAGHAULI,9561606805,GOVT.HIGH SCHOOL JAMDEEH,Recovery,Mixed Block,No,Normal
SANT KABIR NAGAR,BAGHAULI,9561605209,GOVT.KANYA UMV BAGHAULI,Volatile,Mixed Block,No,Normal
SANT KABIR NAGAR,BAGHAULI,9561622603,GOVT HIGH SCHOOL NAUDAND BAGHAULI SANT KABIR NAGAR,Consistent Growth,Mixed Block,No,Normal
SANT KABIR NAGAR,BELHAR KALA,9562103203,G.U.M.V. SHIYA KATAI,Volatile,Mixed Block,No,Normal
SANT KABIR NAGAR,HAINSAR BAZAR,9561915401,GOVT. HIGH SCHOOL RAMJANGALA,Consistent Growth,Mixed Block,No,Normal
SANT KABIR NAGAR,HAINSAR BAZAR,9561907604,GOVT. UMV BABHANAULI,Volatile,Mixed Block,No,Normal
SANT KABIR NAGAR,KHALILABAD,9561500506,GOVT. GIRLS INTET COLLEGE KHALILABAD,Stable,Mixed Block,No,Normal
SANT KABIR NAGAR,KHALILABAD,9561502903,GOVT. UMV GIRDHARPUR,Peaked,Mixed Block,No,Normal
SANT KABIR NAGAR,KHALILABAD,9561517502,GOVT. UMVIDYALAY DHAURAHARA,Recovery,Mixed Block,No,Normal
SANT KABIR NAGAR,MEHNDAVAL,9561804503,GOVT INTER COLLEGE PARSA PANDEY,Consistent Growth,Isolated Growth,No,Normal
SANT KABIR NAGAR,NATHNAGAR,9562007409,GOVT. UMV MAHULI,Consistent Growth,Isolated Growth,No,Normal
SANT KABIR NAGAR,PAULI,9561014503,GOVT. UMV GOVINDGUNJ,Consistent Decline,Isolated Decline,No,Normal
SANT KABIR NAGAR,SANTHA,9562201703,GOVT HIGH SCHOOL MOTIPUR SANTHA SANT KABIR NAGAR,Peaked,Mixed Block,No,Normal
SANT KABIR NAGAR,SEMARINYAVA,9561701709,GOVT. HIGH SCHOOL SALEHPUR,Recovery,Mixed Block,No,Normal
SANT KABIR NAGAR,SEMARINYAVA,9561702605,GOVT. HIGH SCHOOL UMILA,Volatile,Mixed Block,No,Normal
SANT KABIR NAGAR,SEMARINYAVA,9561704403,GOVT.UMVIDYALAY KARMAKHAN,Peaked,Mixed Block,No,Normal
SANT KABIR NAGAR,SEMARINYAVA,9561701021,GOVT HIGH SCHOOL AGAYA SEMARIYAWA SANT KABIR NAGAR,Peaked,Mixed Block,No,Normal
SANT KABIR NAGAR,SEMARINYAVA,9561705909,GOVT HIGH SCHOOL BAGHNAGAR SEMARIYAWA SANT KABIR NAGAR,Consistent Growth,Mixed Block,No,Normal
SHAHJAHANPUR,BANDA,9220610103,G.H.S CHILHAUTA BANDA,Recovery,Recovery Cluster,No,Normal
SHAHJAHANPUR,BANDA,9220603308,G.H.S. RARUA,Recovery,Recovery Cluster,No,Normal
SHAHJAHANPUR,BANDA,9220607703,G.H.S. SINGHAPUR PANAI,Peaked,Recovery Cluster,No,Normal
SHAHJAHANPUR,BANDA,9220612305,RAJKIYE U. M. VIDHYALAY DHAKA GHANSHYAM,Recovery,Recovery Cluster,No,Normal
SHAHJAHANPUR,BANDA,9220603906,RAJKIYE UCHCHTAR MADHYMIK VIDHYALAY NAVICHI,Consistent Growth,Recovery Cluster,No,Normal
SHAHJAHANPUR,BHAWALKHERA,9221305202,G.H.S. DINGURPUR,Recovery,Mixed Block,No,Normal
