District,Block,School_ID,School_Name,School_Growth_Tag,Block_Cluster_Type,Is_Outlier,Outlier_Type
AGRA,ACCHNERA,9150207401,GOVT. GIRLS INTER COLLEGE GARHICHANDMAN ACHHNERA AGRA,Consistent Growth,Mixed Block,No,Normal
AGRA,ACCHNERA,9150200304,GOVT. HIGH SCHOOL ABHAIDOPURA,Volatile,Mixed Block,No,Normal
AGRA,ACCHNERA,9150204604,"GOVT. HIGH SCHOOL, BASTAI",Recovery,Mixed Block,No,Normal
AGRA,ACCHNERA,9150200408,PT.DEENDAYAL UPADHYAY GOVT. MODEL I.C SANDHAN,Peaked,Mixed Block,No,Normal
AGRA,ACCHNERA,9150203110,RAJKIYA HIGH SCHOOL RAIBHA,Recovery,Mixed Block,No,Normal
AGRA,AKOLA,9150101804,GOVT.HIGH SCHOOL BALHERA AKOLA,Volatile,Mixed Block,No,Normal
AGRA,AKOLA,9150101103,PT. DEENDAYAL UPADHYAY GOVT. MODEL I.C MANKAIDA,Consistent Growth,Mixed Block,No,Normal
AGRA,BAH,9150302904,GOVT HSS BATESHWAR BAH,Consistent Decline,Mixed Block,No,Normal
AGRA,BAH,9150301240,GOVT. ABHINAV VIDHYALAYA BIJOLI BAH,Volatile,Mixed Block,No,Normal
AGRA,BAROLI AHEER,9150403204,GOVT. GIRLS INTER COLLEGE NAINANA JAT AGRA,Peaked,Isolated Growth,No,Normal
AGRA,BAROLI AHEER,9150401704,"GOVT. HIGH SCHOOL, GANGRAUA",Consistent Decline,Isolated Growth,No,Normal
AGRA,BAROLI AHEER,9150405004,PT.DEENDAYAL UPADHYAY GOVT. I.C BIJHAMAI,Peaked,Isolated Growth,No,Normal
AGRA,BAROLI AHEER,9150400904,RAJKIYA HIGH SCHOOL DIGNER,Consistent Growth,Isolated Growth,No,Normal
AGRA,BAROLI AHEER,9150405203,VIRANGANA AVANTIBAI GOVT. GIRLS INTER COLLEGE KALAL KHERIA AGRA,Consistent Decline,Isolated Growth,No,Normal
AGRA,BICHPURI,9150501805,GOVT HSS JAUPURA BICHPURI,Recovery,Mixed Block,No,Normal
AGRA,BICHPURI,9150503512,PT.DEENDAYAL UPADHYAY GOVT. MODEL I.C MIDAKUR,Peaked,Mixed Block,No,Normal
AGRA,ETMADPUR,9150607005,GOVT. HIGH SCHOOL KHUSHAPUR,Recovery,Mixed Block,No,Normal
AGRA,ETMADPUR,9150602003,RAJKIYA HIGH SCHOOL BAHRAMPUR,Peaked,Mixed Block,No,Normal
AGRA,ETMADPUR,9150600506,RAJKIYA HIGH SCHOOL MITAWALI,Stable,Mixed Block,No,Normal
AGRA,FATEHABAD,9151104603,GHS NANDAPURA,Peaked,Mixed Block,No,Normal
AGRA,FATEHABAD,9151110303,"GOVT. HIGHER SECONDARY SCHOOL, BARANA",Recovery,Mixed Block,No,Normal
AGRA,FATEHABAD,9151108704,GOVERNMENT INTER COLLEGE AIE AGRA,Peaked,Mixed Block,No,Normal
AGRA,FATEHPUR  SIKRI,9150701003,GOVT HSS CHAUMA SHAPUR F.SIKARI,Peaked,Mixed Block,No,Normal
AGRA,FATEHPUR  SIKRI,9150703903,RAJKIYA HIGH SCHOOL OLENDA,Peaked,Mixed Block,No,Normal
AGRA,JAGNER,9150804903,RAJKIYA HIGH SCHOOL CHANDSAURA,Volatile,Mixed Block,No,Normal
AGRA,JAGNER,9150802603,RAJKIYA HIGH SCHOOL RICHOHA,Recovery,Mixed Block,No,Normal
AGRA,JAITPUR  KALAN,9150909801,GOVERNMENT  INTER COLLEGE KACHHPURA AGRA,Recovery,Mixed Block,No,Normal
AGRA,JAITPUR  KALAN,9150909606,GOVT. HIGH SCHOOL CHITRAHAT,Volatile,Mixed Block,No,Normal
AGRA,KHANDOLI,9151003604,GOVT. GIRLS INTER COLLEGE AWALKHEDA AGRA,Peaked,Mixed Block,No,Normal
AGRA,KHANDOLI,9151000133,GOVT. HIGH SCHOOL NAGLA JAUHARI AGRA,Peaked,Mixed Block,No,Normal
AGRA,KHANDOLI,9151004507,PT. DEENDAYAL UPADHYAY GOVT. MODEL I.C SEMRA,Peaked,Mixed Block,No,Normal
AGRA,KHANDOLI,9151000904,RAJKIYA HIGH SCHOOL KHEDA HAZIPUR,Recovery,Mixed Block,No,Normal
AGRA,KHANDOLI,9151004506,RAJKIYA HIGH SCHOOL SAIMRA,Consistent Growth,Mixed Block,No,Normal
AGRA,KHERAGARH,9151206612,GOVT. GIRLS INTER COLLEGE  KHERAGARH AGRA,Volatile,Mixed Block,No,Normal
AGRA,M.C.AGRA CITY,9151714173,GOVT. GIRLS INTER COLLEGE SHAHGANJ AGRA,Peaked,Mixed Block,No,Normal
AGRA,M.C.AGRA CITY,9151711940,GOVT. INTER COLLEGE SHAHGANJ AGRA,Peaked,Mixed Block,No,Normal
AGRA,PINAHAT,9151300704,RAJKIYA HIGH SCHOOL SAVORA,Peaked,Mixed Block,No,Normal
AGRA,SAIYAN,9151405312,GOVT. HIGH SCHOOL TEHRA SAIYAN,Recovery,Mixed Block,No,Normal
AGRA,SHAMSHABAD,9151507604,"GOVT. HIGH SCHOOL, JAI NAGAR",Recovery,Mixed Block,No,Normal
AGRA,SHAMSHABAD,9151508107,RAJKIYA HIGH SCHOOL KOLARA KALAN,Recovery,Mixed Block,No,Normal
ALIGARH,AKRABAD,9120205303,RAJKIY HIGH SCHOOL KATHERA,Recovery,Mixed Block,No,Normal
ALIGARH,ATRAULI,9120306904,RAJKEYA INTER COLLEGE SAHNOL  ATRAULI,Consistent Decline,Mixed Block,No,Normal
ALIGARH,ATRAULI,9120305202,RAJKEYA KANYA  INTER COLLEGE  NARONA,Peaked,Mixed Block,No,Normal
ALIGARH,ATRAULI,9120305706,RAJKEYA KANYA INTER COLLEGE CHANDAULA,Volatile,Mixed Block,No,Normal
ALIGARH,BIJAULI,9120502307,Pt Deendayal Upadhyay Govt Model Inter College Badesara,Consistent Growth,Isolated Decline,No,Normal
ALIGARH,BIJAULI,9120504604,RAJKEYA KANYA INTER COLLEGE DUTTA CHOLI,Consistent Decline,Isolated Decline,No,Normal
ALIGARH,CHANDAUS,9120708307,KIRAN DEVI RAJKEYA INTER COLLEGE BAMOTI,Volatile,Mixed Block,No,Normal
ALIGARH,CHANDAUS,9120703804,Pt Deendayal Upadhyay Govt Model Inter College,Volatile,Mixed Block,No,Normal
ALIGARH,CHANDAUS,9120708603,RAJKEYA HIGH SCHOOL PORAI CHANDAUS,Recovery,Mixed Block,No,Normal
ALIGARH,CHANDAUS,9120701402,RAJKEYA KANYA INTER COLLEGE DEORAU MOD,Recovery,Mixed Block,No,Normal
ALIGARH,DHANIPUR,9120101303,RAJKEYA HIGH SCHOOL RAHSUPUR DHANIPUR,Recovery,Mixed Block,No,Normal
ALIGARH,DHANIPUR,9120103509,RAJKEYA KANYA INTER COLLEGE KALAI,Consistent Decline,Mixed Block,No,Normal
ALIGARH,GANGIRI,9120409603,RAJKEY HIGH SCHOOL NAVIPUR,Recovery,Mixed Block,No,Normal
ALIGARH,GANGIRI,9120402514,RAJKEYA HIGH SCHOOL GANGIRI ALIGARH,Consistent Growth,Mixed Block,No,Normal
ALIGARH,GANGIRI,9120401935,RAJKEYA KANYA INTER COLLEGE CHHARA,Recovery,Mixed Block,No,Normal
ALIGARH,GONDA,9121108003,GAYATRI DEEVI RAJKEY INTER COLLEGE  GORAI,Peaked,Mixed Block,No,Normal
ALIGARH,GONDA,9121109505,Pt Deendayal Upadhyay Govt Model Inter College Tamotia,Consistent Decline,Mixed Block,No,Normal
ALIGARH,GONDA,9121108012,SMT SAROJ SINGH RASTREYA I.C.GORAI,Peaked,Mixed Block,No,Normal
ALIGARH,IGLAS,9121207805,GOVT. HIGH SCHOOL JAWAR,Recovery,Mixed Block,No,Normal
ALIGARH,IGLAS,9121206027,RAJKEY KANYA INTER COLLEGE,Consistent Growth,Mixed Block,No,Normal
ALIGARH,IGLAS,9121200701,RAJKEYA HIGH SCHOOL RAITPUR IGLAS,Recovery,Mixed Block,No,Normal
ALIGARH,JAWAN,9120610205,ABHINAY VIDHYALAY CHHLESAR,Recovery,Mixed Block,No,Normal
ALIGARH,JAWAN,9120611803,GHS PIPLAUTH,Recovery,Mixed Block,No,Normal
ALIGARH,JAWAN,9120601315,GOVERNTMENT INTER COLLEGE BARAULI,Volatile,Mixed Block,No,Normal
ALIGARH,JAWAN,9120609204,RAJKEY KANYA INTER OLLEGE GODHA JAWAN,Consistent Decline,Mixed Block,No,Normal
ALIGARH,JAWAN,9120601603,RAJKEYA HIGH SCHOOL KHURD KHERA JAWAN,Peaked,Mixed Block,No,Normal
ALIGARH,KHAIR,9120805708,Pt Deendayal Upadhyay Govt Model Inter College kherasattu,Peaked,Mixed Block,No,Normal
ALIGARH,KHAIR,9120805602,RAJKEYA  INTER COLLEGE  AHROLA KHAIR,Peaked,Mixed Block,No,Normal
ALIGARH,KHAIR,9120802203,VIKRAM VIDHYA MANDIR RAJKEYA INTER COLLEGE BANKNER KHAIR,Consistent Decline,Mixed Block,No,Normal
ALIGARH,LODHA,9121000503,RAJKEYA HIGH SCHOOL SINGHARPUR,Stable,Mixed Block,No,Normal
ALIGARH,LODHA,9121005012,G.I.C. RORAWAR,Consistent Growth,Mixed Block,No,Normal
ALIGARH,NAGAR ALIGARH,9121307839,NAURANGI LAL RAJKIYA INTER COLLEGE,Peaked,Mixed Block,No,Normal
ALIGARH,NAGAR ALIGARH,9121307973,RAJKEYA KANYA INTER COLLEGE,Stable,Mixed Block,No,Normal
ALIGARH,NAGAR ALIGARH,9121306092,GOVERNMENT HIGH SCHOOL BHUJPURA,Peaked,Mixed Block,No,Normal
ALIGARH,NAGAR ATRAULI,9121403616,RAJKEYA KANYA INTER COLLEGE ATRAULI,Consistent Decline,Isolated Decline,No,Normal
ALIGARH,TAPPAL,9120906504,RAJKEYA HIGH SCHOOL SIMROTHI TAPPAL,Recovery,Mixed Block,No,Normal
ALIGARH,TAPPAL,9120911213,SMT REVATI GOYAL RAJKEYA KANYA I.C. JATTA,Recovery,Mixed Block,No,Normal
AMBEDKAR NAGAR,AKBARPUR,9480110905,G G I C AKBARPUR,Volatile,Mixed Block,No,Normal
AMBEDKAR NAGAR,AKBARPUR,9480103707,GOVT GIRLS INTER COLLEGE BEWANA,Consistent Growth,Mixed Block,No,Normal
AMBEDKAR NAGAR,AKBARPUR,9480114803,GOVT HIGHER SEC SCH KAHARA SULEMPUR,Recovery,Mixed Block,No,Normal
AMBEDKAR NAGAR,AKBARPUR,9480106311,GOVT HIGHER SEC SCH RAMPUR SAKARWARI,Recovery,Mixed Block,No,Normal
AMBEDKAR NAGAR,AKBARPUR,9480107905,GOVT INTER COLLEGE AKBARPUR,Peaked,Mixed Block,No,Normal
AMBEDKAR NAGAR,AKBARPUR,9480101909,Pt Deendayal Upadhyay Govt Model Inter College Jafarganj,Consistent Growth,Mixed Block,No,Normal
AMBEDKAR NAGAR,AKBARPUR,9480100906,SAVITRI BAI FULE GOVT. GIRLS INTER COLLEGE,Volatile,Mixed Block,No,Normal
AMBEDKAR NAGAR,BASKHARI,9480200403,GOVT HIGHER SEC SCH LAKHANPUR,Recovery,Mixed Block,No,Normal
AMBEDKAR NAGAR,BASKHARI,9480210203,RAJKIYA HIGHER SEC SCH00L TARAULI MUBARAKPUR,Recovery,Mixed Block,No,Normal
AMBEDKAR NAGAR,BHEETI,9480308014,GOVT GIRLS INTER COLLEGE BHEETI,Consistent Growth,Isolated Growth,No,Normal
AMBEDKAR NAGAR,BHIYAON,9480406306,GOVT HIGHER SEC SCH RAMGARH,Recovery,Mixed Block,No,Normal
AMBEDKAR NAGAR,BHIYAON,9480404812,KASTURABA GANDHI G HIGHER SEC SCH RATNA,Recovery,Mixed Block,No,Normal
AMBEDKAR NAGAR,BHIYAON,9480403803,PT. D.D.U GOVT. MODAL INTER COLLEGE INDHANA,Consistent Growth,Mixed Block,No,Normal
AMBEDKAR NAGAR,JAHANGIRGANJ,9480700805,GOVT GIRLS INTER COLLEGE TENDUAI KALA,Consistent Growth,Recovery Cluster,No,Normal
AMBEDKAR NAGAR,JAHANGIRGANJ,9480709005,GOVT HIGHER SEC SCH AHIRAULI RANIMAU,Recovery,Recovery Cluster,No,Normal
AMBEDKAR NAGAR,JAHANGIRGANJ,9480702111,GOVT HIGHER SEC SCH JAHANGIRGANJ,Recovery,Recovery Cluster,No,Normal
AMBEDKAR NAGAR,JAHANGIRGANJ,9480704404,GOVT HIGHER SEC SCHOOL KAMHARIA,Recovery,Recovery Cluster,No,Normal
AMBEDKAR NAGAR,JALALPUR,9480602120,GOVT G INTER COLLEGE JALALPUR,Consistent Growth,Mixed Block,No,Normal
AMBEDKAR NAGAR,JALALPUR,9480607607,GOVT HIGHER SEC SCH BAREPUR,Recovery,Mixed Block,No,Normal
AMBEDKAR NAGAR,JALALPUR,9480605504,GOVT HIGHER SEC SCH BASIYA,Recovery,Mixed Block,No,Normal
AMBEDKAR NAGAR,KATEHARI,9480502308,GOVT HIGHER SEC SCH PAHITIPUR,Recovery,Mixed Block,No,Normal
AMBEDKAR NAGAR,KATEHARI,9480501904,PT DEENDAYAL UPADHYAY GOVT MODAL IC PAHITIPUR KHAJOORDEEH AMBEDKAR NAGAR,Recovery,Mixed Block,No,Normal
AMBEDKAR NAGAR,KATEHARI,9480508707,RAJKEY HIGHSCHOOL ASHRAFPUR BARAWAN,Consistent Growth,Mixed Block,No,Normal
AMBEDKAR NAGAR,RAMNAGAR,9480811703,GOVT HIGHER SEC SCH CHANDANPUR,Volatile,Isolated Decline,No,Normal
AMBEDKAR NAGAR,RAMNAGAR,9480802223,PT. D.D.U. GOVT. MODAL INTER COLLEGE RAMNAGAR,Consistent Growth,Isolated Decline,No,Normal
AMBEDKAR NAGAR,RAMNAGAR,9480814301,RAJKEEYA HIGHER SEC SCH AMADERVESPUR,Consistent Growth,Isolated Decline,No,Normal
AMBEDKAR NAGAR,RAMNAGAR,9480814201,SMT SUMITRA DEVI SHUKLA GOVT GIRLS INTER COLLEGE ALAPUR,Consistent Decline,Isolated Decline,No,Normal
AMBEDKAR NAGAR,TANDA,9480917501,GOVT GIRLS INTER COLLEGE TANDA,Recovery,Recovery Cluster,No,Normal
AMBEDKAR NAGAR,TANDA,9480908706,GOVT HIGHER SEC SCH DIHWA MOHIUDDINPUR,Recovery,Recovery Cluster,No,Normal
AMBEDKAR NAGAR,TANDA,9480900604,GOVT HIGHER SEC SCH FARIDPUR KUTUB,Recovery,Recovery Cluster,No,Normal
AMBEDKAR NAGAR,TANDA,9480911206,GOVT VIDYUT PAR IC VIDYUTNAGAR,Volatile,Recovery Cluster,No,Normal
AMBEDKAR NAGAR,TANDA TOWN AREA,9481002001,GOVT. GIRLS INTER COLLEGE NAGARPALIKA PARISHAD TANDA,Consistent Growth,Isolated Growth,No,Normal
AMETHI - CSM NAGAR,AMETHI,9730208001,GGIC AMETHI,Consistent Decline,Mixed Block,No,Normal
AMETHI - CSM NAGAR,AMETHI,9730200109,RAJKIYE HIGH SCHOOL,Recovery,Mixed Block,No,Normal
AMETHI - CSM NAGAR,BAHADURPUR,9732500101,GGIC JAIS,Volatile,Mixed Block,No,Normal
AMETHI - CSM NAGAR,BAHADURPUR,9732502201,GIC FURSATGANJ,Consistent Decline,Mixed Block,No,Normal
AMETHI - CSM NAGAR,BAHADURPUR,9732500102,GIC JAIS,Volatile,Mixed Block,No,Normal
AMETHI - CSM NAGAR,BAHADURPUR,9732500904,Pt Deendayal Upadhayay Govt Model Inter College Udawa,Recovery,Mixed Block,No,Normal
AMETHI - CSM NAGAR,BAHADURPUR,9732500206,RAJKEEYA HIGH SCHOOL,Volatile,Mixed Block,No,Normal
AMETHI - CSM NAGAR,BAHADURPUR,9732500609,RAJKIYA HIGH SCHOOL PEEDHI,Consistent Growth,Mixed Block,No,Normal
AMETHI - CSM NAGAR,BHADAR,9732704801,GGIC SONARI KALA,Peaked,Mixed Block,No,Normal
AMETHI - CSM NAGAR,BHADAR,9732701209,GIC TIKARMAFI,Peaked,Mixed Block,No,Normal
AMETHI - CSM NAGAR,BHADAR,9732702403,RAJKIYA HIGH SCHOOL,Recovery,Mixed Block,No,Normal
AMETHI - CSM NAGAR,BHADAR,9732706101,RAMABAI AMBEDKAR GGIC,Recovery,Mixed Block,No,Normal
AMETHI - CSM NAGAR,BHETUA,9732303305,RAJKIY INTER COLLEGE,Consistent Growth,Isolated Growth,No,Normal
AMETHI - CSM NAGAR,GAURIGANJ,9731904502,GGIC GAURIGANJ,Volatile,Mixed Block,No,Normal
AMETHI - CSM NAGAR,GAURIGANJ,9731906204,PANDIT DEENDAYAL UPADHYAY RAJKEEYA  MODAL INTER COLLEGE ,Recovery,Mixed Block,No,Normal
AMETHI - CSM NAGAR,JAGDISHPUR,9730100401,GGIC JAGDISHPUR,Consistent Growth,Isolated Decline,No,Normal
AMETHI - CSM NAGAR,JAGDISHPUR,9730106203,GOVT H S MANGRAULI JAGDISHPUR,Consistent Decline,Isolated Decline,No,Normal
AMETHI - CSM NAGAR,JAGDISHPUR,9730104402,RAJKIY HIGH SCHOOL RANIGANJ,Recovery,Isolated Decline,No,Normal
AMETHI - CSM NAGAR,JAGDISHPUR,9730104605,GIC MAU ATWARA  JAGDISHPUR AMETHI,Consistent Growth,Isolated Decline,No,Normal
AMETHI - CSM NAGAR,JAMO,9732100101,GGIC JAMO,Peaked,Mixed Block,No,Normal
AMETHI - CSM NAGAR,JAMO,9732100205,RAJKIYE HIGH SCHOOL SARMEN,Volatile,Mixed Block,No,Normal
AMETHI - CSM NAGAR,JAMO,9732100115,UMA RAMAN INTER COLLEGE,Consistent Growth,Mixed Block,No,Normal
AMETHI - CSM NAGAR,MUSAFIRKHANA,9730301001,GGIC MUSAFIRKHANA,Recovery,Isolated Decline,No,Normal
AMETHI - CSM NAGAR,MUSAFIRKHANA,9730306605,PANDIT DEENDAYAL U RAJKIYE MODAL INTER COLLEGE,Consistent Growth,Isolated Decline,No,Normal
AMETHI - CSM NAGAR,MUSAFIRKHANA,9730303904,RAJKIY HIGH SCHOOL KANJAS,Consistent Decline,Isolated Decline,No,Normal
AMETHI - CSM NAGAR,SANGRAMPUR,9730400406,GGIC SANGRAMPUR,Recovery,Mixed Block,No,Normal
AMETHI - CSM NAGAR,SHAHGARH,9732000201,GGIC SHAHGARH,Consistent Decline,Mixed Block,No,Normal
AMETHI - CSM NAGAR,SHAHGARH,9732003204,GOVT HIGH SCHOOL AFUIYA,Stable,Mixed Block,No,Normal
AMETHI - CSM NAGAR,SHAHGARH,9732002803,RAJKIY HAIGH SCHOOL,Recovery,Mixed Block,No,Normal
AMETHI - CSM NAGAR,SHUKULBAZAR,9731800101,GGIC SHUKUL BAZAR,Recovery,Mixed Block,No,Normal
AMETHI - CSM NAGAR,SINGHPUR,9731700510,RAJKIY HIGH SCHOOL SATAN KA PURWA,Peaked,Mixed Block,No,Normal
AMETHI - CSM NAGAR,SINGHPUR,9731700509,RAJKIY HIGH SCHOOL SINGHPUR,Peaked,Mixed Block,No,Normal
AMETHI - CSM NAGAR,SINGHPUR,9731700807,RAJKIY INTER COLLGE INHAUNA,Volatile,Mixed Block,No,Normal
AMETHI - CSM NAGAR,SINGHPUR,9731703504,RAJKIYA INTER COLLEGE RAJA FATEHPUR,Peaked,Mixed Block,No,Normal
AMETHI - CSM NAGAR,TILOI,9732202304,RAJKIY HIGH SCHOOL CHITRA BUZURG,Recovery,Isolated Decline,No,Normal
AMETHI - CSM NAGAR,TILOI,9732201003,RAJKIY HIGH SCHOOL SAVITAPUR,Consistent Growth,Isolated Decline,No,Normal
AMETHI - CSM NAGAR,TILOI,9732209101,RAJKIY HIGH SCHOOL SEMRAUTA,Consistent Decline,Isolated Decline,No,Normal
AURAIYA,ACHHALDA,9320903205,GOVT. U.M.V. BHAISOL ACHHALDA,Recovery,Mixed Block,No,Normal
AURAIYA,ACHHALDA,9320900115,GOVT. U.M.V. PATA,Peaked,Mixed Block,No,Normal
AURAIYA,AIRWAKATRA,9320400109,GOVT GIRLS INTER COLLEGE AIRWAKATRA,Volatile,Mixed Block,No,Normal
AURAIYA,AIRWAKATRA,9320402003,GOVT. U.M.V. KARMUPUR,Consistent Growth,Mixed Block,No,Normal
AURAIYA,AURAIYA,9320100103,GOVT INTER COLLEGE AYANA  AURAIYA,Volatile,Mixed Block,No,Normal
AURAIYA,AURAIYA,9320103803,GOVT. U.M.V. MAANPUR,Consistent Growth,Mixed Block,No,Normal
AURAIYA,AURAIYA,9320107404,GOVT. U.M.V. NASIRABAD,Peaked,Mixed Block,No,Normal
AURAIYA,BHAGYANAGAR,9320600102,GOVT. GIRLS INTER COLLEGE DIBIYAPUR,Recovery,Mixed Block,No,Normal
AURAIYA,BHAGYANAGAR,9320608206,GOVT. U.M.V. JUA,Volatile,Mixed Block,No,Normal
AURAIYA,BHAGYANAGAR,9320602003,GOVT. U.M.V. TURKIPUR,Volatile,Mixed Block,No,Normal
AURAIYA,BIDHUNA,9320500105,GOVT.  GIRLS INTER COLLEGE  BIDHURA,Consistent Growth,Mixed Block,No,Normal
AURAIYA,BIDHUNA,9320500271,GOVT. U.M.V. BHATAULI,Recovery,Mixed Block,No,Normal
AURAIYA,SAHAR,9320811706,GOVT GIRLS INTER COLLEGE SAHAR AURAIYA,Volatile,Mixed Block,No,Normal
AURAIYA,SAHAR,9320805603,GOVT. U.M.V. BIJHAI SAHAR,Consistent Growth,Mixed Block,No,Normal
AURAIYA,SAHAR,9320801103,GOVT. U.M.V. LAKHUNO,Consistent Growth,Mixed Block,No,Normal
AZAMGARH,ATRAULIYA,9611201913,GOVT GIRLS INTER COLLEGE,Peaked,Mixed Block,No,Normal
AZAMGARH,AZAMGRAH,9612301305,GOVT B.I.COLLEGE RAIDOPUR,Recovery,Mixed Block,No,Normal
AZAMGARH,AZMATGARH,9611604608,GOVT. GIRLS HR. SECODARY SCHOOL,Volatile,Mixed Block,No,Normal
AZAMGARH,BILARIYAGANJ,9611515002,GOVT.GIRLS INTER COLLEGE BAGWAR,Recovery,Mixed Block,No,Normal
AZAMGARH,FOOLPOOR,9610806403,RAJKIYA UMV FATTEPUR FOOLPUR,Peaked,Mixed Block,No,Normal
AZAMGARH,HARRAIYA,9611410802,G.B.U.M.V. PIHAR,Recovery,Mixed Block,No,Normal
AZAMGARH,HARRAIYA,9611400505,MAHANT RAMASHRYA DAS GOVT. I.C.,Consistent Decline,Mixed Block,No,Normal
AZAMGARH,HARRAIYA,9611400703,R.U.M.V. ETAILY,Consistent Decline,Mixed Block,No,Normal
AZAMGARH,JAHANAGANJ,9612000408,GOVT HSS MITTUPUR,Recovery,Mixed Block,No,Normal
AZAMGARH,JAHANAGANJ,9612014707,RAJKIYA U.M.V. KANAILA,Consistent Decline,Mixed Block,No,Normal
AZAMGARH,LALGANJ,9610401511,G.G.I.C. DEVGAON,Recovery,Recovery Cluster,No,Normal
AZAMGARH,LALGANJ,9610400611,G.G.I.C. KATGHAR LALGANJ,Recovery,Recovery Cluster,No,Normal
AZAMGARH,LALGANJ,9610405403,RAJKIYA UMV RASULPUR,Recovery,Recovery Cluster,No,Normal
AZAMGARH,MAHARAJ GANJ,9610104507,"GOVT ABHINAV SCHOOL, TERAHI",Volatile,Mixed Block,No,Normal
AZAMGARH,MIRZAPUR,9611703403,G.G.H.S.S.SARAIMIR,Stable,Mixed Block,No,Normal
AZAMGARH,MOHAMMADPUR,9611800313,G G I C NANDAV,Consistent Growth,Mixed Block,No,Normal
AZAMGARH,MOHAMMADPUR,9611803703,G.U.M.V. KHARATI,Consistent Growth,Mixed Block,No,Normal
AZAMGARH,MOHAMMADPUR,9611801105,GOVT H S S SURJANPUR,Recovery,Mixed Block,No,Normal
AZAMGARH,PALHNA,9612205105,R.UMV DUBHAV,Volatile,Mixed Block,No,Normal
AZAMGARH,PAWAE,9610701108,GOVT. GIRLS H.S. SCHOOL PAWAI,Recovery,Mixed Block,No,Normal
AZAMGARH,PAWAE,9610705504,RAJKIYA U.M.V. SARAIPUL,Recovery,Mixed Block,No,Normal
AZAMGARH,SATHIYAN,9610305907,RAJAKIY INTER COLLAGE JAMURI,Consistent Growth,Isolated Growth,No,Normal
AZAMGARH,TAHBERPUR,9611006403,RAJKIYA U.M.V. RAISINGHPUR,Recovery,Mixed Block,No,Normal
AZAMGARH,TARWA,9610611101,R.B.U.M.V. BARAWANLALGANJ,Volatile,Mixed Block,No,Normal
AZAMGARH,THEKMA,9612106802,GOVT GIRLS I.C.  ASHWANIYA,Consistent Decline,Isolated Decline,No,Normal
BAGHPAT,BAGPAT,9080104909,G.G.I.C BAGHPAT,Peaked,Mixed Block,No,Normal
BAGHPAT,BAGPAT,9080104207,G.H.S AHERA,Recovery,Mixed Block,No,Normal
BAGHPAT,BAGPAT,9080103506,G.H.S FATEHPUR POOTHI,Stable,Mixed Block,No,Normal
BAGHPAT,BAGPAT,9080103703,GIC JAHANGARH DAUJHA,Peaked,Mixed Block,No,Normal
BAGHPAT,BAROUT,9080203312,G. G.I.C. BAVLI,Peaked,Mixed Block,No,Normal
BAGHPAT,BAROUT,9080202903,G.H.S CHOBLI,Volatile,Mixed Block,No,Normal
BAGHPAT,BAROUT URBAN,9080400107,G.G.I.C BAROUT,Peaked,Mixed Block,No,Normal
BAGHPAT,BINOLY,9080304608,G.G.I.C. DAHA,Peaked,Mixed Block,No,Normal
BAGHPAT,BINOLY,9080305606,G.H.S GANGNOLI,Consistent Growth,Mixed Block,No,Normal
BAGHPAT,BINOLY,9080302506,G.H.S MAVIKALAN,Peaked,Mixed Block,No,Normal
BAGHPAT,CHHAPROLI,9080501906,G.G.I.C TUGANA,Volatile,Recovery Cluster,No,Normal
BAGHPAT,CHHAPROLI,9080502304,G.H.S BADARKHA,Recovery,Recovery Cluster,No,Normal
BAGHPAT,CHHAPROLI,9080502006,G.H.S BODHA,Recovery,Recovery Cluster,No,Normal
BAGHPAT,CHHAPROLI,9080501109,G.H.S SOOP,Recovery,Recovery Cluster,No,Normal
BAGHPAT,CHHAPROLI,9080502105,"MODAL INTER COLLEGE, TANDA, BAGHPAT",Consistent Growth,Recovery Cluster,No,Normal
BAGHPAT,KHEKRA,9080602704,G.H.S GONA,Recovery,Mixed Block,No,Normal
BAGHPAT,KHEKRA,9080601605,G.H.S MUBARIKPUR,Recovery,Mixed Block,No,Normal
BAGHPAT,KHEKRA,9080602802,G.H.S SUBHANPR,Volatile,Mixed Block,No,Normal
BAGHPAT,PILANA,9080705205,G.H.S BASAUD,Recovery,Mixed Block,No,Normal
BAGHPAT,PILANA,9080700903,G.H.S TIPANI,Recovery,Mixed Block,No,Normal
BAGHPAT,PILANA,9080702405,MODAL INTER COLLEGE (BOYS) MUKARI ,Peaked,Mixed Block,No,Normal
BAHRAICH,BALHA,9501001805,R H S SCHOOL RAJAPUR KALAN,Consistent Growth,Mixed Block,No,Normal
BAHRAICH,BALHA,9501003802,R H SCHOOL PATRAHIYA,Recovery,Mixed Block,No,Normal
BAHRAICH,BALHA,9501002506,R.H. SCHOOL PAKDIYA DIWAN,Recovery,Mixed Block,No,Normal
BAHRAICH,BALHA,9504104925,GOVT GIRLS INTER COLLEGE GURGHUTTA,Stable,Mixed Block,No,Normal
BAHRAICH,CHITTAURA,9500801802,R H SCHOOL KISHUNPURMAFI CHITTAURA,Peaked,Mixed Block,No,Normal
BAHRAICH,CHITTAURA,9500814601,R H SCHOOL SAMSA TARHAR CHITTAURA,Consistent Growth,Mixed Block,No,Normal
BAHRAICH,FAKHAR PUR,9500308406,GOVT. HIGH SCHOOL BAUNDI,Recovery,Mixed Block,No,Normal
BAHRAICH,FAKHAR PUR,9500303405,GGIC ACHAULIYA,Consistent Growth,Mixed Block,No,Normal
BAHRAICH,HUJUR PUR,9500612301,GIC BHAGADWA BAZAR HUJURPUR,Peaked,Mixed Block,No,Normal
BAHRAICH,HUJUR PUR,9500600107,GOVERNMENT G.H.S. SCHOOL,Volatile,Mixed Block,No,Normal
BAHRAICH,HUJUR PUR,9500608704,R H S JIGANIYA CHHATER PAL,Peaked,Mixed Block,No,Normal
BAHRAICH,HUJUR PUR,9500607203,R H SCHOOL CHAKUJOT,Consistent Growth,Mixed Block,No,Normal
BAHRAICH,HUJUR PUR,9500608004,R. H. AILIHA,Volatile,Mixed Block,No,Normal
BAHRAICH,HUJUR PUR,9500603205,GOVT MODEL INTER COLLEGE,Consistent Growth,Mixed Block,No,Normal
BAHRAICH,JARWAL,9500108805,GOVT H S MUSTAFA BAD JARWAL,Consistent Growth,Mixed Block,No,Normal
BAHRAICH,JARWAL,9500102903,GOVT H S SONBARSA JARAWAL,Recovery,Mixed Block,No,Normal
BAHRAICH,JARWAL,9500102506,R H S  KURSANDA,Recovery,Mixed Block,No,Normal
BAHRAICH,JARWAL,9500108207,R H S AHATA,Volatile,Mixed Block,No,Normal
BAHRAICH,JARWAL,9500100805,R HS NARAUDA,Stable,Mixed Block,No,Normal
BAHRAICH,JARWAL,9500107705,GGIC BASAHIYAPATE,Consistent Growth,Mixed Block,No,Normal
BAHRAICH,KAISER GANJ,9500205111,GOV. HIGH SCHOOL LUDIYA NO-4,Recovery,Growth Pocket,No,Normal
BAHRAICH,KAISER GANJ,9500204403,GOV. INTER COLLEGE,Consistent Growth,Growth Pocket,No,Normal
BAHRAICH,KAISER GANJ,9500200108,R H SCHOOL BADRAULI,Recovery,Growth Pocket,No,Normal
BAHRAICH,KAISER GANJ,9500207202,R H SCHOOL UMARI KAISARGANJ,Consistent Growth,Growth Pocket,No,Normal
BAHRAICH,KAISER GANJ,9500203010,RAJKIYE BALIKA INTER COLLEGE,Consistent Growth,Growth Pocket,No,Normal
BAHRAICH,KAISER GANJ,9500206006,RAJKIYE HIGH SCHOOL GULHARIYA,Recovery,Growth Pocket,No,Normal
BAHRAICH,KAISER GANJ,9500204705,RH SCHOOL PARSENDI,Recovery,Growth Pocket,No,Normal
BAHRAICH,MAHSI,9500400103,R H SCHOOL MAIKUPURWA,Recovery,Mixed Block,No,Normal
BAHRAICH,MAHSI,9500403005,R H SCHOOL NAKAHI,Peaked,Mixed Block,No,Normal
BAHRAICH,MAHSI,9500401203,RAJKEEY HIGH SCHOOL BAHORIKPUR MAHSI,Volatile,Mixed Block,No,Normal
BAHRAICH,MIHIN PURVA,9501108016,R H S CHALWA,Recovery,Recovery Cluster,No,Normal
BAHRAICH,MIHIN PURVA,9501102503,R H SCHOOL SALARPUR MIHIPURWA,Recovery,Recovery Cluster,No,Normal
BAHRAICH,MIHIN PURVA,9501110505,R.H. SCHOOL PARGAHWA,Peaked,Recovery Cluster,No,Normal
BAHRAICH,MIHIN PURVA,9501104605,R.H. SCHOOL PURAINA RAGHUNATHPUR,Recovery,Recovery Cluster,No,Normal
BAHRAICH,MIHIN PURVA,9501114002,R.H. SCHOOL RAMPURWA MATEHI,Consistent Growth,Recovery Cluster,No,Normal
BAHRAICH,MIHIN PURVA,9501104004,R.H. SCHOOL URRA BAZAR,Peaked,Recovery Cluster,No,Normal
BAHRAICH,MIHIN PURVA,9501104811,GIC MADHWAPUR,Peaked,Recovery Cluster,No,Normal
BAHRAICH,NAGAR AREA,9501301904,RAJKEEYA INTER COLLEGE,Recovery,Mixed Block,No,Normal
BAHRAICH,NAGAR AREA,9501301105,RAJKIYA BALIKA INTER COLLAGE ,Volatile,Mixed Block,No,Normal
BAHRAICH,NAWAB GANJ,9501204707,GOVT INTER COLLEGE LAKHAIYA KALAN,Volatile,Mixed Block,No,Normal
BAHRAICH,NAWAB GANJ,9501207210,GOVT.G. INTER COLEGE,Recovery,Mixed Block,No,Normal
BAHRAICH,NAWAB GANJ,9501214301,R H SCHOOL PATNA NAWABGANJ,Consistent Growth,Mixed Block,No,Normal
BAHRAICH,PAYAGPUR,9501400411,MAMRAJ GOV. GIRLS H.S. SCHOOL,Volatile,Mixed Block,No,Normal
BAHRAICH,PAYAGPUR,9501401502,R HS GANGA PUR,Volatile,Mixed Block,No,Normal
BAHRAICH,PAYAGPUR,9501401304,R.H. SEMRIYAWAN,Consistent Growth,Mixed Block,No,Normal
BAHRAICH,RISIA,9500903803,R H S BHAGTAPUR,Recovery,Mixed Block,No,Normal
BAHRAICH,RISIA,9500904603,R H SCHOOL BHOPATPUR CHAUKI,Volatile,Mixed Block,No,Normal
BAHRAICH,SHIV PUR,9500505306,R.H. SCHOOL INTAHA,Recovery,Mixed Block,No,Normal
BAHRAICH,SHIV PUR,9500503505,R.H. SCHOOL RAMPUR DHOBIYAHAR,Consistent Growth,Mixed Block,No,Normal
BAHRAICH,TAJWA PUR,9500703302,GOVT HIGH SCHOOL TEDAVA SISTIPUR,Recovery,Mixed Block,No,Normal
BAHRAICH,TAJWA PUR,9500703604,GOVT INTER COLLEGE RAMPURWA,Consistent Growth,Mixed Block,No,Normal
BAHRAICH,VISHESHWAR  GANJ,9501508302,R H SCHOOL BASANT TEPRA VISHESHWARGANJ,Consistent Growth,Recovery Cluster,No,Normal
BAHRAICH,VISHESHWAR  GANJ,9501508303,R H SCHOOL GANGA JAMUNI VISHESHWARGANJ,Recovery,Recovery Cluster,No,Normal
BAHRAICH,VISHESHWAR  GANJ,9501508301,R H SCHOOL VISHESHWARGANJ VISHESHWARGANJ,Recovery,Recovery Cluster,No,Normal
BAHRAICH,VISHESHWAR  GANJ,9501504003,RH SCHOOL SEMRONA,Recovery,Recovery Cluster,No,Normal
BALLIA,BAIRIA,9631601818,G.G.I.C. BAIRIA,Volatile,Mixed Block,No,Normal
BALLIA,BALLIA N.P.,9631802003,GGIC BALLIA,Consistent Decline,Mixed Block,No,Normal
BALLIA,BALLIA N.P.,9631800503,GIC BALLIA,Consistent Decline,Mixed Block,No,Normal
BALLIA,BANSDEEH,9630900117,G G I C BANSDEEH BALLIA,Peaked,Mixed Block,No,Normal
BALLIA,BANSDEEH,9630904207,RAJKIYA U M V KEWRA,Recovery,Mixed Block,No,Normal
BALLIA,BELAHARI,9631503802,RAJKIYA U M V BASUDHARPAH,Recovery,Recovery Cluster,No,Normal
BALLIA,BELAHARI,9631502003,RAJKIYA UCHHTAR J H S DUDHAILA,Recovery,Recovery Cluster,No,Normal
BALLIA,BELAHARI,9631502903,rajkiy j h s rudrapur,Recovery,Recovery Cluster,No,Normal
BALLIA,CHILKAHAR,9630404605,RAJKIY U M V BACHAIPUR,Volatile,Mixed Block,No,Normal
BALLIA,CHILKAHAR,9630400410,RAJKIY U M VIDYALAY HAJAULI,Peaked,Mixed Block,No,Normal
BALLIA,DUBAHAR,9631400502,GOV. G J H S RAMPUR BASARIKAPU,Volatile,Mixed Block,No,Normal
BALLIA,GARWAR,9631102904,RAJKIYA UPS BISUKIA,Recovery,Mixed Block,No,Normal
BALLIA,GARWAR,9631103806,RAJKIYA UPS JAGDISHPUR,Recovery,Mixed Block,No,Normal
BALLIA,GARWAR,9631100203,Rajkiya umv Savarupur,Consistent Growth,Mixed Block,No,Normal
BALLIA,MANIAR,9630702404,RAJKIYA U M V BARSARI,Consistent Growth,Isolated Growth,No,Normal
BALLIA,MURLI CHHAPRA,9631701103,PRABHAVATI DS GGIC J P NAGAR,Consistent Decline,Isolated Decline,No,Normal
