MUZAFFARNAGAR,CHARTHAWAL,9020300805,PANDIT DEEN DAYAL UPADHYAY RAJKIYA INTER COLLEGE BADHAIKALAN MZN,346,360,223,123,208,152,35.5,38.1,40.2,42.2,Slightly Boys Heavy,Stable,False
MUZAFFARNAGAR,JANSATH,9021200814,GOVERNMENT INTER COLLEGE KAWAL,184,344,82,102,114,230,55.4,60.6,65.7,66.9,Slightly Girls Heavy,Moving to Girls Dominant,False
MUZAFFARNAGAR,JANSATH,9021201906,GOVT INTER COLLEGE MEHALKI   MUZAFFARNAGAR,121,174,44,77,76,98,63.6,67.4,65.7,56.3,Slightly Girls Heavy,Stable,False
MUZAFFARNAGAR,JANSATH,9021207211,"GOVT, HIGH SCHOOL TISAMG",72,71,29,43,31,40,59.7,60.6,64.4,56.3,Slightly Girls Heavy,Stable,False
MUZAFFARNAGAR,JANSATH,9021205204,GOVT. HIGH SCHOOL HUSAINPUR KHADAR,66,48,19,47,19,29,71.2,71.1,66.7,60.4,Slightly Girls Heavy,Moving to Boys Dominant,True
MUZAFFARNAGAR,JANSATH,9021201009,GOVT. HIGH SCHOOL JANDHERI,61,61,35,26,27,34,42.6,54.9,58.7,55.7,Slightly Girls Heavy,Moving to Girls Dominant,False
MUZAFFARNAGAR,JANSATH,9021202507,GOVT. HIGH SCHOOL SAMBHALHERA,53,56,0,53,0,56,100.0,100.0,100.0,100.0,Girls Only School,Stable,False
MUZAFFARNAGAR,JANSATH,9021203406,PANDIT DEEN DAYAL UPADHYAY RAJKIYA INTER COLLEGE KASAMPUR KHOLA MZN,58,142,32,26,81,61,44.8,51.9,45.2,43.0,Slightly Boys Heavy,Stable,False
MUZAFFARNAGAR,KHATAULI,9021401504,GOVT. HIGH SCHOOL BADSU,112,112,40,72,48,64,64.3,66.7,58.8,57.1,Slightly Girls Heavy,Stable,False
MUZAFFARNAGAR,KHATAULI,9021400115,GOVT.HIGH SCHOOL NAVLA,192,113,75,117,41,72,60.9,63.3,61.7,63.7,Slightly Girls Heavy,Stable,False
MUZAFFARNAGAR,KHATAULI,9021400207,RAJKIYA KANYA INTER COLLEGE BHANISI,222,201,0,222,0,201,100.0,100.0,100.0,100.0,Girls Only School,Stable,False
MUZAFFARNAGAR,MORNA,9021305006,DEEN MOHAMMAD RAJKIYA  INTER COLLEGE  COLLEGE KAMHERA  MUZAFFARNAGAR,181,193,129,52,147,46,28.7,27.5,28.2,23.8,Boys Dominated,Stable,True
MUZAFFARNAGAR,MORNA,9021303815,GOVT INTER COLLEGE JAULI MORNA MUZAFFARNAGAR,184,135,97,87,61,74,47.3,58.0,62.6,54.8,Balanced,Stable,False
MUZAFFARNAGAR,MORNA,9021303503,GOVT. HIGH SCHOOL RASULPUR,104,115,59,45,57,58,43.3,41.3,52.6,50.4,Balanced,Stable,False
MUZAFFARNAGAR,MORNA,9021302706,PANDIT DEEN DAYAL UPADHYAY RAJKIYA INTER SIKANDERPUR MZN,157,123,70,87,52,71,55.4,53.5,52.7,57.7,Slightly Girls Heavy,Stable,False
MUZAFFARNAGAR,PURKAJI,9020400704,GOV. HIGH SCHOOL KASAMPUR,34,38,18,16,25,13,47.1,47.8,32.4,34.2,Slightly Boys Heavy,Moving to Boys Dominant,True
MUZAFFARNAGAR,PURKAJI,9020404852,GOVT INTER COLLEGE PURKAJI MUZAFFARNAGAR,509,382,234,275,134,248,54.0,55.9,57.9,64.9,Slightly Girls Heavy,Moving to Girls Dominant,False
MUZAFFARNAGAR,PURKAJI,9020405205,GOVT. HIGH SCHOOL HARINAGAR,202,175,104,98,88,87,48.5,47.6,49.4,49.7,Balanced,Stable,False
MUZAFFARNAGAR,PURKAJI,9020402209,GOVT.HIGH SCHOOL TEJALHERA,84,50,34,50,32,18,59.5,55.0,38.5,36.0,Slightly Boys Heavy,Moving to Boys Dominant,True
MUZAFFARNAGAR,PURKAJI,9020404613,PANDIT DEEN DAYAL UPADHYAY RAJKIYA INTER COLLEGE KHAI KHERI MZN,52,79,33,19,62,17,36.5,36.7,32.4,21.5,Boys Dominated,Moving to Boys Dominant,True
MUZAFFARNAGAR,SADAR,9020100607,GOVT HIGH SCHOOL RAI,47,30,28,19,19,11,40.4,45.5,42.2,36.7,Slightly Boys Heavy,Stable,False
MUZAFFARNAGAR,SADAR,9020104012,GOVT INTER COLLEGE BAHADARPUR,31,199,17,14,146,53,45.2,22.9,20.8,26.6,Slightly Boys Heavy,Moving to Boys Dominant,True
MUZAFFARNAGAR,SADAR,9020102509,RAJKIYA HIGH SCHOOL JATMUJHERA,87,77,43,44,47,30,50.6,44.7,36.4,39.0,Slightly Boys Heavy,Moving to Boys Dominant,True
MUZAFFARNAGAR,SADAR [TOWN AREA],9021500266,GOVT. INTER COLLEGE MUZAFFARNAGAR,1010,706,973,37,629,77,3.7,5.6,8.9,10.9,Boys Dominated,Stable,True
MUZAFFARNAGAR,SHAHPUR,9020503915,GOVT INTER COLLEGE PURBALIYA,73,75,48,25,46,29,34.2,31.0,38.7,38.7,Slightly Boys Heavy,Stable,False
MUZAFFARNAGAR,SHAHPUR,9020501813,GOVT. GIRLS INTER COLLEGE SISOULI,414,425,0,414,0,425,100.0,100.0,100.0,100.0,Girls Only School,Stable,False
MUZAFFARNAGAR,SHAHPUR,9020503706,GOVT. HIGH SCHOOL JEEVNA (SHAHPUR),68,79,26,42,38,41,61.8,58.1,60.7,51.9,Balanced,Stable,False
MUZAFFARNAGAR,SHAHPUR,9020500408,GOVT. HIGHSCHOOL DHINDHAVALI (SHAHPUR),36,28,12,24,13,15,66.7,83.3,64.7,53.6,Balanced,Moving to Boys Dominant,True
PILIBHIT,AMARIA,9210101610,GOVERNMENT HIGH SCHOOL DEORANIA AMARIYA PILIBHIT,54,56,24,30,27,29,55.6,55.8,43.4,51.8,Balanced,Stable,False
PILIBHIT,AMARIA,9210102611,GOVERNMENT HIGH SCHOOL TONDERPUR,49,48,33,16,25,23,32.7,39.5,41.2,47.9,Balanced,Moving to Girls Dominant,False
PILIBHIT,AMARIA,9210108317,"GOVERNMENT INTER COLLEGE, AMARIA",265,209,125,140,84,125,52.8,60.5,60.3,59.8,Slightly Girls Heavy,Stable,False
PILIBHIT,AMARIA,9210106405,PANDIT DEEN DAYAL UPADHYAY GOVERNMENT MODEL INTER COLLEGE BADHEPURA AMARIA PILIBIHT,178,128,101,77,75,53,43.3,42.3,42.0,41.4,Slightly Boys Heavy,Stable,False
PILIBHIT,BARKHERA,9210204408,"GOVERNMENT GIRLS  INTER COLLAGE, BARKHERA",613,486,0,613,0,486,100.0,100.0,100.0,100.0,Girls Only School,Stable,False
PILIBHIT,BARKHERA,9210204304,GOVERNMENT HIGH SCHOOL AAMDAR BARKHERA PILIBHIT,129,144,70,59,61,83,45.7,45.7,50.3,57.6,Slightly Girls Heavy,Moving to Girls Dominant,False
PILIBHIT,BARKHERA,9210205403,"GOVERNMENT HIGH SCHOOL, PENNIARAM KISHAN",129,128,79,50,69,59,38.8,41.2,44.5,46.1,Balanced,Stable,False
PILIBHIT,BARKHERA,9210203203,PANDIT DEEN DAYAL UPADHYAY GOVERNMENT MODEL INTER COLLEGE RAMNAGAR JAGAT BARKHERA PILIBIHT,249,318,137,112,178,140,45.0,47.4,47.8,44.0,Slightly Boys Heavy,Stable,False
PILIBHIT,BILSANDA,9210404227,"GOVERNMENT GIRLS INTER COLLEGE, BILASANDA",274,246,0,274,0,246,100.0,100.0,100.0,100.0,Girls Only School,Stable,False
PILIBHIT,BILSANDA,9210402904,GOVERNMENT HIGH SCHOOL ILAHABAS SIMRA,45,39,25,20,19,20,44.4,40.0,50.0,51.3,Balanced,Stable,False
PILIBHIT,BILSANDA,9210400606,GOVERNMENT HIGH SCHOOL INTGAWN BILSANDA,263,217,145,118,111,106,44.9,47.0,51.4,48.8,Balanced,Stable,False
PILIBHIT,BILSANDA,9210404504,GOVERNMENT HIGH SCHOOL JAMUNIYA MAHUA,74,70,35,39,39,31,52.7,61.6,58.3,44.3,Slightly Boys Heavy,Stable,False
PILIBHIT,BILSANDA,9210407904,PANDIT DEEN DAYAL UPADHYAY GOVERNMENT MODEL INTER COLLEGE MARORIKHASH BILSANDA PILIBIHT,137,143,101,36,92,51,26.3,31.8,38.7,35.7,Slightly Boys Heavy,Stable,False
PILIBHIT,BISALPUR,9210301503,"GOVERNMENT  HIGH SCHOOL, LUHICHA BISALPUR",88,113,65,23,83,30,26.1,32.7,34.1,26.5,Slightly Boys Heavy,Stable,False
PILIBHIT,BISALPUR,9210304404,GOVERNMENT HIGH SCHOOL KHANKA BISALPUR PILIBHIT,251,138,143,108,69,69,43.0,45.9,45.3,50.0,Balanced,Stable,False
PILIBHIT,LALORIKHERA,9210507006,GOVERNMENT INTER COLLEGE PAUTA KALAN LALORIKHERA,419,380,214,205,218,162,48.9,47.7,47.0,42.6,Slightly Boys Heavy,Stable,False
PILIBHIT,LALORIKHERA,9210504211,PANDIT DEEN DAYAL UPADHYAY GOVERNMENT MODEL INTER COLLEGE KHAMARIA PUL LALORIKHER PILIBHIT,341,438,202,139,216,222,40.8,41.2,50.1,50.7,Balanced,Stable,False
PILIBHIT,MARORI,9210600205,GOVERNMENT GIRLS INTER COLLEGE NEORIA HUSSAINPUR MARORI,365,371,0,365,0,371,100.0,100.0,100.0,100.0,Girls Only School,Stable,False
PILIBHIT,MARORI,9210603605,GOVERNMENT HIGH SCHOOL JAMUNIA MARORI PILIBHIT,87,99,42,45,45,54,51.7,45.5,47.9,54.5,Balanced,Stable,False
PILIBHIT,MARORI,9210600603,GOVERNMENT HIGH SCHOOL MAHOF CALONY MARORI PILIBHIT,99,66,41,58,36,30,58.6,50.0,45.3,45.5,Balanced,Moving to Boys Dominant,True
PILIBHIT,MARORI,9210600814,GOVERNMENT INTER COLLEGE NEORIA MARORI,273,182,259,14,172,10,5.1,18.4,7.1,5.5,Boys Dominated,Stable,True
PILIBHIT,N. P. PILIBHIT,9210904268,DRAMOUND GOVERNMENT INTER COLLEGE PILIBHIT,1306,1046,1306,0,1044,2,0.0,0.0,0.0,0.2,Boys Only School,Stable,True
PILIBHIT,N. P. PILIBHIT,9210904267,GOVERNMENT GIRLS INTER COLLEGE PILIBHIT,1764,1575,0,1764,0,1575,100.0,100.0,100.0,100.0,Girls Only School,Stable,False
PILIBHIT,N. P. PILIBHIT,9210901104,GOVERNMENT INTER COLLEGE SHER MOHAMMAD PILIBHIT,24,105,5,19,20,85,79.2,86.8,86.7,81.0,Girls Dominated,Stable,False
PILIBHIT,PURANPUR,9210708942,GOVERNMENT GIRLS INTER COLLEGE PURANPUR,628,434,0,628,0,434,100.0,100.0,100.0,100.0,Girls Only School,Stable,False
PILIBHIT,PURANPUR,9210708505,GOVERNMENT HIGH SCHOOL BOONDI BHOOR PURANPUR,103,101,68,35,45,56,34.0,43.6,51.5,55.4,Slightly Girls Heavy,Moving to Girls Dominant,False
PILIBHIT,PURANPUR,9210701303,GOVERNMENT HIGH SCHOOL KHIRKIYAN BARGADIYA PURANPUR PILIBH,79,68,40,39,43,25,49.4,37.7,29.6,36.8,Slightly Boys Heavy,Moving to Boys Dominant,True
PILIBHIT,PURANPUR,9210721503,GOVERNMENT HIGH SCHOOL MURAINA GAURI PURANPUR,38,50,21,17,22,28,44.7,62.5,58.3,56.0,Slightly Girls Heavy,Moving to Girls Dominant,False
PILIBHIT,PURANPUR,9210707902,"GOVERNMENT INTER COLLEGE, GABHIYA SAHRAI PURANPUR",861,608,452,409,290,318,47.5,50.6,48.2,52.3,Balanced,Stable,False
PRATAPGARH,AASPUR-DEOSARA,9430103805,G H S S DHARAHARA,69,103,30,39,44,59,56.5,57.9,58.6,57.3,Slightly Girls Heavy,Stable,False
PRATAPGARH,AASPUR-DEOSARA,9430100103,"GOVT. H.S.S, ATRAURA",29,48,22,7,12,36,24.1,61.5,72.7,75.0,Slightly Girls Heavy,Moving to Girls Dominant,False
PRATAPGARH,AASPUR-DEOSARA,9430107403,GOVT. HIGHER SECONDARY SCHOOL,72,96,38,34,40,56,47.2,46.0,48.1,58.3,Slightly Girls Heavy,Moving to Girls Dominant,False
PRATAPGARH,AASPUR-DEOSARA,9430106703,Pt Deendayal Upadhyay Govt Model Inter College Mahuli Aspur Devsara,65,143,32,33,79,64,50.8,41.2,43.4,44.8,Slightly Boys Heavy,Stable,False
PRATAPGARH,AASPUR-DEOSARA,9430100605,S.C.B.S.J.M.G.G.I.C.,166,174,0,166,0,174,100.0,100.0,100.0,100.0,Girls Only School,Stable,False
PRATAPGARH,BABA BHELKHARNATH,9431903303,GOVT. H.S.SCHOOL RASULAHA PRATAPGARH,18,23,11,7,9,14,38.9,56.2,60.7,60.9,Slightly Girls Heavy,Moving to Girls Dominant,False
PRATAPGARH,BABA BHELKHARNATH,9431905303,GOVT. HIGHER SECONDRY SCHOOL KANPA,35,81,12,23,46,35,65.7,59.5,50.9,43.2,Slightly Boys Heavy,Moving to Boys Dominant,True
PRATAPGARH,BABAGANJ,9430207309,GOVT. H.S.SCHOOL LARU KUNDA PRATAPGARH,11,41,5,6,22,19,54.5,50.0,57.7,46.3,Balanced,Stable,False
PRATAPGARH,BABAGANJ,9430206004,Pt Deendayal Upadhyay Govt Model Inter College Mahewa Malkiya Babaganj,197,237,96,101,132,105,51.3,45.3,50.2,44.3,Slightly Boys Heavy,Stable,False
PRATAPGARH,BIHAR,9430305402,GOVT. GIRLS H.SEC. SCHOOL,150,132,0,150,0,132,100.0,100.0,100.0,100.0,Girls Only School,Stable,False
PRATAPGARH,BIHAR,9430303703,GOVT. H S S DEVRI HARDO PATTI,52,60,31,21,39,21,40.4,45.5,44.7,35.0,Slightly Boys Heavy,Stable,False
PRATAPGARH,BIHAR,9430305606,GOVT. H.S. SCHOOL BEDHAN GOPALPUR PRATAPGARH,108,112,44,64,64,48,59.3,52.1,44.5,42.9,Slightly Boys Heavy,Moving to Boys Dominant,True
PRATAPGARH,CITY(PRATAPGARH BELHA),9430401003,G I C PRATAPGARH,1162,960,1162,0,960,0,0.0,0.0,0.0,0.0,Boys Only School,Stable,True
PRATAPGARH,CITY(PRATAPGARH BELHA),9430402706,GGIC,1407,1257,0,1407,0,1257,100.0,100.0,100.0,100.0,Girls Only School,Stable,False
PRATAPGARH,GAURA,9431807602,G I C SEKHUPUR,196,202,91,105,103,99,53.6,54.8,53.6,49.0,Balanced,Stable,False
PRATAPGARH,GAURA,9431803804,GHS NAIKOT,135,142,55,80,66,76,59.3,64.5,54.1,53.5,Balanced,Stable,False
PRATAPGARH,GAURA,9431805403,GOVT. GIRLS INTER COLLEGE,80,176,0,80,0,176,100.0,100.0,100.0,100.0,Girls Only School,Stable,False
PRATAPGARH,GAURA,9431803304,"GOVT. H.S. SCHOOL, DAMDAM, PRATAPGARH",88,100,52,36,46,54,40.9,43.6,42.0,54.0,Balanced,Moving to Girls Dominant,False
PRATAPGARH,GAURA,9431808606,GOVT. HIGHER SECONDRY SCHOOL SULTANPUR,164,194,88,76,86,108,46.3,43.6,51.5,55.7,Slightly Girls Heavy,Stable,False
PRATAPGARH,KALAKANKER,9430607301,GGIC Manikpur,328,246,0,328,0,246,100.0,100.0,100.0,100.0,Girls Only School,Stable,False
PRATAPGARH,KALAKANKER,9430607106,GOVT. H.S. SCHOOL VAZIDPUR KALAKANKAR PRATAPGARH,47,48,27,20,27,21,42.6,41.0,37.1,43.7,Slightly Boys Heavy,Stable,False
PRATAPGARH,KALAKANKER,9430604504,Pt Deendayal Upadhyay Govt Model Inter College Murassapur Kalakankar,83,121,50,33,76,45,39.8,41.9,39.6,37.2,Slightly Boys Heavy,Stable,False
PRATAPGARH,LALGANJ,9430803002,G G I C SITALMAU,78,61,0,78,0,61,100.0,100.0,100.0,100.0,Girls Only School,Stable,False
PRATAPGARH,LAXMANPUR,9430906504,GOVT. HIGHER SEC. SCHOOL SHEETAL PATTI,60,93,30,30,35,58,50.0,47.5,46.5,62.4,Slightly Girls Heavy,Moving to Girls Dominant,False
PRATAPGARH,LAXMANPUR,9430906409,GOVT. HIGHER SECONDRY SCHOOL,117,109,57,60,61,48,51.3,44.4,50.0,44.0,Slightly Boys Heavy,Stable,False
PRATAPGARH,MANDHATA,9431004704,G H S S PURAILA,92,83,54,38,47,36,41.3,60.6,62.8,43.4,Slightly Boys Heavy,Stable,False
PRATAPGARH,MANDHATA,9431001101,GOVT. GIRLS INTER COLLEGE,428,241,0,428,0,241,100.0,100.0,100.0,100.0,Girls Only School,Stable,False
PRATAPGARH,MANGRAURA,9431108108,G H S VARI KALA,21,52,10,11,26,26,52.4,54.2,62.1,50.0,Balanced,Stable,False
PRATAPGARH,MANGRAURA,9431111005,GOVT. INTRE HOGHE SECONDARY SCHOOL,84,131,42,42,67,64,50.0,44.8,52.2,48.9,Balanced,Stable,False
PRATAPGARH,PATTI,9431204804,G H S BASAULI,51,113,13,38,38,75,74.5,63.2,60.7,66.4,Slightly Girls Heavy,Stable,False
PRATAPGARH,PATTI,9431201004,GOVT H S SCHOOL KUKUWAR,150,130,67,83,56,74,55.3,60.8,53.4,56.9,Slightly Girls Heavy,Stable,False
PRATAPGARH,PATTI,9431203636,RAM AZOR CHAURSIYA  R.B. I.C. PATTI PRATAPGARH,117,121,0,117,0,121,100.0,100.0,100.0,100.0,Girls Only School,Stable,False
PRATAPGARH,SADWA-CHANDRIKA,9431505603,GOVT. H.S.S. LOHANG PATTI  PRATAPGARH,86,129,63,23,74,55,26.7,30.7,40.9,42.6,Slightly Boys Heavy,Moving to Girls Dominant,False
PRATAPGARH,SADWA-CHANDRIKA,9431507205,GOVT. INTER COLLEGE,290,195,133,157,96,99,54.1,57.7,55.1,50.8,Balanced,Stable,False
PRATAPGARH,SANGIPUR,9431406808,GHS RAJAPUR,86,108,23,63,58,50,73.3,63.3,42.5,46.3,Balanced,Moving to Boys Dominant,True
PRATAPGARH,SANGIPUR,9431401003,GOVERNMENT HIGHER SECONDARY SCHOOL,24,48,8,16,3,45,66.7,81.8,95.1,93.7,Girls Dominated,Moving to Girls Dominant,False
PRATAPGARH,SANGIPUR,9431407605,GOVT.GIRLS INTER COLLEGE,129,100,0,129,0,100,100.0,100.0,100.0,100.0,Girls Only School,Stable,False
PRATAPGARH,SHIVGARH,9431709804,G I C CHANDI GOVINDPUR,292,319,125,167,134,185,57.2,54.8,56.8,58.0,Slightly Girls Heavy,Stable,False
PRATAPGARH,SHIVGARH,9431700203,GOVT. H S SCHOOL IMLIDAD,8,26,6,2,4,22,25.0,69.6,84.6,84.6,Girls Dominated,Moving to Girls Dominant,False
PRATAPGARH,SHIVGARH,9431707903,GOVT. HIGHER SECONDRY SCHOOL HARNAHPUR,48,42,25,23,23,19,47.9,57.1,48.1,45.2,Balanced,Stable,False
PRATAPGARH,SHIVGARH,9431708707,Pt Deendayal Upadhyay Govt Model Inter College Kuradeeh Shivgarh,82,155,57,25,98,57,30.5,28.4,27.0,36.8,Slightly Boys Heavy,Stable,False
PRAYAGRAJ,BAHARIYA,9451904506,PT D.D.U.G.M.INTER COLLEGE,307,429,80,227,97,332,73.9,80.0,82.8,77.4,Girls Dominated,Stable,False
PRAYAGRAJ,BAHARIYA,9451907203,RAJKIYA U M VIDHYALAYA MIRAKPUR BAHARIYA,159,155,66,93,67,88,58.5,54.6,62.8,56.8,Slightly Girls Heavy,Stable,False
PRAYAGRAJ,CHAKA,9451306506,ABHINAV VIDYALAYA,409,333,226,183,184,149,44.7,47.2,45.3,44.7,Slightly Boys Heavy,Stable,False
PRAYAGRAJ,CHAKA,9451306505,RAJKIYA U.M.V. DANDU PUR,236,240,97,139,101,139,58.9,49.1,54.2,57.9,Slightly Girls Heavy,Stable,False
PRAYAGRAJ,CHAKA,9451300803,RAJKIYA U.M.V. MOHABBAT GANJ,167,131,76,91,63,68,54.5,50.0,51.0,51.9,Balanced,Stable,False
PRAYAGRAJ,DHANUPUR,9451501409,GOVERNMENT GIRLS INTER COLLEGE,100,164,0,100,0,164,100.0,100.0,100.0,100.0,Girls Only School,Stable,False
PRAYAGRAJ,HANDIA,9452002508,G.G.I.C. HANDIYA,282,252,0,282,0,252,100.0,100.0,100.0,100.0,Girls Only School,Stable,False
PRAYAGRAJ,HANDIA,9452004803,RAJKIYA U.M.V.,64,61,31,33,24,37,51.6,56.0,61.2,60.7,Slightly Girls Heavy,Stable,False
PRAYAGRAJ,JASARA,9450306508,G.G.I.C. JASARA,468,478,0,468,0,478,100.0,100.0,100.0,100.0,Girls Only School,Stable,False
PRAYAGRAJ,JASARA,9450301603,RAJKIYA U.M.V.PARVEJABAD,175,161,87,88,80,81,50.3,55.3,55.6,50.3,Balanced,Stable,False
PRAYAGRAJ,KARCHHANA,9451806805,G.G.I.C. MUGARI  RAMPUR,673,703,0,673,0,703,100.0,100.0,100.0,100.0,Girls Only School,Stable,False
PRAYAGRAJ,KORAON,9451010913,RAJKIYA U M VIDHYALAYA KHIRI KORAON PRAYAGRAJ,170,136,74,96,67,69,56.5,54.8,44.4,50.7,Balanced,Stable,False
PRAYAGRAJ,KORAON,9451004607,RAJKIYA U.M.V. SANSAR PUR,53,85,19,34,33,52,64.1,67.2,63.0,61.2,Slightly Girls Heavy,Stable,False
PRAYAGRAJ,MANDA,9451606902,GOVT. INTER COLLEGE,1475,1146,777,698,554,592,47.3,46.8,49.3,51.7,Balanced,Stable,False
PRAYAGRAJ,MANDA,9451608203,GOVT.H.S.SCHOOL,32,39,18,14,18,21,43.7,45.5,52.1,53.8,Balanced,Moving to Girls Dominant,False
PRAYAGRAJ,MANDA,9451605402,RAJKIYA U.M.V. BERI MANDA,876,905,425,451,422,483,51.5,54.0,52.5,53.4,Balanced,Stable,False
PRAYAGRAJ,MANDA,9451604004,RAJKIYA U.M.V. DIGHIYA,269,135,158,111,53,82,41.3,48.6,51.2,60.7,Slightly Girls Heavy,Moving to Girls Dominant,False
PRAYAGRAJ,MAUAIMA,9450900303,RAJKIYA U M VIDHAYALAYA JOGIPUR MAUAIMA ,37,52,16,21,32,20,56.8,63.2,52.2,38.5,Slightly Boys Heavy,Moving to Boys Dominant,True
PRAYAGRAJ,MEJA,9450509801,RAJKIYA KANYA U.M.V. JEWANIYA,22,142,0,22,78,64,100.0,100.0,53.9,45.1,Balanced,Moving to Boys Dominant,True
PRAYAGRAJ,MEJA,9450504705,RAJKIYA U.M.V. PIPRANWA,82,104,33,49,51,53,59.8,58.4,50.9,51.0,Balanced,Stable,False
PRAYAGRAJ,NAGAR CHHETRA,9452200413,G.G.I.C. OLD KATARA,170,218,0,170,0,218,100.0,100.0,100.0,100.0,Girls Only School,Stable,False
PRAYAGRAJ,NAGAR CHHETRA,9452200605,G.G.I.C. PHAPHAMAU,832,651,0,832,0,651,100.0,100.0,100.0,100.0,Girls Only School,Stable,False
PRAYAGRAJ,NAGAR CHHETRA,9452209914,GOVT. GIRLS INTER COLLEGE,475,525,0,475,0,525,100.0,100.0,100.0,100.0,Girls Only School,Stable,False
PRAYAGRAJ,NAGAR CHHETRA,9452211107,GOVT. INTER COLLEGE,4300,3209,4300,0,3209,0,0.0,0.0,0.0,0.0,Boys Only School,Stable,True
PRAYAGRAJ,PHOOLPUR,9450609903,GOVERNMENT GIRLS INTER COLLEGE PHOOLPUR,650,638,0,650,0,638,100.0,100.0,100.0,100.0,Girls Only School,Stable,False
PRAYAGRAJ,PHOOLPUR,9450601903,RAJKIYA U.M.V. NANDOUT,103,93,55,48,46,47,46.6,44.3,48.4,50.5,Balanced,Stable,False
PRAYAGRAJ,PRATAP PUR,9450403504,RAJKIYA U M VIDHAYALAYA CHANETHU PRATAPPUR,75,99,32,43,41,58,57.3,53.2,51.9,58.6,Slightly Girls Heavy,Stable,False
PRAYAGRAJ,SAIDABAD,9451106008,GOVT. GIRLS INTER COOLEGE,390,532,0,390,0,532,100.0,99.5,100.0,100.0,Girls Only School,Stable,False
PRAYAGRAJ,SHANKAR GARH,9450100108,G.G.I.C. SHANKARGARH,233,398,0,233,0,398,100.0,100.0,100.0,100.0,Girls Only School,Stable,False
PRAYAGRAJ,SHANKAR GARH,9450104704,GOVT. GIRLS I.C. NARIBARI,303,357,0,303,0,357,100.0,100.0,100.0,100.0,Girls Only School,Stable,False
PRAYAGRAJ,SHANKAR GARH,9450101503,RAJKIYA U.M.V. SONVEY,57,106,30,27,61,45,47.4,39.7,34.3,42.5,Slightly Boys Heavy,Stable,False
PRAYAGRAJ,SORAON,9450706814,GOVERNMENT  HIGH SCHOOL GOHARI ,359,369,192,167,165,204,46.5,47.0,52.4,55.3,Slightly Girls Heavy,Stable,False
PRAYAGRAJ,URUWA,9452100117,GOVERNMENT GIRLS HIGH SCHOOL SIRSA,52,59,11,41,4,55,78.8,81.6,91.5,93.2,Girls Dominated,Moving to Girls Dominant,False
PRAYAGRAJ,URUWA,9452101104,PT Deen Dayal Updhyay Rajkiya Madel School Somhan,332,243,184,148,130,113,44.6,44.1,44.6,46.5,Balanced,Stable,False
RAE BARELI,AMAWAN,9280207003,G.G.I.C. HARIYAWAN RAEBARELI,290,246,0,290,0,246,100.0,100.0,100.0,100.0,Girls Only School,Stable,False
RAE BARELI,AMAWAN,9280203203,"GOVT. HIGHER  SCHOOL, PINDARI KALAN",180,204,76,104,98,106,57.8,54.4,55.1,52.0,Balanced,Stable,False
RAE BARELI,BACHHRAWAN,9280403609,GOVT. GIRLS INTER COLLEGE,720,792,0,720,0,792,100.0,100.0,100.0,100.0,Girls Only School,Stable,False
RAE BARELI,CHHATOH,9282401706,GIC CHHATOH,43,51,6,37,17,34,86.0,75.6,72.2,66.7,Slightly Girls Heavy,Moving to Boys Dominant,True
RAE BARELI,CHHATOH,9282401707,GOV. GIRLS HIGHER SECONDERY CHHATOH,48,32,14,34,2,30,70.8,64.9,76.5,93.7,Girls Dominated,Moving to Girls Dominant,False
RAE BARELI,CHHATOH,9281701904,PT DEEN DAYAL UPADHYAY MODEL INTER COLLEGE,386,444,207,179,228,216,46.4,45.0,46.9,48.6,Balanced,Stable,False
RAE BARELI,DALMAU,9281905005,PT DEEN DAYAL UPADHYAY MODEL INTER COLLEGE,178,237,80,98,113,124,55.1,53.8,52.8,52.3,Balanced,Stable,False
RAE BARELI,DEEH,9282306503,GOVT.  INTER COLLEGE,1285,1245,911,374,933,312,29.1,24.4,25.8,25.1,Slightly Boys Heavy,Stable,False
RAE BARELI,DEEH,9282306504,GOVT. GIRLS INTER COLLEGE,741,799,0,741,0,799,100.0,100.0,100.0,100.0,Girls Only School,Stable,False
RAE BARELI,DEEH,9282306106,RAJKIYE HAIGH SCHOOL VIRNAWO,154,147,76,78,77,70,50.6,52.9,51.5,47.6,Balanced,Stable,False
RAE BARELI,GAURA,9281002306,"GOVT. HIGHER SECONDARY SCHOOL, JALAL PUR DHAI",101,135,77,24,90,45,23.8,30.1,37.7,33.3,Slightly Boys Heavy,Stable,False
RAE BARELI,GAURA,9281003801,"GOVT.GIRLS INTER COLLAGE, GURGUJ PUR",427,370,0,427,0,370,100.0,100.0,100.0,100.0,Girls Only School,Stable,False
RAE BARELI,HARCHANDPUR,9280302307,"G.G. HIGHER SECONDARY SCHOOL, PASCHIM GAON",73,53,35,38,17,36,52.1,38.3,39.7,67.9,Slightly Girls Heavy,Moving to Girls Dominant,False
RAE BARELI,HARCHANDPUR,9280301504,G.G.H. SCHOOL BALA,142,182,31,111,47,135,78.2,81.1,76.7,74.2,Slightly Girls Heavy,Stable,False
RAE BARELI,HARCHANDPUR,9280302402,"GOVT. INTER COLLAGE, TERA BAROULA",302,230,155,147,103,127,48.7,49.5,52.3,55.2,Slightly Girls Heavy,Stable,False
RAE BARELI,JAGATPUR,9281105303,GOVT. HIGH SCHOOL ROJHAIYA BHIKHAMSHAH,95,131,31,64,73,58,67.4,59.8,52.0,44.3,Slightly Boys Heavy,Moving to Boys Dominant,True
RAE BARELI,JAGATPUR,9281100109,"GOVT. HIGHER SECONDARY SCHOOL, JAGATPUR",59,85,23,36,23,62,61.0,73.9,72.3,72.9,Slightly Girls Heavy,Moving to Girls Dominant,False
RAE BARELI,KHIRON,9280801003,"GOVT. GIRLS INTER COLLAGE, KHIRON",160,199,56,104,84,115,65.0,63.1,59.5,57.8,Slightly Girls Heavy,Stable,False
RAE BARELI,KHIRON,9280804204,JAWAHAR GOVT. INTER COLLEGE,319,350,154,165,181,169,51.7,51.2,47.7,48.3,Balanced,Stable,False
RAE BARELI,KHIRON,9280802702,PT DEEN DAYAL UPADHYAY MODEL INTER COLLEGE HARIPUR NIHASTHA,85,88,35,50,36,52,58.8,57.5,59.0,59.1,Slightly Girls Heavy,Stable,False
RAE BARELI,LALGANJ,9282001127,"GOVT. GIRLS INTER COLLAGE, LALGANJ",121,121,0,121,0,121,100.0,100.0,100.0,100.0,Girls Only School,Stable,False
RAE BARELI,LALGANJ,9282002304,GOVT. HIGH SCHOOL CHANDITIKAR,75,74,32,43,23,51,57.3,52.7,50.7,68.9,Slightly Girls Heavy,Moving to Girls Dominant,False
RAE BARELI,MAHRAJGANJ,9280602902,"G.G.I.C. ATREHTA, MAHARAJGANJ",657,543,0,657,0,543,100.0,100.0,100.0,100.0,Girls Only School,Stable,False
RAE BARELI,MAHRAJGANJ,9280607104,GOVT. HIGHER SECONDARY SCHOOL MAU GARBI,77,115,41,36,51,64,46.8,56.1,56.6,55.7,Slightly Girls Heavy,Stable,False
RAE BARELI,MAHRAJGANJ,9280604203,"GOVT. HIGHER SECONDARY SCHOOL, JANAI",111,133,61,50,76,57,45.0,45.5,47.7,42.9,Slightly Boys Heavy,Stable,False
RAE BARELI,MAHRAJGANJ,9280605708,GOVT. INTER COLLEGE,1545,1325,813,732,643,682,47.4,49.3,49.0,51.5,Balanced,Stable,False
RAE BARELI,MAHRAJGANJ,9280601705,PT. DEEN DAYAL UPADDHYAY  RAJKIYA MODEL INTER COLLEGE,263,403,112,151,153,250,57.4,55.0,58.8,62.0,Slightly Girls Heavy,Stable,False
RAE BARELI,NAGAR SHETRA (RBL),9282208604,GOVT. GIRLS INTER COLLEGE,1029,787,0,1029,0,787,100.0,100.0,100.0,100.0,Girls Only School,Stable,False
RAE BARELI,NAGAR SHETRA (RBL),9282208603,GOVT. INTER COLLEGE,882,961,882,0,849,112,0.0,0.0,5.9,11.7,Boys Dominated,Moving to Girls Dominant,True
RAE BARELI,NAGAR SHETRA (RBL),9282206102,SRI K.B. SHINHA GOVT. GIRLS INTER COLLEGE,740,630,0,740,0,630,100.0,100.0,100.0,100.0,Girls Only School,Stable,False
RAE BARELI,RAHI,9280103704, GOVT. HIGH SCHOOL SANAHI,105,152,46,59,63,89,56.2,53.5,56.6,58.6,Slightly Girls Heavy,Stable,False
RAE BARELI,RAHI,9280100806,GOVT. HIGH SCHOOL BELA BHELA,111,147,52,59,73,74,53.2,54.5,50.0,50.3,Balanced,Stable,False
RAE BARELI,RAHI,9280103203,PT DEEN DAYAL UPADHYAY MODEL INTER COLLEGE,228,324,110,118,168,156,51.8,48.3,47.7,48.1,Balanced,Stable,False
RAE BARELI,ROHANIYA,9281201805,"GOVT. HIGHER SECONDARY SCHOOL, ROHANIYA",119,89,38,81,34,55,68.1,68.6,62.2,61.8,Slightly Girls Heavy,Stable,False
RAE BARELI,ROHANIYA,9281206702,"GOVT. HIGHER SECONDARY SCHOOL, TAMASGARH",54,54,23,31,31,23,57.4,60.7,46.6,42.6,Slightly Boys Heavy,Moving to Boys Dominant,True
RAE BARELI,ROHANIYA,9281200803,PT DEEN DAYAL UPADHYAY MODEL INTER COLLEGE,71,169,28,43,68,101,60.6,58.1,65.8,59.8,Slightly Girls Heavy,Stable,False
RAE BARELI,SALON,9282500701,GGIC SALON,412,313,0,412,0,313,100.0,100.0,100.0,100.0,Girls Only School,Stable,False
RAE BARELI,SALON,9282500105,RAJKIYE HIGH SCHOOL SOOCHI,535,432,230,305,178,254,57.0,55.6,60.2,58.8,Slightly Girls Heavy,Stable,False
RAE BARELI,SARENI,9282100106,GOVERNMENT HIGH SCHOOL PURE TRIVEDI,83,98,45,38,52,46,45.8,40.6,44.4,46.9,Balanced,Stable,False
RAE BARELI,SATAON,9280906108,"GOVT. INTER COLLAGE, A. BUJURG",246,254,99,147,111,143,59.8,60.9,57.3,56.3,Slightly Girls Heavy,Stable,False
RAE BARELI,SHIVGARH,9280500703,"G.G.HIGHER SECONDARY SCHOOL, OSAAH",215,170,110,105,67,103,48.8,57.8,66.2,60.6,Slightly Girls Heavy,Moving to Girls Dominant,False
RAMPUR,BILASPUR,9050211003,GOVT HSS AHRO BILASHPUR,88,36,51,37,18,18,42.0,43.2,49.1,50.0,Balanced,Stable,False
RAMPUR,BILASPUR,9050200102,GOVT HSS GAJRAULA BILASPUR,102,92,59,43,41,51,42.2,47.6,58.0,55.4,Slightly Girls Heavy,Moving to Girls Dominant,False
RAMPUR,BILASPUR,9050233005,GOVT IC ASHOK NAGAR,368,269,194,174,133,136,47.3,52.2,50.0,50.6,Balanced,Stable,False
RAMPUR,BILASPUR,9050211715,GOVT IC BILASPUR,41,96,18,23,47,49,56.1,39.2,50.0,51.0,Balanced,Stable,False
RAMPUR,BILASPUR,9050211713,GOVT IC KEMRI,684,512,396,288,271,241,42.1,44.0,44.9,47.1,Balanced,Stable,False
RAMPUR,BILASPUR,9050209107,"GOVT INTER COLLEGE MANUNAGAR, BILASPUR",56,45,31,25,17,28,44.6,47.2,51.9,62.2,Slightly Girls Heavy,Moving to Girls Dominant,False
RAMPUR,CHAMRAUVA,9050402710,GOVT HSS CHAMRAUVA,57,141,27,30,19,122,52.6,53.8,79.8,86.5,Girls Dominated,Moving to Girls Dominant,False
RAMPUR,CHAMRAUVA,9050410802,"GOVT INTER COLLEGE, MANKARA, BLOCK CHAMRAUVA SADAR RAMPUR",137,439,72,65,212,227,47.4,49.3,52.6,51.7,Balanced,Stable,False
RAMPUR,CHAMRAUVA,9050402603,GOVT. H.S.S. NAUGAVAN,152,149,61,91,52,97,59.9,59.7,66.4,65.1,Slightly Girls Heavy,Stable,False
RAMPUR,CHAMRAUVA,9050409918,PT.DEEN DYAL UPADHYAY GOVT. MODEL IC KAKRAUVA,577,675,299,278,318,357,48.2,51.8,52.3,52.9,Balanced,Stable,False
RAMPUR,MILAK,9050514917,"GOVT INTER COLLEGE, DHAMAURA, MILAK",1235,1067,696,539,557,510,43.6,45.7,47.5,47.8,Balanced,Stable,False
RAMPUR,SAID NAGAR,9050609304,GOVT HIGH SCHOOL KHANDIA,80,89,38,42,43,46,52.5,45.1,57.1,51.7,Balanced,Stable,False
