BUDAUN,SAMRER,9191103104,"GOVT. HS SCHOOL,SEERJAYLAL",96,98,55,41,56,42,42.7,41.5,44.7,42.9,Slightly Boys Heavy,Stable,False
BUDAUN,UJHANI,9190201510,"GOVT. HS SCHOOL,DEHMU",127,88,76,51,53,35,40.2,43.7,52.3,39.8,Slightly Boys Heavy,Stable,False
BUDAUN,UJHANI,9190201511,"GOVT. HS SCHOOL,SIKANDRABAD",71,51,36,35,15,36,49.3,46.1,52.4,70.6,Slightly Girls Heavy,Moving to Girls Dominant,False
BUDAUN,USAWAN,9190903606,"GOVT. HIGH SCHOOL, BHUNDI",188,143,119,69,88,55,36.7,34.6,30.0,38.5,Slightly Boys Heavy,Stable,False
BUDAUN,WAZEERGANJ,9191203129,"GOVT. GIRLS INTER COLLEGE,SAIDPUR",71,78,0,71,0,78,100.0,100.0,100.0,100.0,Girls Only School,Stable,False
BUDAUN,WAZEERGANJ,9191202502,"GOVT. HIGH SCHOOL, SOHI",61,115,31,30,54,61,49.2,53.2,53.4,53.0,Balanced,Stable,False
BUDAUN,WAZEERGANJ,9191205310,"GOVT. HS SCHOOL,NAULI HARNATHPUR",34,50,14,20,23,27,58.8,61.9,63.6,54.0,Balanced,Stable,False
BULANDSHAHR,AGAUTA,9113103504,GOVT HS LUHARLI,18,41,2,16,20,21,88.9,84.2,56.7,51.2,Balanced,Moving to Boys Dominant,True
BULANDSHAHR,ANOOPSHAHAR,9111300603,PT DEENDAYAL UPADHYAY GOVT MODEL INTER COLLEGE SAURAKH,49,137,30,19,89,48,38.8,34.3,31.9,35.0,Slightly Boys Heavy,Stable,False
BULANDSHAHR,ANOOPSHAHAR,9111306105,RAJKIYA UMV BAGSARA,38,53,1,37,10,43,97.4,96.3,88.1,81.1,Girls Dominated,Moving to Boys Dominant,True
BULANDSHAHR,ANOOPSHAHAR,9111305009,RAJKIYA UMV BIROLI,153,177,80,73,105,72,47.7,40.4,40.0,40.7,Slightly Boys Heavy,Stable,False
BULANDSHAHR,ARNIA,9110408204,PT DEENDAYAL UPADHYAY GOVT MODEL INTER COLLEGE DHAKPURA,43,91,29,14,58,33,32.6,31.7,39.5,36.3,Slightly Boys Heavy,Stable,False
BULANDSHAHR,ARNIA,9110406002,RAJKIYA INTER COLLEGE THAGAURA,30,81,13,17,34,47,56.7,55.6,61.4,58.0,Slightly Girls Heavy,Stable,False
BULANDSHAHR,ARNIA,9110403708,RAJKIYA UMV AGHORA,64,89,23,41,39,50,64.1,59.7,51.3,56.2,Slightly Girls Heavy,Stable,False
BULANDSHAHR,B.B.NAGAR,9110700117,GOVT. GIRLS INTER COLLEGE,824,786,0,824,0,786,100.0,100.0,100.0,100.0,Girls Only School,Stable,False
BULANDSHAHR,B.B.NAGAR,9110703906,RAJKIYA HIGH SCH MADONA,43,71,13,30,22,49,69.8,73.2,67.2,69.0,Slightly Girls Heavy,Stable,False
BULANDSHAHR,BULANDSHAHR,9110106909,PT DEENDAYAL UPADHYAY GOVT MODEL INTER COLLEGE NAITHALA HASANPUR,172,185,73,99,85,100,57.6,56.4,57.7,54.1,Balanced,Stable,False
BULANDSHAHR,BULANDSHAHR,9110101704,RAJKIYA H/S DHAMRAWALI,133,143,70,63,81,62,47.4,45.1,39.7,43.4,Slightly Boys Heavy,Stable,False
BULANDSHAHR,BULANDSHAHR,9110104605,RAJKIYA HIGH SCH JALKHERA,64,56,32,32,16,40,50.0,44.4,63.6,71.4,Slightly Girls Heavy,Moving to Girls Dominant,False
BULANDSHAHR,BULANDSHAHR,9110105403,RAJKIYA HIGH SCH KAJAMPUR DEVLI,97,99,52,45,57,42,46.4,43.5,45.8,42.4,Slightly Boys Heavy,Stable,False
BULANDSHAHR,BULANDSHAHR,9110104703,RAJKIYA INTER COLLEGE,184,162,81,103,77,85,56.0,55.8,53.5,52.5,Balanced,Stable,False
BULANDSHAHR,BULANDSHAHR,9110109402,RAJKIYA INTER COLLEGE KHETALPUR BHASAULI,111,145,38,73,67,78,65.8,58.4,57.3,53.8,Balanced,Moving to Boys Dominant,True
BULANDSHAHR,BULANDSHAR NAGAR,9112900123,GOVERMENT INTER COLLEGE,503,725,503,0,725,0,0.0,0.0,0.0,0.0,Boys Only School,Stable,True
BULANDSHAHR,BULANDSHAR NAGAR,9112900133,GOVT GIRLS INTER COLLEGE,1611,1625,0,1611,0,1625,100.0,100.0,100.0,100.0,Girls Only School,Stable,False
BULANDSHAHR,DANPUR,9110302703,GOVT HS AIDALPUR,28,33,7,21,15,18,75.0,66.7,68.7,54.5,Balanced,Moving to Boys Dominant,True
BULANDSHAHR,DANPUR,9110303603,GOVT HS KANHERA,75,90,37,38,53,37,50.7,55.2,44.6,41.1,Slightly Boys Heavy,Stable,False
BULANDSHAHR,DANPUR,9110300104,GOVT. GIRLS INTER COLLEGE,27,44,0,27,0,44,100.0,100.0,100.0,100.0,Girls Only School,Stable,False
BULANDSHAHR,DANPUR,9110300211,GOVT. JHS AKARWAS,34,68,9,25,29,39,73.5,65.7,62.3,57.4,Slightly Girls Heavy,Moving to Boys Dominant,True
BULANDSHAHR,DANPUR,9110303604,PT DEENDAYAL UPADHYAY GOVT MODEL INTER COLLEGE KANHERA,174,158,91,83,71,87,47.7,54.8,51.6,55.1,Slightly Girls Heavy,Stable,False
BULANDSHAHR,DEBAI,9110800110,"GOVERNMENT GIRLS INTER COLLEGE, JAYRAMPUR BANGAR",54,88,0,54,0,88,100.0,100.0,100.0,100.0,Girls Only School,Stable,False
BULANDSHAHR,DEBAI,9110800506,GOVT. GIRLS INTER COLLEGE BILONA ROOP,36,36,0,36,0,36,100.0,100.0,100.0,100.0,Girls Only School,Stable,False
BULANDSHAHR,DEBAI,9110803903,RAJKIYA BALIKA INTER COLLEGE PALAKESAR,266,596,0,266,0,596,100.0,100.0,100.0,100.0,Girls Only School,Stable,False
BULANDSHAHR,DEBAI,9110807504,RAJKIYA HIGH SCHOOL GHOSIPURA,68,48,43,25,14,34,36.8,36.8,52.6,70.8,Slightly Girls Heavy,Moving to Girls Dominant,False
BULANDSHAHR,DEBAI,9110805305,RAJKIYA HIGH SCHOOL SATOHA,171,167,78,93,89,78,54.4,53.3,49.0,46.7,Balanced,Stable,False
BULANDSHAHR,DEBAI,9110801803,"RAJKIYA HIGH SCHOOL, BADARPUR",47,51,16,31,20,31,66.0,67.4,72.7,60.8,Slightly Girls Heavy,Stable,False
BULANDSHAHR,GULAOTI,9111003704,PT DEENDAYAL UPADHYAY GOVT MODEL INTER COLLEGE JAINPUR,292,310,131,161,160,150,55.1,56.1,50.0,48.4,Balanced,Stable,False
BULANDSHAHR,GULAOTI,9111000704,RAJKIYA UMV SAINTHA,49,113,22,27,66,47,55.1,45.1,43.3,41.6,Slightly Boys Heavy,Moving to Boys Dominant,True
BULANDSHAHR,JAHAGIRABAD,9111206006,PT DEENDAYAL UPADHYAY GOVT MODEL INTER COLLEGE KOTHARA KURAINA,90,178,35,55,91,87,61.1,56.9,51.6,48.9,Balanced,Moving to Boys Dominant,True
BULANDSHAHR,JAHAGIRABAD,9111201504,RAJKIYA HIGH SCH DHAKROLI,51,70,14,37,31,39,72.5,56.2,53.1,55.7,Slightly Girls Heavy,Moving to Boys Dominant,True
BULANDSHAHR,JAHAGIRABAD,9111200903,RAJKIYA HIGH SCH KOTHERA,25,44,13,12,16,28,48.0,40.0,53.1,63.6,Slightly Girls Heavy,Moving to Girls Dominant,False
BULANDSHAHR,KHURJA,9111101003,PT DEENDAYAL UPADHYAY GOVT MODEL INTER COLLEGE AHIRAULI,18,160,7,11,81,79,61.1,45.3,44.9,49.4,Balanced,Moving to Boys Dominant,True
BULANDSHAHR,KHURJA,9111105304,RAJKIYA UMV NAGLA ROOMI,56,72,35,21,29,43,37.5,38.3,59.0,59.7,Slightly Girls Heavy,Moving to Girls Dominant,False
BULANDSHAHR,LAKHAWATI,9110901904,RAJKIYA UMV RAJGARHI,53,64,31,22,38,26,41.5,37.9,34.4,40.6,Slightly Boys Heavy,Stable,False
BULANDSHAHR,PAHASU,9111405903,GOVT. GIRLS INTER COLLEGE PAHASU,211,214,0,211,0,214,100.0,100.0,100.0,100.0,Girls Only School,Stable,False
BULANDSHAHR,PAHASU,9111400503,GOVT. HIGHER SEC. SCH,63,107,28,35,41,66,55.6,51.1,61.0,61.7,Slightly Girls Heavy,Stable,False
BULANDSHAHR,PAHASU,9111402903,PT DEENDAYAL UPADHYAY GOVT MODEL INTER COLLEGE RASOOLGARH,50,242,19,31,121,121,62.0,50.0,50.3,50.0,Balanced,Moving to Boys Dominant,True
BULANDSHAHR,PAHASU,9111409604,RAJKIYA HIGH SCHOOL ALLI MUBARAK PUR,21,25,5,16,7,18,76.2,83.3,80.0,72.0,Slightly Girls Heavy,Stable,False
BULANDSHAHR,SHIKARPUR,9110200115,G.G.I.C.,279,221,0,279,0,221,100.0,100.0,100.0,100.0,Girls Only School,Stable,False
BULANDSHAHR,SHIKARPUR,9110201603,PT DEENDAYAL UPADHYAY GOVT MODEL INTER COLLEGE JAKHAITA,38,94,8,30,49,45,78.9,64.3,46.9,47.9,Balanced,Moving to Boys Dominant,True
BULANDSHAHR,SHIKARPUR,9110204003,RAJKIYA HIGH SCHOOL,22,57,6,16,25,32,72.7,65.1,57.4,56.1,Slightly Girls Heavy,Moving to Boys Dominant,True
BULANDSHAHR,SIKANDRABAD,9111500107,GOVT. GIRLS INTER COLLEGE,55,90,0,55,0,90,100.0,100.0,100.0,100.0,Girls Only School,Stable,False
BULANDSHAHR,SIKANDRABAD,9111511303,RAJKIYA UMV NAI BASTI,57,85,32,25,49,36,43.9,36.4,45.1,42.4,Slightly Boys Heavy,Stable,False
BULANDSHAHR,SYNA,9110601106,RAJKIYA UMV MAKADI,25,51,7,18,14,37,72.0,75.7,78.8,72.5,Slightly Girls Heavy,Stable,False
BULANDSHAHR,UCHAGAON,9110500504,GOVT HS FAREEDA BANGAR,33,62,14,19,31,31,57.6,62.5,40.0,50.0,Balanced,Stable,False
BULANDSHAHR,UCHAGAON,9110507203,PT DEENDAYAL UPADHYAY GOVT MODEL INTER COLLEGE TIMARPUR,134,208,73,61,121,87,45.5,51.7,43.7,41.8,Slightly Boys Heavy,Stable,False
BULANDSHAHR,UCHAGAON,9110505517,RAJKIYA HIGH SCHOOL,23,22,5,18,12,10,78.3,73.3,54.5,45.5,Balanced,Moving to Boys Dominant,True
CHANDAULI,BARAHANI,9660700806,G.G.I.C SAIYADRAJA,679,971,0,679,0,971,100.0,100.0,100.0,100.0,Girls Only School,Stable,False
CHANDAULI,BARAHANI,9660705803,GHS DAITHA,58,52,29,29,25,27,50.0,45.8,46.4,51.9,Balanced,Stable,False
CHANDAULI,BARAHANI,9660701103,GHS KANDAWA,22,49,10,12,31,18,54.5,50.0,38.1,36.7,Slightly Boys Heavy,Moving to Boys Dominant,True
CHANDAULI,BARAHANI,9660703804,GHS KHAJARA,19,46,7,12,20,26,63.2,66.7,62.5,56.5,Slightly Girls Heavy,Stable,False
CHANDAULI,BARAHANI,9660701402,GHS NOORI,35,52,19,16,34,18,45.7,60.0,51.1,34.6,Slightly Boys Heavy,Moving to Boys Dominant,True
CHANDAULI,CHAHANIYA,9660302802,GHS KURAHANA,51,83,20,31,39,44,60.8,66.7,53.7,53.0,Balanced,Stable,False
CHANDAULI,CHAKIYA,9660211804,ADITYA NARAYAN GOVT. I.C. CHAKIYA,2863,3378,1724,1139,1884,1494,39.8,39.9,43.7,44.2,Slightly Boys Heavy,Stable,False
CHANDAULI,CHAKIYA,9660211203,GHS BITHAWAL KALA,59,135,28,31,64,71,52.5,50.5,50.0,52.6,Balanced,Stable,False
CHANDAULI,CHAKIYA,9660206803,GHS GARALA,86,72,38,48,33,39,55.8,62.7,67.7,54.2,Balanced,Stable,False
CHANDAULI,CHAKIYA,9660203305,GHS GAYGHAT,31,44,17,14,23,21,45.2,61.1,50.0,47.7,Balanced,Stable,False
CHANDAULI,CHANDAULI,9660107602,GHS KHURUHUJA,76,140,28,48,69,71,63.2,51.5,51.6,50.7,Balanced,Moving to Boys Dominant,True
CHANDAULI,CHANDAULI,9660105404,GHS KONIYA,35,80,22,13,37,43,37.1,48.1,51.9,53.7,Balanced,Moving to Girls Dominant,False
CHANDAULI,CHANDAULI,9660117401,GHS PAITUA,52,75,12,40,25,50,76.9,65.6,60.6,66.7,Slightly Girls Heavy,Moving to Boys Dominant,True
CHANDAULI,CHANDAULI,9660109602,GHS TRIBHUVANPUR,79,117,46,33,77,40,41.8,39.1,36.6,34.2,Slightly Boys Heavy,Stable,False
CHANDAULI,NAUGARH,9660901102,GHS DEWARI KALA,64,50,42,22,23,27,34.4,50.0,60.6,54.0,Balanced,Moving to Girls Dominant,False
CHANDAULI,NAUGARH,9660902003,GHS GOLABAD,186,125,91,95,58,67,51.1,50.3,51.2,53.6,Balanced,Stable,False
CHANDAULI,NAUGARH,9660900802,GHS JAMASOT,55,59,25,30,31,28,54.5,50.0,50.0,47.5,Balanced,Stable,False
CHANDAULI,NAUGARH,9660900503,GHS LAUWARI KALA,48,44,29,19,26,18,39.6,40.9,31.0,40.9,Slightly Boys Heavy,Stable,False
CHANDAULI,NAUGARH,9660904504,GHS SONWAR,92,128,39,53,52,76,57.6,57.7,63.3,59.4,Slightly Girls Heavy,Stable,False
CHANDAULI,NAUGARH,9660902603,GHS UDITPUR SURRA,52,102,31,21,53,49,40.4,33.3,39.3,48.0,Balanced,Stable,False
CHANDAULI,NAUGARH,9660907306,GOVT. INTER COLLEGE NAUGARH,1480,1153,710,770,556,597,52.0,52.3,52.3,51.8,Balanced,Stable,False
CHANDAULI,SAKALDIHA,9660409305,GOVT. G.I.C. DIGHAWAT,151,186,0,151,0,186,100.0,100.0,100.0,100.0,Girls Only School,Stable,False
CHANDAULI,SHAHABGANJ,9660606603,GHS BANARASIYA,139,164,85,54,82,82,38.8,42.2,47.6,50.0,Balanced,Moving to Girls Dominant,False
CHANDAULI,SHAHABGANJ,9660607202,GHS KAUDIHAR,48,59,28,20,36,23,41.7,39.2,38.6,39.0,Slightly Boys Heavy,Stable,False
CHANDAULI,SHAHABGANJ,9660602903,GHS KHAKHADA,51,40,35,16,25,15,31.4,40.7,53.8,37.5,Slightly Boys Heavy,Stable,False
CHANDAULI,SHAHABGANJ,9660608003,GHS MUSAKHAND,143,118,78,65,54,64,45.5,48.0,47.0,54.2,Balanced,Stable,False
CHITRAKOOT,CHITRAKOOT,9410104506,G.I.C. GHURETANPUR,490,623,237,253,297,326,51.6,48.7,51.8,52.3,Balanced,Stable,False
CHITRAKOOT,CHITRAKOOT,9410105809,GOVT. HIGH SCHOOL BHARATKOOP,138,146,72,66,72,74,47.8,45.3,46.2,50.7,Balanced,Stable,False
CHITRAKOOT,CHITRAKOOT,9410106908,GOVT. HIGH SCHOOL RAULI KALYANPUR,137,128,61,76,45,83,55.5,52.5,57.4,64.8,Slightly Girls Heavy,Stable,False
CHITRAKOOT,CHITRAKOOT,9410103404,GOVT. HIGH SCHOOL SEMARIYA CHARANDASI,97,79,37,60,28,51,61.9,58.3,55.8,64.6,Slightly Girls Heavy,Stable,False
CHITRAKOOT,CHITRAKOOT,9410109503,GOVT. HIGH SCHOOL SHIVRAMPUR,143,105,68,75,52,53,52.4,52.3,53.2,50.5,Balanced,Stable,False
CHITRAKOOT,CHITRAKOOT (URBAN),9410600186,G.G.I.C. KARWI,531,566,0,531,0,566,100.0,100.0,100.0,100.0,Girls Only School,Stable,False
CHITRAKOOT,MANIKPUR,9410507201,G.G.I.C. MANIKPUR,288,252,0,288,0,252,100.0,100.0,100.0,100.0,Girls Only School,Stable,False
CHITRAKOOT,MANIKPUR,9410504607,GOVT. HIGH SCHOOL BADI MADAIYAN,103,82,56,47,29,53,45.6,51.5,60.2,64.6,Slightly Girls Heavy,Moving to Girls Dominant,False
CHITRAKOOT,MANIKPUR,9410504704,GOVT. HIGH SCHOOL DADARI MAFI,59,80,34,25,45,35,42.4,46.8,35.0,43.7,Slightly Boys Heavy,Stable,False
CHITRAKOOT,MANIKPUR,9410506109,GOVT. HIGH SCHOOL ELHA,19,35,13,6,19,16,31.6,66.7,48.4,45.7,Balanced,Moving to Girls Dominant,False
CHITRAKOOT,MANIKPUR,9410500910,GOVT. HIGH SCHOOL ETAWA DUDAILA,122,77,67,55,38,39,45.1,50.4,59.3,50.6,Balanced,Stable,False
CHITRAKOOT,MANIKPUR,9410500113,PT DEEN DAYAL UPADHYAY GOVT MODEL I C UNCHADEEH CHITRAKOOT,308,300,155,153,174,126,49.7,44.0,45.8,42.0,Slightly Boys Heavy,Stable,False
CHITRAKOOT,MAU,9410304106,G.I.C. BARGARH,1109,1077,575,534,521,556,48.2,49.0,51.5,51.6,Balanced,Stable,False
CHITRAKOOT,MAU,9410304009,GOVT. HIGH SCHOOL BIYAWAL,123,119,66,57,64,55,46.3,51.5,57.3,46.2,Balanced,Stable,False
CHITRAKOOT,MAU,9410300503,GOVT. HIGH SCHOOL MANDAUR,116,147,57,59,68,79,50.9,43.2,50.8,53.7,Balanced,Stable,False
CHITRAKOOT,MAU,9410304803,GOVT. HIGH SCHOOL MURKA,71,53,26,45,19,34,63.4,57.4,67.2,64.1,Slightly Girls Heavy,Stable,False
CHITRAKOOT,MAU,9410302604,GOVT. HIGH SCHOOL TIKARA,60,97,29,31,44,53,51.7,39.6,43.9,54.6,Balanced,Stable,False
CHITRAKOOT,MAU,9410305004,PT DEEN DAYAL UPADHYAY GOVT MODEL I C HARDI KALA CHITRAKOOT,150,220,72,78,130,90,52.0,53.6,48.1,40.9,Slightly Boys Heavy,Moving to Boys Dominant,True
CHITRAKOOT,PAHADI,9410207501,GOVT. HIGH SCHOOL ASHOH,138,141,67,71,62,79,51.4,56.1,59.5,56.0,Slightly Girls Heavy,Stable,False
CHITRAKOOT,PAHADI,9410200304,GOVT. HIGH SCHOOL CHANDI,104,169,67,37,84,85,35.6,45.4,52.6,50.3,Balanced,Moving to Girls Dominant,False
CHITRAKOOT,PAHADI,9410205101,GOVT. HIGH SCHOOL GAUHANI,51,52,19,32,8,44,62.7,80.5,84.8,84.6,Girls Dominated,Moving to Girls Dominant,False
CHITRAKOOT,PAHADI,9410203801,GOVT. HIGH SCHOOL MAMSI BUJURGA,74,63,38,36,54,9,48.6,45.5,23.7,14.3,Boys Dominated,Moving to Boys Dominant,True
CHITRAKOOT,PAHADI,9410202505,GOVT. HIGH SCHOOL MIRJAPUR,81,90,30,51,42,48,63.0,52.5,46.5,53.3,Balanced,Stable,False
CHITRAKOOT,PAHADI,9410206505,GOVT. HIGH SCHOOL NONAR,41,66,19,22,25,41,53.7,59.6,64.9,62.1,Slightly Girls Heavy,Stable,False
CHITRAKOOT,PAHADI,9410202404,GOVT. HIGH SCHOOL SURSEN,100,105,49,51,45,60,51.0,55.9,57.8,57.1,Slightly Girls Heavy,Stable,False
CHITRAKOOT,PAHADI,9410205407,RAJKIYA KANYA UCHCHATAR MADHYAMIK VIDYALYA GANEEWA CHITRAKOOT,32,50,0,32,0,50,100.0,100.0,100.0,100.0,Girls Only School,Stable,False
CHITRAKOOT,PAHADI,9410202022,SAMAJWADI ABHINAV VIDYALAYA SARDHUWA,77,113,63,14,77,36,18.2,24.8,30.6,31.9,Slightly Boys Heavy,Moving to Girls Dominant,False
CHITRAKOOT,RAM NAGAR,9410403909,G.G.I.C. RAJAPUR,673,656,0,673,0,656,100.0,100.0,100.0,100.0,Girls Only School,Stable,False
CHITRAKOOT,RAM NAGAR,9410401803,GOVT. HIGH SCHOOL SIRAWAL,144,126,79,65,62,64,45.1,48.1,52.1,50.8,Balanced,Stable,False
DEORIA,BARAHAJ,9601701602,R.U.M.V. BADKA GAON,75,123,23,52,58,65,69.3,70.9,58.3,52.8,Balanced,Moving to Boys Dominant,True
DEORIA,BARAHAJ,9601703905,RAJKIY U.M.V.LABAKANI GANGA,119,73,73,46,23,50,38.7,56.9,60.4,68.5,Slightly Girls Heavy,Moving to Girls Dominant,False
DEORIA,BARAHAJ,9601704611,RAJKIYA UMV PAINA,57,59,20,37,23,36,64.9,63.4,60.3,61.0,Slightly Girls Heavy,Stable,False
DEORIA,BHATNI,9600803917,RAJIYA U.M.V.BHARHE CHAURA,29,22,12,17,12,10,58.6,41.9,36.7,45.5,Balanced,Moving to Boys Dominant,True
DEORIA,DEORIA NAGAR KSHETRA,9601502902,GOVERMENT INTER COLLEGE DEORIA,1642,2110,1244,398,1361,749,24.2,29.1,34.5,35.5,Slightly Boys Heavy,Moving to Girls Dominant,False
DEORIA,DEORIA NAGAR KSHETRA,9601502903,KASTUEBA RAJKIY GIRLS INTER COLLEGE DEORIA,1177,1014,0,1177,0,1014,100.0,100.0,100.0,100.0,Girls Only School,Stable,False
DEORIA,DESAHI DEORIA,9601802206,PT DEEN DAYAL UPADHYAY I C TILA TALI DESAHI DEORIA DEORIA,49,252,27,22,157,95,44.9,28.7,36.4,37.7,Slightly Boys Heavy,Stable,False
DEORIA,GAURI BAZAR,9600108705,G.G.H.S. SCHOOL INDUPUR,244,207,0,244,0,207,100.0,100.0,100.0,100.0,Girls Only School,Stable,False
DEORIA,GAURI BAZAR,9600102903,RAJKIY U.M.V.BAGAPAR,23,53,12,11,20,33,47.8,58.8,71.2,62.3,Slightly Girls Heavy,Moving to Girls Dominant,False
DEORIA,GAURI BAZAR,9600109103,RAJKIY U.M.V.SAVANA  LAXMAN,102,80,46,56,27,53,54.9,66.7,66.2,66.2,Slightly Girls Heavy,Moving to Girls Dominant,False
DEORIA,LAR,9601404204,RAJKIY U.M.V.KUNDAULI,24,23,7,17,8,15,70.8,73.3,71.4,65.2,Slightly Girls Heavy,Stable,False
DEORIA,PATTHRDEVA,9600503905,GOVT.H.S.SCHOOL MALGHOT BIRAICHA,37,22,11,26,11,11,70.3,68.7,72.0,50.0,Balanced,Moving to Boys Dominant,True
DEORIA,PATTHRDEVA,9600503804,R .UMV RAMPUR MAHUARI,114,47,57,57,23,24,50.0,51.1,54.1,51.1,Balanced,Stable,False
DEORIA,RUDRAPUR,9600706504,RAJKIY U.M.V.SILHATA,33,51,21,12,21,30,36.4,50.0,56.0,58.8,Slightly Girls Heavy,Moving to Girls Dominant,False
DEORIA,RUDRAPUR,9600701103,RAJKIYA U.M.V.GONAH SURTPURA,13,11,5,8,6,5,61.5,64.3,42.9,45.5,Balanced,Moving to Boys Dominant,True
DEORIA,RUDRAPUR,9600700903,RAJKIYA U.M.V.NAKAEL,95,92,52,43,53,39,45.3,49.5,48.4,42.4,Slightly Boys Heavy,Stable,False
DEORIA,SALIMPUR,9600405612,GOVT. G. INTER COLLEGE,14,11,0,14,0,11,100.0,100.0,100.0,100.0,Girls Only School,Stable,False
ETAH,ALIGANJ,9170111309,CHAMPADEVI G.G.I.C. RAJA KA RAMPUR,483,458,0,483,1,457,100.0,100.0,100.0,99.8,Girls Only School,Stable,False
ETAH,ALIGANJ,9170102704,GOVERNMENT HIGH SCHOOL M.NAGAR BAJHERA,37,49,15,22,17,32,59.5,77.3,65.2,65.3,Slightly Girls Heavy,Stable,False
ETAH,ALIGANJ,9170102705,PANDIT DEEN DAYAL UPADHYAY GOVT MODEL INTER COLLEGE M NAGAR BAJHERA ETAH,29,75,15,14,40,35,48.3,33.3,46.6,46.7,Balanced,Stable,False
ETAH,AWAGARH,9170306407,GOVERNMENT HSS KUSAWA,80,50,35,45,29,21,56.2,50.6,34.0,42.0,Slightly Boys Heavy,Moving to Boys Dominant,True
ETAH,AWAGARH,9170307510,"GOVT. HIGH SCHOOL, KUSET",29,51,8,21,18,33,72.4,44.0,50.0,64.7,Slightly Girls Heavy,Stable,False
ETAH,AWAGARH,9170305106,PANDIT DEEN DAYAL UPADHYAY GOVT MODEL INTER COLLEGE ISAULI ETAH,174,241,92,82,127,114,47.1,49.0,48.0,47.3,Balanced,Stable,False
ETAH,ETAH (URBAN),9171602102,GOV. GIRLS INTER COLEEGE ETAH,902,591,0,902,0,591,100.0,100.0,100.0,100.0,Girls Only School,Stable,False
ETAH,ETAH (URBAN),9171602303,GOV. INTER COLLEGE ETAH,433,373,433,0,349,24,0.0,0.5,3.8,6.4,Boys Dominated,Stable,True
ETAH,JAITHARA,9170504504,GOVERNMENT HIGH SCHOOL LALPUR JAHANGIRABAD,30,22,10,20,12,10,66.7,100.0,85.7,45.5,Balanced,Moving to Boys Dominant,True
ETAH,JAITHARA,9170509104,GOVT INTER COLLEGE AMRATPUR RAGHUPUR JAITHRA,35,184,14,21,65,119,60.0,57.1,60.6,64.7,Slightly Girls Heavy,Stable,False
ETAH,JAITHARA,9170503009,PANDIT DEEN DAYAL UPADHYAY GOVT MODEL INTER COLLEGE MUIUDDINPUR ETAH,63,87,19,44,23,64,69.8,70.9,67.3,73.6,Slightly Girls Heavy,Stable,False
ETAH,JALESAR,9170605204,GOVERNMENT HIGHSCHOOL MAHANMAI,106,81,44,62,31,50,58.5,60.6,60.5,61.7,Slightly Girls Heavy,Stable,False
ETAH,JALESAR (URBAN),9171801702,RAJKIYA BALIKA INTER COLLAGE,818,690,0,818,3,687,100.0,100.0,99.9,99.6,Girls Only School,Stable,False
ETAH,MARHARA,9170807903,GOVT H.S NAGLA MANDHATI (SARNU),47,53,27,20,27,26,42.6,59.0,46.3,49.1,Balanced,Stable,False
ETAH,MARHARA,9170806803,GOVT H.S.V ALAMPUR,67,60,28,39,22,38,58.2,54.7,62.5,63.3,Slightly Girls Heavy,Stable,False
ETAH,NIDHAULI KALAN,9170906602,G.G.I. COLLEGE BAKALPUR,196,218,0,196,0,218,100.0,99.5,100.0,100.0,Girls Only School,Stable,False
ETAH,NIDHAULI KALAN,9170908304,GOVERNMENT GIRLS INTER COLLEGE RAM NAGAR,79,71,0,79,0,71,100.0,100.0,100.0,100.0,Girls Only School,Stable,False
ETAH,NIDHAULI KALAN,9170900504,GOVERNMENT HSS ADHAPURA,37,52,16,21,26,26,56.8,63.6,60.0,50.0,Balanced,Stable,False
ETAH,NIDHAULI KALAN,9170907404,GOVERNMENT HSS SHAH BAJPUR,25,51,15,10,27,24,40.0,39.1,33.3,47.1,Balanced,Stable,False
ETAH,NIDHAULI KALAN,9170907704,PANDIT DEEN DAYAL UPADHYAY GOVT MODEL INTER COLLEGE GAHARANA ETAH,139,236,69,70,130,106,50.4,52.5,49.5,44.9,Slightly Boys Heavy,Stable,False
ETAH,SAKEET,9171203106,"GOVT. HIGH SCHOOL, RIJOR",60,66,29,31,29,37,51.7,66.7,70.6,56.1,Slightly Girls Heavy,Stable,False
ETAH,SAKEET,9171207019,PANDIT DEEN DAYAL UPADHYAY GOVT MODEL INTER COLLEGE MALAWAN ETAH,99,157,50,49,85,72,49.5,52.4,49.3,45.9,Balanced,Stable,False
ETAH,SHEETAL PUR,9171314101,GOV.GIRLS INTER COLLEGE,91,122,0,91,0,122,100.0,100.0,100.0,100.0,Girls Only School,Stable,False
ETAH,SHEETAL PUR,9171313404,GOVERNMENT HIGH SCHOOL KASON NIJAMPUR,76,73,27,49,19,54,64.5,49.2,53.0,74.0,Slightly Girls Heavy,Stable,False
ETAH,SHEETAL PUR,9171300114,PANDIT DEEN DAYAL UPADHYAY GOVT MODEL INTER COLLEGE JIRSIMI ETAH,294,414,170,124,190,224,42.2,44.7,49.4,54.1,Balanced,Moving to Girls Dominant,False
ETAWAH,BARHPURA,9310500108,GOVT GIRLS INTER COLLEGE UDDI,342,287,0,342,0,287,100.0,100.0,100.0,100.0,Girls Only School,Stable,False
ETAWAH,BHARTHANA,9310702406,GOVT UMV SAMASPURA ETAWA,95,101,30,65,45,56,68.4,52.4,46.7,55.4,Slightly Girls Heavy,Moving to Boys Dominant,True
ETAWAH,CHAKARNAGAR,9310800118,GOVT HIGH SCHOOL KANDESI DHAR,31,52,14,17,24,28,54.8,47.1,47.4,53.8,Balanced,Stable,False
ETAWAH,CHAKARNAGAR,9310800130,GOVT UMV IMLIA,57,60,26,31,27,33,54.4,36.4,56.9,55.0,Balanced,Stable,False
ETAWAH,CHAKARNAGAR,9310800120,GOVT UPS JAUNANI,63,53,36,27,26,27,42.9,39.1,40.0,50.9,Balanced,Stable,False
ETAWAH,CHAKARNAGAR,9310805804,GOVT.  INTER COLLEGE SINDAUS,154,171,78,76,68,103,49.4,53.6,55.1,60.2,Slightly Girls Heavy,Moving to Girls Dominant,False
ETAWAH,CHAKARNAGAR,9310800116,GOVT. GIRLS INTER COLLEGE CHAKARNAGAR,309,303,0,309,0,303,100.0,100.0,100.0,100.0,Girls Only School,Stable,False
ETAWAH,CHAKARNAGAR,9310804607,GOVT. HIGHER SECONDARY SCHOOL,257,288,198,59,194,94,23.0,24.7,30.4,32.6,Slightly Boys Heavy,Stable,False
ETAWAH,ETAWAH NAGAR CHETRA,9310903242,GOVT INTER COLLEGE ETAWAH,1481,984,1344,137,977,7,9.3,9.2,5.3,0.7,Boys Only School,Stable,True
ETAWAH,ETAWAH NAGAR CHETRA,9310907904,GOVT. GIRLS INTER COLLEGE,1642,1447,0,1642,0,1447,100.0,100.0,100.0,100.0,Girls Only School,Stable,False
ETAWAH,JASWANT NAGAR,9310410922,GOVT GIRLS INTER COLLEGE JASWANT NAGAR,489,520,0,489,0,520,100.0,100.0,100.0,100.0,Girls Only School,Stable,False
ETAWAH,JASWANT NAGAR,9310410923,GOVT INTER COLLEGE DHARWAR ETAWAH,118,103,40,78,52,51,66.1,60.2,52.7,49.5,Balanced,Moving to Boys Dominant,True
ETAWAH,JASWANT NAGAR,9310410925,GOVT UPS BAUTH,55,65,30,25,27,38,45.5,45.5,56.0,58.5,Slightly Girls Heavy,Moving to Girls Dominant,False
ETAWAH,JASWANT NAGAR,9310410926,GOVT UPS BIBAMAU,50,71,34,16,31,40,32.0,46.3,52.4,56.3,Slightly Girls Heavy,Moving to Girls Dominant,False
ETAWAH,JASWANT NAGAR,9310401104,RAJIKIYA UCCATAR MADIMIK VIDHALYA  JASWANTNAGAR ,22,36,10,12,18,18,54.5,63.6,64.3,50.0,Balanced,Stable,False
ETAWAH,MAHEWA,9310201706,GOVT UMV LUDHIYANI,179,167,85,94,76,91,52.5,57.9,55.4,54.5,Balanced,Stable,False
ETAWAH,SAIFAI,9310601706,AMITAB BACHCHAN GOVT. INTER COLLEGE SAIFAI,146,136,144,2,136,0,1.4,0.0,0.0,0.0,Boys Only School,Stable,True
ETAWAH,SAIFAI,9310601722,GOVT GIRLS INTER COLLEGE SAIFAI,293,274,0,293,0,274,100.0,100.0,100.0,100.0,Girls Only School,Stable,False
ETAWAH,SAIFAI,9310601708,GOVT UPS HARCHANDERPUR,67,111,41,26,48,63,38.8,45.1,50.0,56.8,Slightly Girls Heavy,Moving to Girls Dominant,False
ETAWAH,SAIFAI,9310601707,GOVT UPS NAGARIYA KUKPUR,48,59,25,23,25,34,47.9,62.8,62.8,57.6,Slightly Girls Heavy,Stable,False
ETAWAH,TAKHA,9310105506,GOVT. HIGHER SECONDARYSCHOOL,99,99,37,62,45,54,62.6,58.9,51.2,54.5,Balanced,Stable,False
FAIZABAD,AMANIGANJ,9470103101,"GOVERNMENT BALIKA INTER COLLEGE, GAHNAG",45,100,0,45,0,100,100.0,100.0,100.0,100.0,Girls Only School,Stable,False
FAIZABAD,AMANIGANJ,9470109407,GOVERNMENT HIGH SCHOOL MANUDEEH,128,90,48,80,31,59,62.5,62.7,70.0,65.6,Slightly Girls Heavy,Stable,False
FAIZABAD,AMANIGANJ,9470103603,GOVT GIRLS HIGHER SECONDARY SCHOOL,26,43,1,25,0,43,96.2,94.7,100.0,100.0,Girls Only School,Stable,False
FAIZABAD,AYODHYA TOWN AREA,9471502405,"GGIC, FAIZABAD",1084,894,0,1084,0,894,100.0,100.0,100.0,100.0,Girls Only School,Stable,False
FAIZABAD,AYODHYA TOWN AREA,9471501703,"RAJKIYA INTER COLLEGE, FAIZABAD",759,556,755,4,556,0,0.5,0.7,0.5,0.0,Boys Only School,Stable,True
FAIZABAD,AYODHYA TOWN AREA,9471300102,TULSI G.G.I.C. AYODHYA,479,372,0,479,0,372,100.0,100.0,100.0,100.0,Girls Only School,Stable,False
FAIZABAD,BIKAPUR,9470200402,GOVERNMENT HIGH SCHOOL PURE NANDA TIWARI,67,84,26,41,34,50,61.2,52.9,56.0,59.5,Slightly Girls Heavy,Stable,False
FAIZABAD,BIKAPUR,9470205405,GOVT.GIRLS HIGHER SEC. SCHOOL,90,105,0,90,0,105,100.0,100.0,100.0,100.0,Girls Only School,Stable,False
FAIZABAD,MASAUDHA,9470401503,GGIC GAUHANIYA,413,305,0,413,0,305,100.0,100.0,100.0,100.0,Girls Only School,Stable,False
FAIZABAD,MAWAI,9470609301,GOVERENMENT HIGHER SECONDARY SCHOOL,63,82,33,30,35,47,47.6,54.5,52.3,57.3,Slightly Girls Heavy,Stable,False
FAIZABAD,MAWAI,9470607608,GOVT INTER COLLEGE SUNBA MAWAI AYODHYA,51,272,31,20,116,156,39.2,40.0,53.1,57.4,Slightly Girls Heavy,Moving to Girls Dominant,False
FAIZABAD,MAYA,9470711203,GOVERNMENT HIGH SCHOOL SCHOOL,21,28,10,11,9,19,52.4,59.3,55.6,67.9,Slightly Girls Heavy,Moving to Girls Dominant,False
FAIZABAD,MAYA,9470706504,"GOVERNMENT HIGHER SECONDARY SCHOOL, BENWA",48,101,18,30,49,52,62.5,59.5,60.7,51.5,Balanced,Moving to Boys Dominant,True
FAIZABAD,MAYA,9470713301,"GOVERNMENT HIGHER SECONDARY SCHOOL, HARDI",32,47,18,14,25,22,43.7,45.8,63.6,46.8,Balanced,Stable,False
FAIZABAD,MAYA,9471400204,RAJKIYA BALIKA INTER COLLEGE,115,74,0,115,0,74,100.0,100.0,100.0,100.0,Girls Only School,Stable,False
FAIZABAD,MILKIPUR,9471201503,GOVERNMENT  SECONDARY SCHOOL KAHUA,69,76,34,35,35,41,50.7,48.3,47.1,53.9,Balanced,Stable,False
FAIZABAD,MILKIPUR,9471207202,GOVERNMENT SECONDARY SCHOOL GARHA,55,132,32,23,71,61,41.8,44.6,50.5,46.2,Balanced,Stable,False
FAIZABAD,MILKIPUR,9471205909,GOVT INTER COLLEGE TAKSARA MILKIPUR AYODHYA,200,645,114,86,389,256,43.0,40.6,39.8,39.7,Slightly Boys Heavy,Stable,False
FAIZABAD,PURA,9470810609,GOVERNMENT HIGH SCHOOL BHADAULI,30,40,13,17,25,15,56.7,69.0,35.2,37.5,Slightly Boys Heavy,Moving to Boys Dominant,True
FAIZABAD,RUDAULI,9472302403,GOVERNMENT GIRLS INTER COLLEGE,463,722,0,463,1,721,100.0,100.0,99.8,99.9,Girls Only School,Stable,False
FAIZABAD,RUDAULI,9470910903,GOVERNMENT HIGH SCHOOL jamuniyamau,60,98,22,38,41,57,63.3,66.7,66.2,58.2,Slightly Girls Heavy,Stable,False
